title,link,description
Even isolated states like North Korea get COVID,https://www.dw.com/en/even-isolated-states-like-north-korea-get-covid/a-61790865?maca=en-rss-en-all-1573-rdf,Viruses don't respect national borders. Now even North Korea is dealing with COVID-19. We look at how countries fared by isolating fully in the pandemic.
What caused the lastest cryptocrash?,https://www.dw.com/en/what-caused-the-lastest-cryptocrash/a-61787326?maca=en-rss-en-all-1573-rdf,"Cryptocurrency investors fled from the risky asset after one of the most trusted coins, Terra, took a nosedive. A prolonged dip could destabilize emerging markets like El Salvador."
The perilous life of migratory birds,https://www.dw.com/en/the-perilous-life-of-migratory-birds/a-61710214?maca=en-rss-en-all-1573-rdf,"Climate change is making their journeys longer and harder, window panes and power lines are deadly obstacles, and hunters lie in wait with nets. But there is plenty we can do to help, not harm, our feathered friends."
Speak up! What your voice reveals about your character,https://www.dw.com/en/speak-up-what-your-voice-reveals-about-your-character/a-61733611?maca=en-rss-en-all-1573-rdf,"When we listen to a voice, we automatically connect it to the person's personality. But what does the voice actually say about a human's character?"
Astronomers produce first image of black hole at center of Milky Way,https://www.dw.com/en/astronomers-produce-first-image-of-black-hole-at-center-of-milky-way/a-61776464?maca=en-rss-en-all-1573-rdf,"Scientists theorize that ""supermassive black holes"" lie at the center of all galaxies, including our own. ""Sagittarius A*"" is orders of magnitude more dense than the sun but it's also quite some distance from Earth."
'Cost-of-living' crisis hits consumers as UK economy struggles with inflation,https://www.dw.com/en/cost-of-living-crisis-hits-consumers-as-uk-economy-struggles-with-inflation/a-61765236?maca=en-rss-en-all-1573-rdf,"A series of shocks have combined to send prices spiraling in the UK. Inflation is a global problem, but Boris Johnson's government is being accused of making things worse for consumers."
Africa's COVID-19 vaccine production line in jeopardy,https://www.dw.com/en/africa-s-covid-19-vaccine-production-line-in-jeopardy/a-61756730?maca=en-rss-en-all-1573-rdf,"A year ago, South Africa celebrated the opening of the continent's first COVID-19 vaccine production line. Now it's at risk of being shut down due to low demand."
Wildfires in Russia: Will war in Ukraine limit firefighting response?,https://www.dw.com/en/wildfires-in-russia-will-war-in-ukraine-limit-firefighting-response/a-61753044?maca=en-rss-en-all-1573-rdf,"The fire season has started early in Siberia, as drought and strong winds fuel blazes in its carbon-rich peat forests. But with Russian forces fighting in Ukraine, this year's emergency response could suffer."
Global warming: World has 50-50 chance of hitting 1.5C mark soon,https://www.dw.com/en/global-warming-world-has-50-50-chance-of-hitting-1-5c-mark-soon/a-61743456?maca=en-rss-en-all-1573-rdf,"The average global temperature could exceed 1.5 degrees Celsius above pre-industrial levels by 2026, UN meteorologists say. The threshold is one that international agreements are trying to prevent."
How devastating is a DDoS cyberattack?,https://www.dw.com/en/how-devastating-is-a-ddos-cyberattack/a-61748267?maca=en-rss-en-all-1573-rdf,"Last weekend, Russian hackers attacked several German government websites. These cyberattacks were seemingly harmless, much to the relief of the authorities. But many others are not so lucky."
How Lithuania is freeing itself from Russian energy,https://www.dw.com/en/how-lithuania-is-freeing-itself-from-russian-energy/a-61738474?maca=en-rss-en-all-1573-rdf,"A new pipeline is connecting the Baltic states with Poland, ergo with the entire European gas network. For Poland, it's been a lifesaver. For Lithuania, it's just one part of a much larger scheme."
Ultra-long-haul flights: Your body and mental health,https://www.dw.com/en/ultra-long-haul-flights-your-body-and-mental-health/a-61714702?maca=en-rss-en-all-1573-rdf,Qantas will offer non-stop ultra-long-haul flights from Australia to the US and Europe. How will the 20-hour flights affect your mental and physical health?
China's export growth slows sharply as zero-COVID rules hit economy,https://www.dw.com/en/china-s-export-growth-slows-sharply-as-zero-covid-rules-hit-economy/a-61731968?maca=en-rss-en-all-1573-rdf,"China's zero-COVID policies are beginning to severely hit the country's global export engine. Prolonged lockdowns led to particularly sluggish export growth in April, new figures show."
Why do humans eat so much meat?,https://www.dw.com/en/why-do-humans-eat-so-much-meat/a-60735141?maca=en-rss-en-all-1573-rdf,We know the current meat and dairy industry are harming our planet and that eating too much animal protein can even be bad for our health. So why do humans continue eating meat?
NashStore: Russia's alternative to the Google Play store,https://www.dw.com/en/nashstore-russia-s-alternative-to-the-google-play-store/a-61712657?maca=en-rss-en-all-1573-rdf,Google Play is restricted in Russia as part of Western sanctions over the invasion of Ukraine. A domestic alternative is set to launch soon after a testing phase.
Will surging energy prices derail reforms in oil-exporting Middle East?,https://www.dw.com/en/will-surging-energy-prices-derail-reforms-in-oil-exporting-middle-east/a-61675230?maca=en-rss-en-all-1573-rdf,The Ukraine war has seen energy prices spike with oil producers in the Middle East making more money than ever. But will it put the brakes on long-planned reforms to diversify oil-reliant economies in the region?
Racism in Germany is part of everyday life,https://www.dw.com/en/racism-in-germany-is-part-of-everyday-life/a-61700339?maca=en-rss-en-all-1573-rdf,"Most Germans recognize that racism exists in their society, affecting not only minorities but everybody who lives here. The country's first National Discrimination and Racism report has found some surprising results."
Think 8 hours of sleep is best? Think again!,https://www.dw.com/en/think-8-hours-of-sleep-is-best-think-again/a-61661946?maca=en-rss-en-all-1573-rdf,Are you 38 or older? Then you may want to rethink how much sleep you truly need. A team of international researchers has found that less is more.
Ukraine: How drones are changing the way of war,https://www.dw.com/en/ukraine-how-drones-are-changing-the-way-of-war/a-61681013?maca=en-rss-en-all-1573-rdf,The war in Ukraine shows that unmanned aerial vehicles are part of modern warfare. Drones have various tasks from aerial surveillance to missile defense.
German Overshoot Day: 'We cannot continue like this',https://www.dw.com/en/german-overshoot-day-we-cannot-continue-like-this/a-61673016?maca=en-rss-en-all-1573-rdf,Germany has used more resources in the first third of 2022 than are sustainably available to it for an entire year. Here's what needs to change.
COVID: Omicron subvariants 'escaping the previous immunity',https://www.dw.com/en/covid-omicron-subvariants-escaping-the-previous-immunity/a-61673415?maca=en-rss-en-all-1573-rdf,"You may be at risk of catching the new subvariants BA.4 or BA.5 even if you had the original omicron, virologist Alex Sigal told DW's Science Unscripted."
Breed accounts for less than 10% of a dog's behavior,https://www.dw.com/en/breed-accounts-for-less-than-10-of-a-dog-s-behavior/a-61634800?maca=en-rss-en-all-1573-rdf,"If you're looking for a dog with a specific personality, its breed will tell you less than the environment in which it is raised, a new study suggests."
Will an EU oil embargo put the lights out at Schwedt's refinery?,https://www.dw.com/en/will-an-eu-oil-embargo-put-the-lights-out-at-schwedt-s-refinery/a-61668807?maca=en-rss-en-all-1573-rdf,"As EU member states push for a Russian oil embargo, Germany's PCK Schwedt refinery is facing an uncertain future. It runs wholly on Russian imports, and many locals aren't so sure alternatives can be found in time."
Carbon farming: Climate change solution or greenwashing?,https://www.dw.com/en/carbon-farming-climate-change-solution-or-greenwashing/a-61532175?maca=en-rss-en-all-1573-rdf,European agriculture produces millions of tons of CO2 every year. Could encouraging farmers to capture carbon on their land to sell credits to businesses help reduce emissions?
Germans split over heavy weapons deliveries to Ukraine,https://www.dw.com/en/germans-split-over-heavy-weapons-deliveries-to-ukraine/a-61664515?maca=en-rss-en-all-1573-rdf,The German public is divided on the issue of military support for Ukraine. Many fear the delivery of tanks and training of Ukrainian soldiers in Germany may drag the country into the war.
Brazil dams: 1 million live close to danger,https://www.dw.com/en/brazil-dams-1-million-live-close-to-danger/a-61523548?maca=en-rss-en-all-1573-rdf,"Data analysis by DW reveals many Brazilians live near dams that, without proper maintenance and governmental oversight, could be deadly in the case of failure."
Swiping right on climate love: Dating apps and environmental advocacy,https://www.dw.com/en/swiping-right-on-climate-love-dating-apps-and-environmental-advocacy/a-61600741?maca=en-rss-en-all-1573-rdf,Dating platforms have noticed their users are hot for climate issues and are incorporating features to help them connect with each other. But how useful are additions like OkCupid's climate advocate badge?
Mars probe discovers 'shocking' new aurora,https://www.dw.com/en/mars-probe-discovers-shocking-new-aurora/a-61610851?maca=en-rss-en-all-1573-rdf,The Emirates Mars Mission says it's a first: They have spotted a worm-like aurora that stretches halfway round Mars. It looks like our northern lights.
Scientists sound alarm bells on noise pollution,https://www.dw.com/en/scientists-sound-alarm-bells-on-noise-pollution/a-61582252?maca=en-rss-en-all-1573-rdf,"The rumble of road traffic and trains, the bustle of the bar downstairs or the roar of a plane taking off – noise is a problem that is increasingly hurting health and disrupting ecosystems."
Beyond ecology: The trees at the heart of our culture,https://www.dw.com/en/beyond-ecology-the-trees-at-the-heart-of-our-culture/a-61554900?maca=en-rss-en-all-1573-rdf,"From Ireland to the Amazon to Kenya, trees can hold traditional or even sacred value. DW takes a look at trees and forests of cultural importance to communities around the world. Some are under threat."
Live Updates: Russia Moves to Annex Areas It Has Seized in Southeast Ukraine,https://www.nytimes.com/live/2022/05/19/world/russia-ukraine-war,"The territory occupied by Russian forces so far in the three-month-old invasion deserves “a worthy place in our Russian family,” a Kremlin official who toured the region said."
"Prince Charles and Camilla Visit Canada, Confronting Legacy of the Crown",https://www.nytimes.com/live/2022/05/19/world/prince-charles-canada-visit,"Prince Charles acknowledged the “suffering” of the Indigenous community in a visit to the Northwest Territories on the last day of his three-day tour of the country, where polls suggest there is little support for the monarchy."
How a Group of Female Independents Aims to Revive Australian Democracy,https://www.nytimes.com/2022/05/19/world/australia/federal-election-independents.html,"A community-driven movement has recruited around 25 candidates, most of them successful women preaching pragmatic reform. They could shape the balance of power after Saturday’s election."
"Hooked on Cheap Oil, Hungary Resists an Embargo on Russia",https://www.nytimes.com/2022/05/19/world/europe/hungary-russia-oil.html,Prime Minister Viktor Orban has promised voters to keep energy prices low. The dividends from taking Russian fuel also help fund the policies that have made Hungary a beacon for right-wing groups.
An Indian State Banned Alcohol. The Drinking Moved to Nearby Nepal.,https://www.nytimes.com/2022/05/19/world/asia/nepal-india-bihar-alcohol.html,"The ban in Bihar State, championed by local women, was aimed at tackling alcoholism and domestic violence. But a drinking scene has sprung up across the border in Nepal."
The 17th-Century English Judge Behind Abortion and Rape Rulings Today,https://www.nytimes.com/2022/05/19/world/asia/abortion-lord-matthew-hale.html,"Both in India and in the Roe v. Wade draft ruling roiling the United States, Lord Matthew Hale — an English judge who wrote that women were contractually obligated to husbands — still looms large."
"Israeli Government Loses Parliament Majority, Raising Prospect of Election",https://www.nytimes.com/2022/05/19/world/middleeast/israel-opposition-parliament-majority.html,"Increasing tensions between Israeli authorities and Palestinians have put pressure on the government, leading to the possibility of a fifth election in three years."
"In Ukraine, Gruesome Injuries and Not Enough Doctors to Treat Them",https://www.nytimes.com/2022/05/18/world/europe/ukraine-russia-war-doctors.html,"Operating with skeleton crews, doctors and nurses race to save limbs, and lives. It’s a grim routine for medical personnel often working around the clock. And not all limbs can be saved."
Japanese Man Gambles Away a Town’s Covid Funds,https://www.nytimes.com/2022/05/19/world/asia/japan-covid-relief-funds-gambler.html,"An official in the rural Japanese town wired the 24-year-old man nearly $360,000 by mistake. He lost it in online casinos. Now, the town is suing and he has been arrested."
"Around Kharkiv, Ukrainians Emerge to Find Lives in Ruin",https://www.nytimes.com/2022/05/18/world/europe/kharkiv-ukraine-russia-photos.html,"After sheltering underground since February, residents of the beseiged city have finally been able to to assess the damage the Russians left behind. The discoveries have been grisly."
Economic Headwinds Mount as Leaders Weigh Costs of Confronting Russia,https://www.nytimes.com/2022/05/18/us/politics/russia-finance-ministers-economy.html,Top economic officials are gathering this week to discuss how to keep pressure on Vladimir V. Putin without sinking their economies.
Strongmen in Turkey and Hungary Stall Unity in NATO and the E.U.,https://www.nytimes.com/2022/05/18/world/europe/sweden-finland-nato-turkey-oil.html,Russia benefits as Turkey slows down Swedish and Finnish applications to NATO and Hungary continues to block an E.U. embargo on Russian oil.
"Stop Picking Endangered Phallic Plant, Cambodia Warns",https://www.nytimes.com/2022/05/18/world/asia/cambodian-plant-video.html,"In Cambodia, video of women suggestively joking around with a protected carnivorous specimen prompted a government admonition: Hands off, people."
"With Gas Pumps All but Dry, Sri Lanka Faces Its ‘Most Difficult Time’",https://www.nytimes.com/2022/05/17/world/asia/sri-lanka-fuel-economic-crisis.html,The island nation’s new prime minister revealed that the country’s economic disaster was even worse than imagined.
Officials Report a Possible Monkeypox Case in New York,https://www.nytimes.com/2022/05/19/nyregion/monkeypox-case-ny.html,The patient is under care at Bellevue Hospital while further testing is conducted.
Russian Rock Singer Charged After Condemning the Ukraine War,https://www.nytimes.com/2022/05/19/world/europe/russian-rock-musician-charged.html,The singer made the comments less than three months after Russia enacted a law that would punish spreading “false information” about its invasion.
Prince Charles Dances With Indigenous People to End Canada Visit,https://www.nytimes.com/2022/05/19/world/prince-charles-indigenous-dene.html,"On the prince’s third and final day in Canada, he said he was “deeply moved’’ by the stories of those who survived brutal treatment in residential schools."
"Moscow Moves to Russify Seized Ukraine Land, Signaling Annexation",https://www.nytimes.com/2022/05/19/world/europe/moscow-russifying-captured-territory.html,"The territory occupied by Russian forces so far in the three-month-old invasion deserves “a worthy place in our Russian family,” a Kremlin official who toured the region said."
Biden Begins Trip to Asia Meant to Reassure Allies of Focus on China,https://www.nytimes.com/2022/05/19/us/politics/biden-trip-asia.html,"With the administration’s attention having shifted to Ukraine, President Biden plans to emphasize that the United States can counter aggression in both Europe and Asia."
Biden Seeks Swift Effort to Bring Finland and Sweden Into NATO,https://www.nytimes.com/2022/05/19/us/politics/biden-finland-sweden-nato.html,"Speedy approval seems likely among most members of the alliance in the wake of Russia’s invasion of Ukraine, but Turkey’s objections remain a sticking point."
Ukrainian Oligarch Mulls Selling Superyacht to Distance Himself From Russia,https://www.nytimes.com/2022/05/19/world/europe/ukrainian-oligarch-superyacht.html,The richest man in Ukraine has committed to building back his country. But he is also constructing a luxury ship that would rival a yacht that the U.S. government believes may belong to Vladimir Putin.
Russian Gymnast Who Wore Pro-War ‘Z’ Symbol on Podium Is Given One-Year Ban,https://www.nytimes.com/2022/05/19/world/russian-gymnast-z-medal.html,"The gymnast, Ivan Kuliak, wore the symbol while standing at the podium next to the Ukrainian gold medalist."
Your Friday Briefing: Russia Seeks More Control Over Occupied Ukraine,https://www.nytimes.com/2022/05/19/briefing/russia-ukraine-africa-hunger.html,Plus the war is causing hunger in Africa and the “teals” are looking to upend Australia’s elections.
New Evidence Shows How Russian Soldiers Executed Men in Bucha,https://www.nytimes.com/2022/05/19/world/europe/russia-bucha-ukraine-executions.html,"Witness testimony and videos obtained by The New York Times show how Russian paratroopers executed at least eight Ukrainian men in a Kyiv suburb on March 4, a potential war crime."
Navalny’s Team Lobbies Congress to Place More Sanctions on Putin’s Associates,https://www.nytimes.com/2022/05/19/world/putin-sanctions-aleksei-navalny.html,The activists are pitching sanctions on midlevel officials as a cost-free way for the United States to further isolate the Russian president.
A Russian Official Tours Occupied Southern Ukraine,https://www.nytimes.com/2022/05/19/world/russia-ukraine-kherson-zelensky.html,"The official, Marat Khusnullin, Russia’s deputy prime minister for infrastructure, outlined plans to take control of vital infrastructure."
"U.S. Ambassador to Ukraine, Bridget Brink, Has Experience Shaped By Soviet Domination",https://www.nytimes.com/2022/05/19/world/europe/ukraine-ambassador-bridget-brink.html,"Bridget Brink has worked in Slovakia, Uzbekistan and Georgia. She is filling a role that has been empty for three years."
The Senate Approves $40 Billion in New Aid to Ukraine,https://www.nytimes.com/2022/05/19/us/politics/senate-passes-ukraine-aid.html,"The measure’s smooth path through Congress reflected a broad consensus on Capitol Hill, for now, to devote massive sums to supporting Ukraine’s war effort with little debate."
Former German Chancellor Loses Perks Over Ties to Russia,https://www.nytimes.com/2022/05/19/world/europe/gerhard-schroder-russia.html,"The former German leader, a personal friend of President Vladimir V. Putin and lobbyist for Russian energy companies, has refused to distance himself from Russia."
Russian Soldier Who Pleaded Guilty at War Crimes Trial Apologizes,https://www.nytimes.com/2022/05/19/world/russian-soldier-trial-vadim-shishimarin.html,Sgt. Vadim Shishimarin says he was ordered to shoot at 62-year-old Oleksandr Shelipov because he and his fellow soldiers believed that he was informing the Ukrainian military about their location.
"Juan Carlos, Former King, Returns to Spain",https://www.nytimes.com/2022/05/19/world/europe/spain-king-juan-carlos.html,"The former monarch left his country in the wake of fraud investigations, which have since been dropped, and now lives in the United Arab Emirates."
Scientists Uncover a Shady Web of Online Spider Sales,https://www.nytimes.com/2022/05/19/science/spiders-tarantulas-arachnids-trade.html,"More than 1,200 species of arachnids are part of a largely unregulated global marketplace, according to a new study."
Livestreams of Mass Shootings: From Buffalo to New Zealand,https://www.nytimes.com/2022/05/19/technology/mass-shootings-livestream-online.html,"Dozens of recordings of a 2019 massacre in Christchurch, New Zealand, remain online, in a sobering reminder of the internet’s permanence."
"Chinese Hackers Tried to Steal Russian Defense Data, Report Says",https://www.nytimes.com/2022/05/19/world/asia/china-hackers-russia.html,"The campaign detailed by a cybersecurity firm highlights Beijing’s increasingly sophisticated tactics to spy on an array of targets, including countries it considers friends."
G7 Finance Ministers Race to Secure More Ukraine Aid,https://www.nytimes.com/2022/05/19/us/politics/ukraine-aid-g7.html,Officials are working on a plan to provide $15 billion to help keep Ukraine’s government operating during its war with Russia.
Boris Johnson Avoids Further Fines as the Police End Lockdown Inquiry,https://www.nytimes.com/2022/05/19/world/europe/uk-covid-lockdown-parties-boris-johnson.html,The completion of the investigation into parties at Downing Street that violated Covid rules lifts a cloud over the prime minister’s political future.
‘Wagatha Christie’ Case Offers a Riveting Peek Into Celebrity Culture,https://www.nytimes.com/2022/05/19/world/europe/wagatha-christie-rooney-vardy.html,Libel proceedings in London have laid bare the personal lives of two British celebrities in a legal whodunit for the social media age. And it wasn’t just the tabloids that became obsessed with the feud.
Coping With ‘Zero Covid’,https://www.nytimes.com/2022/05/19/briefing/zero-covid-china-pandemic.html,Our correspondent takes you inside Shanghai’s Covid lockdown.
"U.S. Eyeing Russian Energy Sanctions Over Ukraine War, Officials Say",https://www.nytimes.com/2022/05/19/us/politics/russia-ukraine-oil-sanctions.html,"The revenue powers Vladimir V. Putin’s war machine in Ukraine. But plans for new U.S. sanctions could create problems with China, India and other major buyers."
Your Thursday Briefing,https://www.nytimes.com/2022/05/19/briefing/nato-turkey-long-covid.html,Turkey’s efforts to delay Finland’s and Sweden’s NATO applications.
Russia Uses Surrender in Mariupol to Portray Ukrainians as Terrorists,https://www.nytimes.com/2022/05/18/world/europe/russia-ukraine-captives.html,"Many soldiers who surrendered from Mariupol’s Azovstal steel plant belong to the Azov battalion, a group with far-right roots, and the Kremlin may now put them on trial just as Ukraine is prosecuting Russians for war crimes."
Your Thursday Briefing: Turkey’s NATO Block,https://www.nytimes.com/2022/05/18/briefing/asia-ukraine-turkey-nato.html,Plus North Korea’s Covid strategy and China’s expanding internet censorship.
"The World Is as Vulnerable as Ever to Pandemics, an Expert Panel Concludes",https://www.nytimes.com/2022/05/18/world/global-pandemic-preparation.html,The authors of the new report zeroed in on the uneven distribution of vaccines around the world as one of the major hurdles to overcome.
Biden Endorses Finland and Sweden’s Bids to Join NATO,https://www.nytimes.com/2022/05/18/world/europe/finland-sweden-nato-us.html,"Mr. Biden’s pledge is far short of a treaty, or even an executive agreement committing the United States to come to the aid of both countries."
U.K. Lawmaker Reportedly Arrested Over Rape Allegations,https://www.nytimes.com/2022/05/18/world/europe/uk-mp-arrest-rape-allegations.html,"The arrest, of a man who has not yet been identified, was the latest in a string of sexual misconduct allegations against members of Parliament."
Russian Soldier Pleads Guilty in Kyiv to Violating ‘Laws and Customs of War’,https://www.nytimes.com/2022/05/18/world/europe/russian-soldier-war-crime-ukraine-law.html,"Sgt. Vadim Shyshimarin, 21, admitted in a Ukrainian court he had fatally shot a 62-year-old man on a bicycle in the village in the Sumy region in the early days of the invasion. He faces 10 years to life in prison."
John Fetterman: ‘Unfussy and Plain-Spoken’,https://www.nytimes.com/2022/05/18/briefing/john-fetterman-pennsylvania-primary.html,"John Fetterman, the Democratic Senate nominee in Pennsylvania, isn’t like most politicians in his party."
China-Style Covid Lockdowns Risk Deepening North Korean Crisis,https://www.nytimes.com/2022/05/18/world/asia/north-korea-covid-china.html,"As infections spread quickly, outside experts are warning that the country’s desire to mimic Beijing’s playbook could worsen a coming disaster."
Do Airline Offset Programs Really Reduce Your Carbon Footprint?,https://www.nytimes.com/2022/05/18/climate/offset-carbon-footprint-air-travel.html,"Carbon credits could eventually play an important role in fighting climate change, but right now a few dollars’ worth won’t change much."
"‘I could not stay away’: With Russians pushed back, residents return to Kharkiv.",https://www.nytimes.com/2022/05/18/world/europe/i-could-not-stay-away-with-russians-pushed-back-residents-return-to-kharkiv.html,
Labour asks if Conservatives broke U.K. election laws by accepting a donation linked to a Russian account.,https://www.nytimes.com/2022/05/18/world/europe/labour-asks-if-conservatives-broke-uk-election-laws-by-accepting-a-donation-linked-to-a-russian-account.html,
Your Wednesday Briefing,https://www.nytimes.com/2022/05/17/briefing/ukraine-mariupol-economy-northern-ireland.html,The surrender of Ukrainian forces in Mariupol.
