title,link,description
"Ukraine war: US fully backs Sweden and Finland Nato bids, Biden says",https://www.bbc.co.uk/news/world-us-canada-61511396?at_medium=RSS&at_campaign=KARANGA,Both countries submitted their applications to be part of the Western defence alliance this week.
Ukrainian widow confronts Russian soldier accused of killing her husband,https://www.bbc.co.uk/news/world-europe-61511640?at_medium=RSS&at_campaign=KARANGA,The 21-year-old serviceman has pled guilty to killing her husband in a village in Ukraine's north-east.
Ukraine war: One Russian's anti-war protest on the side of his shopping centre,https://www.bbc.co.uk/news/world-europe-61515365?at_medium=RSS&at_campaign=KARANGA,Dmitry Skurikhin has listed the Ukrainian towns attacked by Russia on the side of his shopping centre.
North Korea: Fighting Covid with traditional medicine,https://www.bbc.co.uk/news/61508440?at_medium=RSS&at_campaign=KARANGA,"As Covid spreads in North Korea, state media urges the use of traditional medicine against the virus."
Former Afghanistan official apologises for his role in the fall of the country,https://www.bbc.co.uk/news/world-asia-61516894?at_medium=RSS&at_campaign=KARANGA,Hamdullah Mohib fled the country along with the president the day the capital fell.
"Monkeypox cases investigated in Europe, US and Canada",https://www.bbc.co.uk/news/health-61506562?at_medium=RSS&at_campaign=KARANGA,"Cases of the rare disease are now confirmed in four European countries, health authorities say."
Vangelis: Chariots of Fire and Blade Runner composer dies at 79,https://www.bbc.co.uk/news/entertainment-arts-61514850?at_medium=RSS&at_campaign=KARANGA,"The Greek musician won an Oscar for the 1981 film theme, and also wrote the Blade Runner soundtrack."
Israeli coalition government in crisis as MP quits,https://www.bbc.co.uk/news/world-middle-east-61512656?at_medium=RSS&at_campaign=KARANGA,"An Arab member resigns in anger, leaving the government as a fragile minority for the first time."
Bush condemns Putin's invasion of 'Iraq' instead of Ukraine,https://www.bbc.co.uk/news/world-us-canada-61505050?at_medium=RSS&at_campaign=KARANGA,The former US president corrected himself after saying Putin had invaded Iraq rather than Ukraine.
Russian McDonald's buyer to rebrand restaurants,https://www.bbc.co.uk/news/business-61512255?at_medium=RSS&at_campaign=KARANGA,The fast food giant says the new owner of its 850 Russian restaurants will operate them under a new brand.
Nnamdi Kanu: Nigerian separatist allowed to watch Liverpool games on TV,https://www.bbc.co.uk/news/world-africa-61509984?at_medium=RSS&at_campaign=KARANGA,A Nigerian judge grants Nnamdi Kanu dispensation to watch the climax of his favourite team's season.
Women awarded damages over Japan exam discrimination,https://www.bbc.co.uk/news/world-asia-61506568?at_medium=RSS&at_campaign=KARANGA,Juntendo University in Tokyo set stricter requirements for female medical students in entrance exams.
Australia election 2022: Cost of living worries voters,https://www.bbc.co.uk/news/business-61483645?at_medium=RSS&at_campaign=KARANGA,"If interest rates keep rising 300,000 Australians may default on mortgage repayments."
Assam: The wild mushrooms killing India tea garden workers,https://www.bbc.co.uk/news/world-asia-india-61475397?at_medium=RSS&at_campaign=KARANGA,Workers in Assam's famed tea gardens are dying from eating wild mushrooms.
Australia election: Why is Australia's parliament so white?,https://www.bbc.co.uk/news/world-australia-61432762?at_medium=RSS&at_campaign=KARANGA,"Australia is a multicultural country, but critics say those representing the country don't reflect this."
Russia's laser weapon claim derided as propaganda,https://www.bbc.co.uk/news/world-europe-61508922?at_medium=RSS&at_campaign=KARANGA,"Moscow says it has destroyed a drone with a laser, but Kyiv says it can't mask battlefield failure."
I learned to sing using YouTube - and now it's my career,https://www.bbc.co.uk/news/uk-scotland-edinburgh-east-fife-61480033?at_medium=RSS&at_campaign=KARANGA,A holiday rep who was unable to sing teaches himself then scoops two music awards.
LGBTQ+ in Qatar: 'Waking up in fear every day is exhausting',https://www.bbc.co.uk/news/world-middle-east-61500137?at_medium=RSS&at_campaign=KARANGA,Fifa has said it will cancel the World Cup 2022 contracts of any hotel in Qatar that does not allow same-sex couples to stay.
Meet Gleb and Ukraine’s youth orchestra in exile in Slovenia,https://www.bbc.co.uk/news/world-europe-61300986?at_medium=RSS&at_campaign=KARANGA,A large group of talented young musicians and their families have been evacuated out of Ukraine into Slovenia.
Woman kidnapped as a child reunites with rescuer,https://www.bbc.co.uk/news/world-australia-61482700?at_medium=RSS&at_campaign=KARANGA,"Kathy Wrethman, from Australia, has finally come face-to-face with the man who saved her life."
China's silenced feminist: How Sophia Huang Xueqin went missing,https://www.bbc.co.uk/news/world-asia-china-61467135?at_medium=RSS&at_campaign=KARANGA,"BBC Eye investigates the disappearance of Sophia Huang Xueqin, a high-profile feminist journalist who kick-started China’s #MeToo movement."
Taylor Swift graduation speech: Embrace 'cringe',https://www.bbc.co.uk/news/world-us-canada-61502979?at_medium=RSS&at_campaign=KARANGA,New York University bestowed the renowned pop singer with an honorary degree.
"Canada to ban China's Huawei, ZTE from 5G networks",https://www.dw.com/en/canada-to-ban-china-s-huawei-zte-from-5g-networks/a-61870419?maca=en-rss-en-all-1573-rdf,Canada's government said it would ban the use of the two Chinese telecommunications giants' 5G gear due to national security concerns. The move follows similar bans in other Western countries.
Bundesliga playoff: Advantage Hamburg against Felix Magath and Hertha Berlin,https://www.dw.com/en/bundesliga-playoff-advantage-hamburg-against-felix-magath-and-hertha-berlin/a-61869764?maca=en-rss-en-all-1573-rdf,"Four years after their first ever relegation, Hamburg have one foot back in the Bundesliga. Ludovit Reis' looped goal was a fluke, but HSV won't care. Hertha Berlin and Felix Magath are edging towards relegation."
Spain: Exiled ex-King Juan Carlos returns for brief visit,https://www.dw.com/en/spain-exiled-ex-king-juan-carlos-returns-for-brief-visit/a-61845457?maca=en-rss-en-all-1573-rdf,"The former Spanish monarch has returned to the country after spending nearly two years in self-imposed exile in the UAE. He was set to visit his son, King Felipe VI, in Madrid."
Eco-fascism: The greenwashing of the far right,https://www.dw.com/en/eco-fascism-the-greenwashing-of-the-far-right/a-61867605?maca=en-rss-en-all-1573-rdf,White-supremacist killers are invoking environmental concerns to justify murder. But what is eco-fascism and why are people attracted to it?
"NATO: Joe Biden backs Sweden, Finland membership bid",https://www.dw.com/en/nato-joe-biden-backs-sweden-finland-membership-bid/a-61859523?maca=en-rss-en-all-1573-rdf,"Although Turkey has doubled down on blocking Sweden and Finland's membership bids, Western leaders have expressed confidence the proceedings will move quickly."
"Explained: The mysterious monkeypox outbreak in UK, Europe",https://www.dw.com/en/explained-the-mysterious-monkeypox-outbreak-in-uk-europe/a-61859359?maca=en-rss-en-all-1573-rdf,"The UK and other European countries have reported a small number of human monkeypox infections, a virus rarely seen in Europe. Health services remain puzzled over how the virus is transmitted."
US Senate approves $40 billion Ukraine aid package — live updates,https://www.dw.com/en/us-senate-approves-40-billion-ukraine-aid-package-live-updates/a-61845391?maca=en-rss-en-all-1573-rdf,"Meanwhile, the first Russian soldier to face trial for killing a civilian has asked the man's widow for ""forgiveness."" Ukrainian President Zelenskyy has warned of a long war. Follow DW for the latest."
"Russia 'weaponizes' food security, US tells UN meeting",https://www.dw.com/en/russia-weaponizes-food-security-us-tells-un-meeting/a-61865923?maca=en-rss-en-all-1573-rdf,"Washington's top diplomat has called on Russia to lift a blockade on Ukraine's Black Sea ports, while Russia's UN envoy said it was ""absolutely false"" that Moscow was blamed for global food insecurity."
G7: Germany pledges €1 billion in grants for Ukraine,https://www.dw.com/en/g7-germany-pledges-€1-billion-in-grants-for-ukraine/a-61868266?maca=en-rss-en-all-1573-rdf,"The influx of cash aims to support the financing of Ukraine's government, as Russia's war has decimated tax revenue. The grant is part of over €18 billion pledged by G7 finance ministers during their summit in Germany."
Thailand: What happened to mass anti-government protests?,https://www.dw.com/en/thailand-what-happened-to-mass-anti-government-protests/a-61861179?maca=en-rss-en-all-1573-rdf,"In 2020, Thai youth sparked the largest wave of anti-government protests since the 2014 military coup. But human rights activists say persecutions and systematic harassment have weakened the pro-democracy movement."
Herbal medicines that really work,https://www.dw.com/en/herbal-medicines-that-really-work/a-61865033?maca=en-rss-en-all-1573-rdf,Medicines have been extracted from plants for thousands of years and new ones are still being discovered. Here are several plant extracts with robust medical benefits.
Taliban orders female TV presenters to cover face on air,https://www.dw.com/en/taliban-orders-female-tv-presenters-to-cover-face-on-air/a-61859653?maca=en-rss-en-all-1573-rdf,The Taliban authorities in Afghanistan have issued an official order that female journalists must cover their faces on television. The move comes days after authorities ordered women to cover their faces in public.
Historian Christopher Clark to receive European media award,https://www.dw.com/en/historian-christopher-clark-to-receive-european-media-award/a-61832172?maca=en-rss-en-all-1573-rdf,The eminent historian and academic is being awarded the Charlemagne Award for his work on Anglo-German history. We take a look at his illustrious career.
Germany: Ex-Chancellor Schröder loses part of state privileges,https://www.dw.com/en/germany-ex-chancellor-schröder-loses-part-of-state-privileges/a-61843090?maca=en-rss-en-all-1573-rdf,"The former chancellor has come under heavy criticism for refusing to distance himself from Russia and Vladimir Putin. Now the German government is planning to take away his office and staff, without touching his pension."
Champions League: How Barcelona rose to challenge Lyon's dominance,https://www.dw.com/en/champions-league-how-barcelona-rose-to-challenge-lyon-s-dominance/a-61826930?maca=en-rss-en-all-1573-rdf,"Lyon dominated women's football in Europe for an entire decade. However, this year's Champions League final against Barcelona could mark a changing of the guard, one the Catalans have long prepared for."
Guinea-Bissau's political crisis deepens,https://www.dw.com/en/guinea-bissau-s-political-crisis-deepens/a-61853451?maca=en-rss-en-all-1573-rdf,Opposition parties and constitutional experts have slammed President Umaro Sissoco Embalo's decision to dissolve parliament. The move has heightened fears in the coup-prone West African nation.
European Parliament backs sanctions against Germany's ex-Chancellor Gerhard Schröder,https://www.dw.com/en/european-parliament-backs-sanctions-against-germany-s-ex-chancellor-gerhard-schröder/a-61853701?maca=en-rss-en-all-1573-rdf,The parliament has called for sanctions on former German Chancellor Gerhard Schröder because of his links to Russia.
UK: Police end inquiry into 'Partygate' scandal at Downing Street,https://www.dw.com/en/uk-police-end-inquiry-into-partygate-scandal-at-downing-street/a-61852967?maca=en-rss-en-all-1573-rdf,Police have ended an investigation into breaches of COVID lockdown rules that sparked outrage across the United Kingdom. Prime Minister Boris Johnson has not received any more fines.
"Asia security in focus as Biden visits South Korea, Japan",https://www.dw.com/en/asia-security-in-focus-as-biden-visits-south-korea-japan/a-61847610?maca=en-rss-en-all-1573-rdf,US President Joe Biden is aiming to boost ties with East Asian allies to face down a nuclear-armed North Korea and an increasingly expansionist China.
Germany: One person injured in a shooting incident at a high school,https://www.dw.com/en/germany-one-person-injured-in-a-shooting-incident-at-a-high-school/a-61847686?maca=en-rss-en-all-1573-rdf,"An armed suspect has been detained after one person was seriously injured in a shooting at a high school in the northern city of Bremerhaven, police said."
Germany: Dutch police arrest 3 over ATM bombings,https://www.dw.com/en/germany-dutch-police-arrest-3-over-atm-bombings/a-61847670?maca=en-rss-en-all-1573-rdf,Suspects believed to have stolen almost €1 million after bombing several ATMs across Germany have been arrested. The operation was the result of Dutch-German cooperation.
The Freiburg Way: 'A specific type of intelligence' and 'football for everyone',https://www.dw.com/en/the-freiburg-way-a-specific-type-of-intelligence-and-football-for-everyone/a-61844735?maca=en-rss-en-all-1573-rdf,"SC Freiburg will play RB Leipzig in their first ever German Cup final on Saturday. The two clubs are cut from very different cloth but, deep in the Black Forest, Freiburg are happy to continue on their own unique path."
"'Happy birthday, Mr. President' — famous birthday serenades",https://www.dw.com/en/happy-birthday-mr-president-famous-birthday-serenades/a-61837742?maca=en-rss-en-all-1573-rdf,"On this day 60 years ago, Marilyn Monroe famously serenaded John F. Kennedy for his birthday. But there are other legendary birthday songs."
One tiny company is wrecking the American solar industry – why?,https://www.dw.com/en/one-tiny-company-is-wrecking-the-american-solar-industry-why/a-61846726?maca=en-rss-en-all-1573-rdf,A small US solar panels manufacturer is pushing for high tariffs on imports. This threatens the Biden administration's climate goals and the industry as a whole.
US natural gas price spikes as demand from Europe grows,https://www.dw.com/en/us-natural-gas-price-spikes-as-demand-from-europe-grows/a-61830135?maca=en-rss-en-all-1573-rdf,"Natural gas prices in the United States have hit a 13-year high, partly due to Europe's demand for alternative energy sources in the wake of Russia's invasion of Ukraine."
Chancellor Olaf Scholz tells German parliament 'Russia must not win this war',https://www.dw.com/en/chancellor-olaf-scholz-tells-german-parliament-russia-must-not-win-this-war/a-61845874?maca=en-rss-en-all-1573-rdf,German Chancellor Olaf Scholz has delivered a statement to the German parliament ahead of an EU summit on the war in Ukraine. Scholz described the war in Ukraine as the greatest crisis facing the EU in its history.
Conference on diverse forms of global feminist protests,https://www.dw.com/en/conference-on-diverse-forms-of-global-feminist-protests/a-61840309?maca=en-rss-en-all-1573-rdf,"Violence against women is a global problem but women are successfully fighting back. The Goethe Institute's ""Frequencies. Sharing Feminisms"" festival shows how they do this."
Are European academics helping China's military?,https://www.dw.com/en/are-european-academics-helping-china-s-military/a-61834716?maca=en-rss-en-all-1573-rdf,"An investigation by DW and partners has found that European researchers have cooperated with China's National University of Defense Technology. The NUDT's purpose is to ""Strengthen the Armed Forces and the Nation."""
Europa League final: Frankfurt break glass ceiling as new era begins in Seville,https://www.dw.com/en/europa-league-final-frankfurt-break-glass-ceiling-as-new-era-begins-in-seville/a-61845456?maca=en-rss-en-all-1573-rdf,"After 42 years of waiting, Eintracht Frankfurt are continental champions again after a long, hot night in Seville. Around 40,000 ticketless Frankfurt fans made the journey on a night when a new Eintracht was born."
Shootout in Seville: Europa League glory for Eintracht Frankfurt after victory over Rangers,https://www.dw.com/en/shootout-in-seville-europa-league-glory-for-eintracht-frankfurt-after-victory-over-rangers/a-61844022?maca=en-rss-en-all-1573-rdf,Eintracht Frankfurt crowned a spectacular Europa League campaign by beating Rangers on penalties in the final in Seville. Goalkeeper Kevin Trapp was the hero with vital saves in extra time and in the shootout.
"Droughts, fires and floods: Could climate change decide Australia's election?",https://www.dw.com/en/droughts-fires-and-floods-could-climate-change-decide-australia-s-election/a-61821853?maca=en-rss-en-all-1573-rdf,"Australia, a major coal exporter and one of the worst per capita emitters, goes to the polls Saturday. The result could be decisive for global climate goals, as voters demand lawmakers do more to cut emissions."
Health tips: How to stay safe in a heat wave,https://www.dw.com/en/health-tips-how-to-stay-safe-in-a-heat-wave/a-61822226?maca=en-rss-en-all-1573-rdf,"Heat waves are common in India and Pakistan, but this year is hotter than ever before. Here's how to stay safe when temperatures soar."
Germans and sex: It's complicated,https://www.dw.com/en/germans-and-sex-it-s-complicated/a-53210116?maca=en-rss-en-all-1573-rdf,"How well do Germans do in bed? That's what Rachel Stewart asked a woman who should know. A conversation about the sexual needs of German women, the insecurity of men — and the evolution of the vibrator."
The dangers of app-based delivery work,https://www.dw.com/en/the-dangers-of-app-based-delivery-work/a-61786310?maca=en-rss-en-all-1573-rdf,"While new delivery startups boast about record investment earnings, many of their workers complain about tiring work, poor compensation and organizational issues. Paul Krantz reports from Berlin."
Carbon pollution pushed environmental breakdown to record levels in 2021,https://www.dw.com/en/carbon-pollution-pushed-environmental-breakdown-to-record-levels-in-2021/a-61831484?maca=en-rss-en-all-1573-rdf,"People have warped the climate so much that in 2021 four critical measures of planetary health broke records. Oceans grew hotter, higher and more acidic than ever documented, said the World Meteorological Organization."
NATO application puts Finland's Russian trade on thin ice,https://www.dw.com/en/nato-application-puts-finland-s-russian-trade-on-thin-ice/a-61829860?maca=en-rss-en-all-1573-rdf,"As Finland moves to join NATO, DW wonders how hard the economic impact of delinking economically with Russia could be. The other NATO wannabe, Sweden, has far less to worry about."
Ukraine war: Repatriated Pakistani students worry for their future,https://www.dw.com/en/ukraine-war-repatriated-pakistani-students-worry-for-their-future/a-61827198?maca=en-rss-en-all-1573-rdf,Hundreds of Pakistanis studying in Ukraine were brought home after Russia invaded the Eastern European country. Now they can neither go back nor find a place in local universities.
Donna Summer: 10th death anniversary of disco legend,https://www.dw.com/en/donna-summer-10th-death-anniversary-of-disco-legend/a-17334510?maca=en-rss-en-all-1573-rdf,"The sultry Queen of Disco, who during childhood moved churchgoers to tears with her gospel singing, succumbed to lung cancer 10 years ago today."
India: Will LIC stake sale trigger a big privatization push?,https://www.dw.com/en/india-will-lic-stake-sale-trigger-a-big-privatization-push/a-61821831?maca=en-rss-en-all-1573-rdf,India's largest insurer has made its debut on the stock market after Prime Minister Narendra Modi's government divested a small stake in it. But a big privatization drive in the near future appears unlikely.
Cannes opens with Ukraine's Zelenskyy as special guest,https://www.dw.com/en/cannes-opens-with-ukraine-s-zelenskyy-as-special-guest/a-61812363?maca=en-rss-en-all-1573-rdf,The 75th Cannes Film Festival has excluded all Russian participants except dissident director Kirill Serebrennikov.
Explainer: Northern Ireland Protocol continues to cast its shadow,https://www.dw.com/en/explainer-northern-ireland-protocol-continues-to-cast-its-shadow/a-61818901?maca=en-rss-en-all-1573-rdf,"On Tuesday, the UK government will announce planned legislation on the Northern Ireland Protocol that could end up killing its post-Brexit deal with the EU. A trade war could follow."
Lockdowns cripple Chinese economy,https://www.dw.com/en/lockdowns-cripple-chinese-economy/a-61817370?maca=en-rss-en-all-1573-rdf,"The Chinese economy is slowing down markedly as strict lockdowns send big cities into hibernation. Repercussions will be felt in Germany, too."
German state election leaves Chancellor Scholz reeling,https://www.dw.com/en/german-state-election-leaves-chancellor-scholz-reeling/a-61816748?maca=en-rss-en-all-1573-rdf,Chancellor Olaf Scholz is digesting a major defeat after his Social Democrats were comfortably beaten into second place in North Rhine-Westphalia. He now needs a favor from the surging Green Party.
COP15: Ivory Coast hosts desertification talks,https://www.dw.com/en/cop15-ivory-coast-hosts-desertification-talks/a-61815049?maca=en-rss-en-all-1573-rdf,"The COP15 conference is meeting to address issues of land degradation, advancing deserts and deforestation. Experts and activists hope that this will not be just another high-level conference with no concrete results."
Food security in space: Farming salad in moon soil,https://www.dw.com/en/food-security-in-space-farming-salad-in-moon-soil/a-61777814?maca=en-rss-en-all-1573-rdf,"Scientists have grown plants in soil taken from the lunar surface. It's a sign that people could one day live on the moon, grow food and produce water."
Cannes' first female president: Iris Knobloch,https://www.dw.com/en/cannes-first-female-president-iris-knobloch/a-61767004?maca=en-rss-en-all-1573-rdf,"German manager Iris Knobloch, a longtime Warner Bros. executive, could make the prestigious Cannes Film Festival more corporate and more American."
Russia looms large at EU-US trade and tech talks in Paris,https://www.dw.com/en/russia-looms-large-at-eu-us-trade-and-tech-talks-in-paris/a-61812879?maca=en-rss-en-all-1573-rdf,A trans-Atlantic forum meant to bring Washington and Brussels closer on digital and trade issues has switched gears to tackle global trade and supply chain disruptions sparked by Russia's ongoing aggression in Ukraine.
Ukrainian TikTok star Valeria Shashenok chronicles life during war,https://www.dw.com/en/ukrainian-tiktok-star-valeria-shashenok-chronicles-life-during-war/a-61811942?maca=en-rss-en-all-1573-rdf,"A 20-year-old TikTok artist, who made viral videos about life in an underground bomb shelter in Ukraine, has attracted more than 1 million followers."
Turkey witnesses bitcoin frenzy amid economic turmoil,https://www.dw.com/en/turkey-witnesses-bitcoin-frenzy-amid-economic-turmoil/a-61786507?maca=en-rss-en-all-1573-rdf,Cryptocurrency ownership is soaring in Turkey as high inflation and a weak lira prompt Turks to seek ways to preserve the value of their savings. Concerns rise about a fast-growing industry and legislation is overdue.
Women's Bundesliga: Why copy the men's model?,https://www.dw.com/en/women-s-bundesliga-why-copy-the-men-s-model/a-61810921?maca=en-rss-en-all-1573-rdf,"While 26 goals in six matches made for an entertaining 22nd and final matchday of the Bundesliga season, it also revealed glaring gaps in quality in the women's game. Here are five theses based on the season just gone."
Child labor on the rise in Africa,https://www.dw.com/en/child-labor-on-the-rise-in-africa/a-61772211?maca=en-rss-en-all-1573-rdf,"After years of child labor decline, the COVID pandemic has pushed many African children back to work. As a result, experts and children's rights activists are calling for stricter measures to protect them."
War in Ukraine: Tourism specialists relate their experiences,https://www.dw.com/en/war-in-ukraine-tourism-specialists-relate-their-experiences/a-61705114?maca=en-rss-en-all-1573-rdf,"After Russia's invasion of Ukraine on February 24, tourism activities ended abruptly and remain suspended indefinitely. Here are five stories from people working in tourism — with their hopes, fears and wishes."
Last show of Benin Bronzes in Cologne before their return,https://www.dw.com/en/last-show-of-benin-bronzes-in-cologne-before-their-return/a-61749285?maca=en-rss-en-all-1573-rdf,"Before the Benin Bronzes are restituted to Nigeria, the Rautenstrauch-Joest Museum is showing the works from its collection. Nigerian Ambassador Yusuf Tuggar hopes a return date will be found by June."
Eurovision Song Contest 2022: Ukraine wins the public's hearts,https://www.dw.com/en/eurovision-song-contest-2022-ukraine-wins-the-public-s-hearts/a-61788818?maca=en-rss-en-all-1573-rdf,"Europe's annual song and dance extravaganza wasn't short on either entertainment or pyrotechnics, but voting remained nail-biting until the end."
Opinion: The Bundesliga is going stale,https://www.dw.com/en/opinion-the-bundesliga-is-going-stale/a-61747588?maca=en-rss-en-all-1573-rdf,"Another Bundesliga season is over and with it comes a very familiar feeling. For DW's Jonathan Harding, the 2021/22 campaign is a reminder that the Bundesliga is need of something fresh."
Are we flushing away the answer to our fertilizer shortages?,https://www.dw.com/en/are-we-flushing-away-the-answer-to-our-fertilizer-shortages/a-61737037?maca=en-rss-en-all-1573-rdf,All eyes are on our food systems as the Russia-Ukraine war further pushes up fertilizer prices. Scientists think recycling our urine could be the solution to helping crops grow and strengthening food security.
