title,link,description
Ukrainian Holdouts in Mariupol Surrender to an Uncertain Fate,https://www.nytimes.com/2022/05/17/world/europe/ukraine-mariupol-fighters-surrender.html,"The government’s order for hundreds of remaining fighters to stand down offers Russia a propaganda victory, but prospects for a prisoner swap seem unclear at best."
Russian Hacking Cartel Attacks Costa Rican Government Agencies,https://www.nytimes.com/2022/05/17/us/politics/russia-hacking-costa-rica.html,"Experts who track the hackers’ actions said the group had recently begun to shift its focus to countries in Central and South America, perhaps as retaliation against nations that have supported Ukraine."
Biden Administration Offers Venezuela Minor Sanctions Relief,https://www.nytimes.com/2022/05/17/us/politics/us-venezuela-oil-sanctions.html,The Biden administration said it would relax restrictions on Chevron’s dealings with President Nicolás Maduro and remove sanctions from his relative.
"Your Wednesday Briefing: Sri Lanka, Out of Fuel",https://www.nytimes.com/2022/05/17/briefing/sri-lanka-gas-fuel-crisis-asia.html,"Plus lockdowns continue in Shanghai, and India’s community health workers press for a raise."
Europe Rethinks Its Reliance on Burning Wood for Electricity,https://www.nytimes.com/2022/05/17/climate/eu-burning-wood-electricity.html,"A new proposal would significantly rewrite E.U. rules on renewable energy, ending subsidies for biomass like wood pellets."
"Hezbollah Loses Majority Bloc in Lebanon Election, Results Show",https://www.nytimes.com/2022/05/17/world/middleeast/lebanon-election-hezbollah.html,"Voters drove out vital parliamentary allies of the militant faction, though not Hezbollah candidates themselves. A dozen new independents won seats."
