title,link,description
Ukraine war: Dozens feared dead after bomb hits school,https://www.bbc.co.uk/news/world-europe-61369229?at_medium=RSS&at_campaign=KARANGA,A Ukrainian official says 60 people may be dead after an air strike on a village school in Luhansk.
'We tried not to watch' - escapees recount terror of Russian-occupied Izyum,https://www.bbc.co.uk/news/world-europe-61354626?at_medium=RSS&at_campaign=KARANGA,Two women recall what happened when Russia took over a strategically-important city in the Donbas.
War in Ukraine: Zelensky WW2 speech accuses Russia of Nazi atrocities,https://www.bbc.co.uk/news/world-europe-61370906?at_medium=RSS&at_campaign=KARANGA,The Ukrainian leader compares Russia's invasion of his country to wartime Nazi bombings.
Ros Atkins on... Why 9 May matters to Russia,https://www.bbc.co.uk/news/world-europe-61328696?at_medium=RSS&at_campaign=KARANGA,Ros Atkins explains why Victory Day is such an important date in Russia.
Two held in manhunt for axe attackers who killed three Israelis,https://www.bbc.co.uk/news/world-middle-east-61370905?at_medium=RSS&at_campaign=KARANGA,Israeli police say the Palestinians were found hiding in bush near Elad where the attack took place.
EasyJet to take out seats so it can fly with fewer crew,https://www.bbc.co.uk/news/business-61370175?at_medium=RSS&at_campaign=KARANGA,The airline plans to remove a row of seats so that it can fly with fewer cabin crew on board.
Sri Lanka: The protests unifying a nation where ethnic fault lines run deep,https://www.bbc.co.uk/news/world-asia-61373192?at_medium=RSS&at_campaign=KARANGA,Unprecedented protests in Colombo are unifying a nation where ethnic fault lines run deep.
Hong Kong's John Lee: Ex-security chief becomes new leader,https://www.bbc.co.uk/news/world-asia-china-61345463?at_medium=RSS&at_campaign=KARANGA,John Lee's appointment is being seen as a move by China to tighten its grip on the city.
New Mexico wildfire: Huge blaze could worsen this weekend,https://www.bbc.co.uk/news/world-latin-america-61367797?at_medium=RSS&at_campaign=KARANGA,"""Historic"" extreme weather likely to stoke New Mexico fire, which is already the size of Chicago."
Kentucky Derby: 80-1 outsider Rich Strike pulls off historic upset,https://www.bbc.co.uk/news/world-us-canada-61367800?at_medium=RSS&at_campaign=KARANGA,"Rich Strike, a 80-1 outsider, won the race despite only being brought in after a horse dropped out."
UK YouTuber Benjamin Rich quizzed and fined at Russian space centre,https://www.bbc.co.uk/news/uk-61373057?at_medium=RSS&at_campaign=KARANGA,Bald and Bankrupt vlogger Benjamin Rich says he was questioned by Russian police in Kazakhstan.
Brazil's Lula launches presidential campaign,https://www.bbc.co.uk/news/world-latin-america-61367119?at_medium=RSS&at_campaign=KARANGA,The former Brazilian president says he wants to unite the country and defend its democracy.
Ukraine war: Returning to the place my father was killed,https://www.bbc.co.uk/news/world-europe-61351772?at_medium=RSS&at_campaign=KARANGA,"As Vadim and his father tried to rescue their dogs, they were fired upon by a convoy they believe was Russian."
"Ukraine war: 'If this is true, then I am also a Nazi'",https://www.bbc.co.uk/news/world-europe-61361827?at_medium=RSS&at_campaign=KARANGA,Holocaust survivors in the Ukrainian city of Uman feel insulted by Russian claims to be fighting Nazis.
Viewpoint: Putin now faces only different kinds of defeat,https://www.bbc.co.uk/news/world-europe-61348287?at_medium=RSS&at_campaign=KARANGA,"Russia's Victory Day parade won't represent any sort of victory over Ukraine, writes defence analyst Michael Clarke."
KwaZulu-Natal floods: The South African family who lost nine children,https://www.bbc.co.uk/news/world-africa-61318783?at_medium=RSS&at_campaign=KARANGA,Mass funerals are held in South Africa after the country's most deadly natural disaster.
Philippines election: 'Politicians hire me to spread fake stories',https://www.bbc.co.uk/news/blogs-trending-61339293?at_medium=RSS&at_campaign=KARANGA,Voters in the Philippines presidential election are facing an onslaught of online lies.
Fergal Keane: How I found a way to live with PTSD,https://www.bbc.co.uk/news/world-61350174?at_medium=RSS&at_campaign=KARANGA,"The BBC correspondent, who was diagnosed with PTSD in 2008, explores the effects of the condition and how it can be treated."
"Who is Alina Kabaeva, Putin's alleged girlfriend?",https://www.bbc.co.uk/news/world-europe-61353020?at_medium=RSS&at_campaign=KARANGA,"The EU is proposing to sanction Alina Kabaeva, an ex-gymnast turned media boss close to President Vladimir Putin."
Ukraine war: Bono sings with soldier in Kyiv metro station,https://www.bbc.co.uk/news/world-europe-61373349?at_medium=RSS&at_campaign=KARANGA,The U2 frontman was seen singing at a downtown metro station covering the hit track Stand by Me.
Ukraine war: Rebuilt Kyiv railway bridge a symbol of hope,https://www.bbc.co.uk/news/world-europe-61365365?at_medium=RSS&at_campaign=KARANGA,"A railway bridge close to Kyiv has been rebuilt, just a month after it was destroyed by Russian attacks."
The return of California's butterflies,https://www.bbc.co.uk/news/stories-61338799?at_medium=RSS&at_campaign=KARANGA,Efforts to protect these beautiful insects include driving electric tractors and hand-rearing them in a lab.
Acid attack survivors in Mexico: 'Justice is not enough',https://www.bbc.co.uk/news/world-latin-america-61346864?at_medium=RSS&at_campaign=KARANGA,Carmen Sanchez launched her foundation in Mexico to help survivors of attacks rebuild their lives.
"Australia election: Welcome to Durack, a seat six times bigger than Britain",https://www.bbc.co.uk/news/world-australia-61317755?at_medium=RSS&at_campaign=KARANGA,"Australians head to the polls on 21 May - and in Durack, it means a massive logistical effort."
Scholz: Ukraine won't accept Russian dictatorship,https://www.dw.com/en/scholz-ukraine-won-t-accept-russian-dictatorship/a-61724145?maca=en-rss-en-all-1573-rdf,German Chancellor Olaf Scholz says he strongly believes Russia won't win its war in Ukraine. His remarks come as the conflict overshadows commemorations to mark the end of World War II in Europe.
Wolfsburg reclaim Women's Bundesliga in some style,https://www.dw.com/en/wolfsburg-reclaim-women-s-bundesliga-in-some-style/a-61726482?maca=en-rss-en-all-1573-rdf,"Bayern Munich wrestled the title from Wolfsburg last season, but the perennial women's Bundesliga champions have reclaimed it after a 10-1 win. Elsewhere Frankfurt are in good shape for Europe and Chelsea won the WSL."
Germany: CDU set to win Schleswig-Holstein state election,https://www.dw.com/en/germany-cdu-set-to-win-schleswig-holstein-state-election/a-61726509?maca=en-rss-en-all-1573-rdf,"The conservative CDU is on track for victory in the northern state of Schleswig-Holstein, forecasts from broadcasters ARD and ZDF show. The poll was seen as a test of Chancellor Olaf Scholz's response to the Ukraine war."
Syria's Bashar Assad pays rare visit to ally Iran,https://www.dw.com/en/syria-s-bashar-assad-pays-rare-visit-to-ally-iran/a-61725309?maca=en-rss-en-all-1573-rdf,Syrian President Bashar Assad has visited Iran for only the second time since the civil war broke out in his country. The two nations are united by their enmity toward Israel.
EU citizens are full of hope for the future of Europe,https://www.dw.com/en/eu-citizens-are-full-of-hope-for-the-future-of-europe/a-61697022?maca=en-rss-en-all-1573-rdf,A select group of citizens of the EU has gathered multiple times since last May to discuss what the bloc should look like in the years ahead. But implementing some of the ideas would mean overhauling how the EU works.
How Schalke 'reinvented' themselves to get back to the Bundesliga,https://www.dw.com/en/how-schalke-reinvented-themselves-to-get-back-to-the-bundesliga/a-61724384?maca=en-rss-en-all-1573-rdf,"One year ago, Schalke were relegated in a cloud of internal chaos and on the brink of insolvency. Twelve months later, the Royal Blues are back in the Bundesliga and on the long road to financial recovery."
Israel: 2 Palestinian suspects in Elad attack arrested,https://www.dw.com/en/israel-2-palestinian-suspects-in-elad-attack-arrested/a-61723450?maca=en-rss-en-all-1573-rdf,Israeli security forces say they have arrested two Palestinians suspected of carrying out a deadly attack in the town of Elad last week. The detentions come after a massive manhunt.
Ukraine war puts spotlight on Red Cross service to find missing people,https://www.dw.com/en/ukraine-war-puts-spotlight-on-red-cross-service-to-find-missing-people/a-61712712?maca=en-rss-en-all-1573-rdf,Wars and natural disasters tear families apart worldwide. The German Red Cross tries to put them back in touch.
Nepal: Sherpa Kami Rita breaks own Everest record,https://www.dw.com/en/nepal-sherpa-kami-rita-breaks-own-everest-record/a-61723031?maca=en-rss-en-all-1573-rdf,"The Nepalese Sherpa guide Kami Rita has scaled Mount Everest for the 26th time, setting a new world record. More than 300 people have died trying to conquer the world's highest peak."
Ukraine: G7 to impose fresh sanctions on Russia — live updates,https://www.dw.com/en/ukraine-g7-to-impose-fresh-sanctions-on-russia-live-updates/a-61721480?maca=en-rss-en-all-1573-rdf,"After talks with Ukrainian President Volodymyr Zelenskyy, leaders of the G7 nations pledged further economic isolation of Russia and vowed ""phasing out or banning"" Russian oil imports. Follow DW for the latest."
Europe's first samurai museum opens in Berlin,https://www.dw.com/en/europe-s-first-samurai-museum-opens-in-berlin/a-61704500?maca=en-rss-en-all-1573-rdf,"As a new museum on the samurai opens in Berlin, here are five facts about how the legendary warriors and political elite shaped the history of Japan for centuries"
Hong Kong: Ex-security chief John Lee named new leader,https://www.dw.com/en/hong-kong-ex-security-chief-john-lee-named-new-leader/a-61722783?maca=en-rss-en-all-1573-rdf,"An election committee composed largely of pro-Beijing figures voted for John Lee, a former security official, to be the new leader of Hong Kong. Lee, the only candidate in the vote, replaces Carrie Lam in July."
Benjamin Rich: British YouTuber denies reports of being arrested in Kazakhstan,https://www.dw.com/en/benjamin-rich-british-youtuber-denies-reports-of-being-arrested-in-kazakhstan/a-61720595?maca=en-rss-en-all-1573-rdf,"Benjamin Rich, a British national known for his YouTube travel blog, shot back at Russia's claim that he was arrested at the Baikonur Cosmodrome spaceport. Rich said he was only questioned for a few hours by authorities."
Germany: Police investigate device found at Russian news agency in Berlin,https://www.dw.com/en/germany-police-investigate-device-found-at-russian-news-agency-in-berlin/a-61720964?maca=en-rss-en-all-1573-rdf,"A device that was discovered Friday in the basement of Ria Novosti's office in Berlin's Steglitz district was ""probably incendiary,"" according to police. An investigation into the ""dangerous object"" is still ongoing."
Brazil: Lula launches presidential bid to overcome 'criminal' Bolsonaro,https://www.dw.com/en/brazil-lula-launches-presidential-bid-to-overcome-criminal-bolsonaro/a-61720499?maca=en-rss-en-all-1573-rdf,"Luiz Inacio Lula da Silva said he wanted to ""send fascism back to the sewer of history"" at a rally in Sao Paulo. He served as the 35th president of Brazil from 2003 to 2010."
"What Sinn Fein's win could mean for Northern Ireland, UK",https://www.dw.com/en/what-sinn-fein-s-win-could-mean-for-northern-ireland-uk/a-61720107?maca=en-rss-en-all-1573-rdf,"For the first time, a nationalist party has become the strongest party in the Northern Ireland Assembly. What does Sinn Fein stand for? And what could this result mean for the future?"
Northern Ireland: Sinn Fein secures historic election win,https://www.dw.com/en/northern-ireland-sinn-fein-secures-historic-election-win/a-61719108?maca=en-rss-en-all-1573-rdf,"The Irish nationalist party Sinn Fein vowed a ""new era"" as it won the most seats in the Assembly for the first time — a victory that could bring the party's ultimate goal of a united Ireland a step closer."
Bayer Leverkusen strategy pays off with Champions League return,https://www.dw.com/en/bayer-leverkusen-strategy-pays-off-with-champions-league-return/a-61719844?maca=en-rss-en-all-1573-rdf,Bayer Leverkusen will return to the Champions League next season after a three-year absence. They got over the line with a typically topsy-turvy win that highlighted the long-term strategy the club has employed.
Mysterious series of deaths among Russian oligarchs,https://www.dw.com/en/mysterious-series-of-deaths-among-russian-oligarchs/a-61719107?maca=en-rss-en-all-1573-rdf,"Seven Russian oligarchs, many involved with oil and gas, have recently died under mysterious circumstances. Though suicide is officially suspected, speculation about the Kremlin's involvement abounds."
Bundesliga: Arminia Bielefeld on the brink,https://www.dw.com/en/bundesliga-arminia-bielefeld-on-the-brink/a-61716065?maca=en-rss-en-all-1573-rdf,"Arminia Bielefeld waited 11 years to return to the Bundesliga, but their two-season stay in the top flight seems set to end after defeat by Bochum. Arminia, one of Germany's yo-yo clubs, will no doubt be back for more."
Victory Day in Europe: Ukraine war puts spotlight on Russia,https://www.dw.com/en/victory-day-in-europe-ukraine-war-puts-spotlight-on-russia/a-61713873?maca=en-rss-en-all-1573-rdf,VE-Day marks Nazi Germany's unconditional surrender in WW2. Russia celebrates it on May 9 and many fear Vladimir Putin may use the opportunity to mobilize his country for all out war.
Borussia Dortmund cancel Israel trip after concerns raised,https://www.dw.com/en/borussia-dortmund-cancel-israel-trip-after-concerns-raised/a-61690901?maca=en-rss-en-all-1573-rdf,The post-season trip has been called off after members of Borussia Dortmund's team raised concerns due to the Israeli-Palestinian conflict. The Bundesliga runners-up were due to play a friendly against Maccabi Netanya.
Watching Karl Lagerfeld's estate go under the hammer,https://www.dw.com/en/watching-karl-lagerfeld-s-estate-go-under-the-hammer/a-61703641?maca=en-rss-en-all-1573-rdf,"On the day Diego Maradona's football jersey fetched a record sum at Sotheby's London, DW's Brenda Haas went to the auction house's Cologne branch to watch her first auction."
COVID-19: Pandemic trends in three charts,https://www.dw.com/en/covid-19-pandemic-trends-in-three-charts/a-53954594?maca=en-rss-en-all-1573-rdf,Only a few countries are reporting more new coronavirus infections compared with the previous two weeks. DW sums up the global data on the current situation in three charts.
Eintracht Frankfurt daring to believe in Europa League dream,https://www.dw.com/en/eintracht-frankfurt-daring-to-believe-in-europa-league-dream/a-61703414?maca=en-rss-en-all-1573-rdf,Eintracht Frankfurt’s win over West Ham in the Europa League semifinals secured them a place in a first major final for 42 years. It’s about time this football club was introduced back to the continent’s biggest stage.
Germany's Fuggerei: The world's oldest social housing project,https://www.dw.com/en/germany-s-fuggerei-the-world-s-oldest-social-housing-project/a-58928076?maca=en-rss-en-all-1573-rdf,"Five hundred years after the Fuggerei estate was opened in Augsburg, the rents remain under €1, and diverse people facing financial hardship still have housing security."
Domenico Tedesco left to pick up the pieces following RB Leipzig's latest low,https://www.dw.com/en/domenico-tedesco-left-to-pick-up-the-pieces-following-rb-leipzig-s-latest-low/a-61701358?maca=en-rss-en-all-1573-rdf,"RB Leipzig's Europa League campaign crashed in Glasgow as Rangers won 3-1 to book their ticket to the final in Seville. For Leipzig coach Domenico Tedesco, it was another night to forget in a season going south."
Western companies leave Russia — taking Russian jobs with them,https://www.dw.com/en/western-companies-leave-russia-taking-russian-jobs-with-them/a-61697175?maca=en-rss-en-all-1573-rdf,"More and more Russians are losing their jobs due to Western sanctions on Russia, and some are having to painfully rethink their future. With some sanctions' effects yet to be felt, the number of unemployed could grow."
Think 8 hours of sleep is best? Think again!,https://www.dw.com/en/think-8-hours-of-sleep-is-best-think-again/a-61661946?maca=en-rss-en-all-1573-rdf,Are you 38 or older? Then you may want to rethink how much sleep you truly need. A team of international researchers has found that less is more.
5 things we can learn from Marlene Dietrich,https://www.dw.com/en/5-things-we-can-learn-from-marlene-dietrich/a-60195584?maca=en-rss-en-all-1573-rdf,"Marlene Dietrich died on May 6, 1992 — 30 years ago. She fled the Nazis and conquered Hollywood. She remains a role model in times of crisis."
Ukraine: How farm vehicles stolen by Russia were remotely disabled,https://www.dw.com/en/ukraine-how-farm-vehicles-stolen-by-russia-were-remotely-disabled/a-61691839?maca=en-rss-en-all-1573-rdf,"Russian soldiers looted combine harvesters and tractors worth millions of dollars from Ukraine, according to a media report. But the machinery was deactivated remotely before it could be put to use."
Bitcoin boom spikes amid perceived risks,https://www.dw.com/en/bitcoin-boom-spikes-amid-perceived-risks/a-61686615?maca=en-rss-en-all-1573-rdf,Central African Republic and El Salvador have made Bitcoin legal tender and Panama has approved a bill to regulate crypto assets. Experts warn that nations that adopt crypto currencies risk instability.
Documenta cancels talks amid antisemitism row,https://www.dw.com/en/documenta-cancels-talks-amid-antisemitism-row/a-61692036?maca=en-rss-en-all-1573-rdf,"The 2022 edition of the world-famous contemporary art show has suddenly axed discussions on the topic of artistic freedom, which had planned to address accusations of antisemitism."
New German open letter: 'Yes' to weapons for Ukraine,https://www.dw.com/en/new-german-open-letter-yes-to-weapons-for-ukraine/a-61692748?maca=en-rss-en-all-1573-rdf,"Pianist Igor Levit, Nobel laureate Herta Müller and 55 other intellectuals have sent an appeal to Chancellor Olaf Scholz. They say Germany should supply heavy weapons to Ukraine."
Germany plans documentation center on Nazi occupation in Europe,https://www.dw.com/en/germany-plans-documentation-center-on-nazi-occupation-in-europe/a-61690542?maca=en-rss-en-all-1573-rdf,"Almost 80 years after the end of the Second World War, the German government has approved a concept for a documentation center in Berlin. Its focus: the effects of the Nazi era in Europe."
What are millets and can they help create global food security?,https://www.dw.com/en/what-are-millets-and-can-they-help-create-global-food-security/a-61682721?maca=en-rss-en-all-1573-rdf,The Russian invasion of Ukraine has pushed food insecurity onto the table. Could an overlooked cereal help steady the situation and feed the global population in an era of climate crisis?
'Navalny' documentary hits theaters in Germany,https://www.dw.com/en/navalny-documentary-hits-theaters-in-germany/a-61683768?maca=en-rss-en-all-1573-rdf,"Being an outspoken enemy of the Kremlin nearly cost Alexei Navalny his life. In this documentary that feels like a spy thriller, Putin's rival uncovers the facts about his poisoning."
Ukraine: How drones are changing the way of war,https://www.dw.com/en/ukraine-how-drones-are-changing-the-way-of-war/a-61681013?maca=en-rss-en-all-1573-rdf,The war in Ukraine shows that unmanned aerial vehicles are part of modern warfare. Drones have various tasks from aerial surveillance to missile defense.
German Overshoot Day: 'We cannot continue like this',https://www.dw.com/en/german-overshoot-day-we-cannot-continue-like-this/a-61673016?maca=en-rss-en-all-1573-rdf,Germany has used more resources in the first third of 2022 than are sustainably available to it for an entire year. Here's what needs to change.
DW documentary 'Guardians of Truth' premieres in Berlin,https://www.dw.com/en/dw-documentary-guardians-of-truth-premieres-in-berlin/a-61683697?maca=en-rss-en-all-1573-rdf,Turkish journalist Can Dündar and Mexican investigative journalist Anabel Hernandez both live in exile. They share their stories in a new documentary and at the Berlin premiere.
COVID: Omicron subvariants 'escaping the previous immunity',https://www.dw.com/en/covid-omicron-subvariants-escaping-the-previous-immunity/a-61673415?maca=en-rss-en-all-1573-rdf,"You may be at risk of catching the new subvariants BA.4 or BA.5 even if you had the original omicron, virologist Alex Sigal told DW's Science Unscripted."
Open letter about weapons deliveries to Ukraine draws criticism,https://www.dw.com/en/open-letter-about-weapons-deliveries-to-ukraine-draws-criticism/a-61660104?maca=en-rss-en-all-1573-rdf,The publication of an open letter to German Chancellor Scholz signed by leading cultural figures has triggered a fierce debate about the planned delivery of heavy weapons to Ukraine — especially on social media.
Can Algeria contribute to the EU's energy security?,https://www.dw.com/en/can-algeria-contribute-to-the-eu-s-energy-security/a-61680466?maca=en-rss-en-all-1573-rdf,"Timely decisions, long-term commitments and a broader vision could help the European Union increase ties with the Western Mediterranean. Algeria, with its large reserves, could enhance the bloc's energy security."
DOK.fest Munich puts spotlight on Ukraine,https://www.dw.com/en/dok-fest-munich-puts-spotlight-on-ukraine/a-61674310?maca=en-rss-en-all-1573-rdf,"After a two-year break due to the pandemic, the documentary film festival is once again held in cinemas. A political thriller about Alexei Navalny opens the event."
Will buying cars online really take off?,https://www.dw.com/en/will-buying-cars-online-really-take-off/a-61676761?maca=en-rss-en-all-1573-rdf,"Boosted by the popularity of electric automaker Tesla, more people than ever are buying vehicles online. UBS estimates the web will make up half of all car sales by 2030, but what will that mean for traditional dealers?"
Breed accounts for less than 10% of a dog's behavior,https://www.dw.com/en/breed-accounts-for-less-than-10-of-a-dog-s-behavior/a-61634800?maca=en-rss-en-all-1573-rdf,"If you're looking for a dog with a specific personality, its breed will tell you less than the environment in which it is raised, a new study suggests."
Will an EU oil embargo put the lights out at Schwedt's refinery?,https://www.dw.com/en/will-an-eu-oil-embargo-put-the-lights-out-at-schwedt-s-refinery/a-61668807?maca=en-rss-en-all-1573-rdf,"As EU member states push for a Russian oil embargo, Germany's PCK Schwedt refinery is facing an uncertain future. It runs wholly on Russian imports, and many locals aren't so sure alternatives can be found in time."
Carbon farming: Climate change solution or greenwashing?,https://www.dw.com/en/carbon-farming-climate-change-solution-or-greenwashing/a-61532175?maca=en-rss-en-all-1573-rdf,European agriculture produces millions of tons of CO2 every year. Could encouraging farmers to capture carbon on their land to sell credits to businesses help reduce emissions?
Germans split over heavy weapons deliveries to Ukraine,https://www.dw.com/en/germans-split-over-heavy-weapons-deliveries-to-ukraine/a-61664515?maca=en-rss-en-all-1573-rdf,The German public is divided on the issue of military support for Ukraine. Many fear the delivery of tanks and training of Ukrainian soldiers in Germany may drag the country into the war.
Is India facing a post-pandemic employment crisis?,https://www.dw.com/en/is-india-facing-a-post-pandemic-employment-crisis/a-61662629?maca=en-rss-en-all-1573-rdf,"India's job market is tightening, and skilled workers are finding it harder to enter the workforce. Government job drives and the informal economy have been unable to make up the difference."
Record-breaking heat waves show we need to adapt to the climate crisis now,https://www.dw.com/en/record-breaking-heat-waves-show-we-need-to-adapt-to-the-climate-crisis-now/a-61661802?maca=en-rss-en-all-1573-rdf,"India is just the latest country to face life-threatening temperatures before summer has even started. As extreme heat becomes more frequent around the world, how can affected areas adapt to remain livable?"
"Europe cooperates on gas, as Russia turns off taps to Poland and Bulgaria",https://www.dw.com/en/europe-cooperates-on-gas-as-russia-turns-off-taps-to-poland-and-bulgaria/a-61641814?maca=en-rss-en-all-1573-rdf,"Russia has halted gas exports to Poland and Bulgaria, ramping up the pressure on all EU states to find alternative suppliers. Some are working on cutting Russian gas altogether, others have plans to share with neighbors."
"Russia posts trained dolphins at Black Sea naval base, satellite images show",https://www.dw.com/en/russia-posts-trained-dolphins-at-black-sea-naval-base-satellite-images-show/a-61640460?maca=en-rss-en-all-1573-rdf,"Dolphin pens were moved to the Black Sea naval base around the time Russia invaded Ukraine, according to the US Naval Institute's analysis of satellite imagery."
Origin of hepatitis outbreak in kids is still unknown,https://www.dw.com/en/origin-of-hepatitis-outbreak-in-kids-is-still-unknown/a-61625520?maca=en-rss-en-all-1573-rdf,"Doctors are puzzled by an unknown strain of hepatitis presenting in children, which has in some cases caused liver failure. But they are learning more. Symptoms are like jaundice."
