titles,descriptions,links,pubDates
Ukraine Live Updates: Finland's Move to Join NATO Upends Putin's War Aims ,"Neutral Finland's leaders unequivocally said they intended to seek membership in the alliance, with Sweden expected to do the same, inviting new threats from Moscow. ",https://www.nytimes.com/live/2022/05/12/world/russia-ukraine-war-news ,"Fri, 13 May 2022 04:30:16 +0000 "
North Korea Reports 6 Deaths as Covid-19 Spreads 'Explosively' ,"The country's leader, Kim Jong-un, said 187,800 people were in quarantine, and state TV showed him wearing a mask for the first time. ",https://www.nytimes.com/2022/05/12/world/asia/north-korea-covid-deaths.html ,"Fri, 13 May 2022 02:59:38 +0000 "
Investigation of Journalist's Killing May Hinge on Bullet ,The Palestinian Authority said it would not let Israeli officials examine the bullet that killed Shireen Abu Akleh in the occupied West Bank during an Israeli raid. Israel said that is the only way to determine who fired it. ,https://www.nytimes.com/live/2022/05/12/world/al-jazeera-journalist-killed-west-bank ,"Fri, 13 May 2022 02:46:29 +0000 "
"Life in a Ukrainian Unit: Diving for Cover, Waiting for Western Weapons ","Analysts say the outcome of fighting now is riding on the accuracy, quantity and the striking power of long-range weapons. Ukraine is pleading for more. ",https://www.nytimes.com/2022/05/12/world/ukraine-russia-weapons.html ,"Thu, 12 May 2022 21:23:05 +0000 "
U.K. Donor Said to Have Funneled Russian Money to Tories ,"The cash was part of a fund-raising blitz that helped propel Prime Minister Boris Johnson's party to victory in 2019. Records track $630,225 to a Russian bank account. ",https://www.nytimes.com/2022/05/12/world/europe/russian-money-uk-tories.html ,"Fri, 13 May 2022 02:12:34 +0000 "
Families Reel Outside El Salvador Prisons After Gang Violence Crackdowns ,"Dozens of women wait outside a detention facility for news of their loved ones after a crackdown on gang violence resulted in the imprisonment of more than 25,000 people. ",https://www.nytimes.com/2022/05/12/world/americas/el-salvador-prison-gangs-bukele.html ,"Thu, 12 May 2022 13:48:10 +0000 "
Boris Johnson Sidesteps Question on Donation Flagged as Russia-Linked ,Britain's prime minister said all donations are disclosed “in the normal way.” The Conservative Party gave no sign it would return the money. ,https://www.nytimes.com/2022/05/12/world/europe/boris-johnson-response-sheleg-donation.html ,"Thu, 12 May 2022 19:30:35 +0000 "
Africa's First Covid-19 Vaccine Factory Has Not Received a Single Order ,"Aspen Pharmacare, in South Africa, was licensed to produce the Johnson & Johnson vaccine. It was hailed as an answer to Africa's struggle to get access to vaccines. ",https://www.nytimes.com/2022/05/12/world/africa/south-africa-covid-vaccine-factory.html ,"Fri, 13 May 2022 04:34:43 +0000 "
Interview With Gay Couple Sparks Backlash in Indonesia ,"The segment on a popular podcast hosted by Deddy Corbuzier enraged religious leaders, highlighting the limits of tolerance for gay people in the Muslim-majority nation. ",https://www.nytimes.com/2022/05/12/world/asia/indonesia-podcast-deddy-corbuzier.html ,"Thu, 12 May 2022 17:37:49 +0000 "
Kim Jong-un Orders Lockdown as North Korea Reports First Covid Cases ,"The country's leader, Kim Jong-un, ordered a national lockdown after a subvariant of the Omicron variant of the coronavirus was found in the capital. ",https://www.nytimes.com/2022/05/11/world/asia/north-korea-covid.html ,"Thu, 12 May 2022 19:45:21 +0000 "
Biden Hosts Southeast Asian Leaders as He Tries to Return Focus to China ,"The leaders at the two-day summit in Washington will discuss a variety of topics, but the president plans to use it to show a united front against Beijing. ",https://www.nytimes.com/2022/05/12/us/politics/biden-asian-nations-china.html ,"Fri, 13 May 2022 00:16:36 +0000 "
India's Hindu-Muslim Tensions Reveal a Worrisome New Pattern ,"As a national campaign by right-wing groups inflames local tensions, Muslim communities are facing the harshest punishments, according to activists, analysts and retired officials. ",https://www.nytimes.com/2022/05/11/world/asia/india-hindu-muslim-violence.html ,"Wed, 11 May 2022 20:34:30 +0000 "
Bulgaria Takes Unusual Stand Against Russia With Sanctions ,"Bulgaria has imposed economic sanctions on Russia, offered to repair broken military equipment for Ukraine and expelled Russian diplomats. ",https://www.nytimes.com/2022/05/11/world/europe/bulgaria-russia-ukraine.html ,"Thu, 12 May 2022 03:07:23 +0000 "
"Shireen Abu Akleh, Palestinian Journalist, Dies, Aged 51 ","Ms. Abu Akleh, 51, a Palestinian American reporter who was killed in the West Bank on Wednesday, was a household name across the Middle East. ",https://www.nytimes.com/2022/05/11/world/middleeast/shireen-abu-akleh-al-jazeera-dead.html ,"Thu, 12 May 2022 21:42:12 +0000 "
Your Friday Briefing ,Finland moves to join NATO. ,https://www.nytimes.com/2022/05/12/briefing/ukraine-finland-nato-crypto.html ,"Fri, 13 May 2022 03:44:25 +0000 "
Rand Paul Delays $40 Billion in Aid for Ukraine ,Mr. Paul had sought to alter the bill to include requiring that an inspector general monitor the spending. ,https://www.nytimes.com/2022/05/12/world/europe/rand-paul-ukraine-aid.html ,"Fri, 13 May 2022 01:07:18 +0000 "
U.S. Embraces Finland's Move Toward NATO Membership. What About Ukraine? ,"Ukraine has been considered too full of corruption and too devoid of democratic institutions to make membership likely for years, if not decades, to come. ",https://www.nytimes.com/2022/05/12/us/politics/nato-finland-sweden-ukraine.html ,"Fri, 13 May 2022 04:30:14 +0000 "
Biden's Summit of the Americas Threatened By Boycotts ,"Latin American heads of state are threatening to skip the event in Los Angeles, putting at risk the White House's agenda in a region gripped by upheaval. ",https://www.nytimes.com/2022/05/12/world/americas/summit-americas-boycotts.html ,"Thu, 12 May 2022 22:57:51 +0000 "
"Finland Moves to Join NATO, Upending Putin's Ukraine War Aims ","Neutral Finland's leaders unequivocally said they intended to seek membership in the alliance, with Sweden expected to do the same, inviting new threats from Moscow. ",https://www.nytimes.com/2022/05/12/world/europe/finland-sweden-nato-russia-war.html ,"Thu, 12 May 2022 23:16:03 +0000 "
Why a Bullet Is the Focus of Investigations In Journalist's Killing ,The Palestinian Authority said it would not let Israeli officials examine the bullet that killed Shireen Abu Akleh. Israel said that is the only way to determine who fired it. ,https://www.nytimes.com/2022/05/12/world/middleeast/journalist-killed-palestine-israel-bullet.html ,"Thu, 12 May 2022 22:13:56 +0000 "
"As Southern Africa Cases Climb, Health Officials Worry About Testing Drop ","New reported cases in South Africa have increased 80 percent, from the average two weeks ago, and deaths have increased 44 percent. ",https://www.nytimes.com/2022/05/12/world/africa/southern-africa-covid-surge-testing.html ,"Thu, 12 May 2022 22:23:36 +0000 "
Your Friday Briefing: The Fateful Bullet ,Israeli and Palestinian authorities are divided over how to investigate the killing of the Al Jazeera journalist in the West Bank. ,https://www.nytimes.com/2022/05/12/briefing/al-jazeera-palestine-journalist-israel.html ,"Thu, 12 May 2022 21:11:20 +0000 "
F.B.I. Told Israel It Wanted Pegasus Hacking Tool for Investigations ,A 2018 letter from the bureau to the Israeli government is the clearest documentary evidence to date that the agency weighed using the spyware for law enforcement operations. ,https://www.nytimes.com/2022/05/12/us/politics/fbi-pegasus-spyware-israel.html ,"Thu, 12 May 2022 19:12:44 +0000 "
Biden Administration Cancels Oil Drilling Sales in Alaska and Gulf of Mexico ,Republicans link the move to rising gas prices while the administration said it was a result of conflicting legal opinions and a lack of interest among bidders. ,https://www.nytimes.com/2022/05/12/climate/biden-oil-gas-lease-sales.html ,"Thu, 12 May 2022 15:53:20 +0000 "
U.K. Police Issue More Fines for Parties at Downing Street ,"Britain's prime minister, Boris Johnson, was not among those affected, his office said, though neither it, nor the police, named those who were. ",https://www.nytimes.com/2022/05/12/world/europe/downing-street-covid-lockdown.html ,"Thu, 12 May 2022 14:26:06 +0000 "
Thailand Is Easing Weed Laws and Giving Away Cannabis Plants ,The Southeast Asian country will soon allow residents to grow cannabis for medicinal use. Smoking pot recreationally still carries harsh penalties. ,https://www.nytimes.com/2022/05/12/world/asia/thailand-legal-weed-plant.html ,"Thu, 12 May 2022 13:31:12 +0000 "
Who Is 'Wagatha Christie'? Let Us Explain. ,The feud between two television personalities has made its way to a London courtroom and the front of British tabloids. Let us explain. ,https://www.nytimes.com/2022/05/12/world/europe/wagatha-christie-trial.html ,"Thu, 12 May 2022 18:09:54 +0000 "
"At Biden's Summit, Other Nations Pledge Billions to Bolster Pandemic Response ",The meeting was meant to reinvigorate the response as vaccination and testing lag. Many attendees said Covid fatigue had become nearly as big a danger as Covid itself. ,https://www.nytimes.com/2022/05/12/us/politics/biden-covid-summit.html ,"Thu, 12 May 2022 22:31:37 +0000 "
Inflation Anger ,Inflation is still high — and many Americans are upset. ,https://www.nytimes.com/2022/05/12/briefing/inflation-america-rising-prices.html ,"Thu, 12 May 2022 11:49:58 +0000 "
Biden Orders Federal Flags to Fly at Half-Staff as U.S. Covid Toll Nears One Million ,The president said in a formal statement that the United States must 'remain vigilant' against a virus that has 'forever changed' the country. ,https://www.nytimes.com/2022/05/12/us/biden-covid-deaths-flags-half-staff.html ,"Thu, 12 May 2022 20:23:09 +0000 "
These Dancers Escaped the War. Their Journeys Are Just Beginning. ,"Hundreds of ballet dancers and students fled Ukraine after Russia's invasion. With opportunities scarce, many will have to keep moving if they want to keep dancing. ",https://www.nytimes.com/2022/05/12/arts/ukraine-ballet-war.html ,"Thu, 12 May 2022 15:11:29 +0000 "
Finland's Leaders Urge NATO Membership 'Without Delay' ,Public opinion in Finland has shifted significantly in favor of joining the alliance in the 11 weeks since Russia invaded Ukraine. ,https://www.nytimes.com/2022/05/12/world/europe/finland-nato.html ,"Thu, 12 May 2022 17:10:26 +0000 "
Your Thursday Briefing ,Forecasts for the war in Ukraine. ,https://www.nytimes.com/2022/05/12/briefing/economic-war-ukraine-bulgaria-israel.html ,"Thu, 12 May 2022 09:51:00 +0000 "
The Milky Way's Black Hole Comes to Light ,The Event Horizon Telescope has once again caught sight of the “unseeable.” ,https://www.nytimes.com/2022/05/12/science/black-hole-photo.html ,"Fri, 13 May 2022 00:22:26 +0000 "
Your Thursday Briefing: A Journalist Killed in the West Bank ,Plus uncertainty about China's wheat harvest and religious violence in India. ,https://www.nytimes.com/2022/05/11/briefing/journalist-west-bank-al-jazeera.html ,"Wed, 11 May 2022 20:54:18 +0000 "
Ukraine Launches First War Crimes Trial for Russian Soldier ,A 21-year-old Russian soldier is accused of following orders to shoot an unarmed cyclist four days into Russia's invasion of Ukraine. ,https://www.nytimes.com/2022/05/11/world/europe/russia-war-crimes-trial-ukraine.html ,"Wed, 11 May 2022 22:16:04 +0000 "
"Only a Third of Americans Were Worried About Covid in April, Poll Finds ","The survey, from Gallup, was conducted between April 15 and April 23, at a time when new cases were increasing after plummeting from highs seen during the winter Omicron surge. ",https://www.nytimes.com/2022/05/11/us/covid-fears-us.html ,"Thu, 12 May 2022 02:19:12 +0000 "
Israel's Teetering Government Breathes Again as Arab Party Rejoins ,"A small Islamist party decided to end its freeze on participating in the fragile eight-way coalition, granting it at least a temporary reprieve. ",https://www.nytimes.com/2022/05/11/world/middleeast/israel-parliament-raam.html ,"Wed, 11 May 2022 17:36:36 +0000 "
Ukrainians Fight Russian Troops Up Close Along the Eastern Front ,"In some villages along the front, Ukrainian and Russian soldiers face off at close quarters, sometimes within eyesight of one another. ",https://www.nytimes.com/2022/05/11/world/europe/russia-ukraine-fighting-east.html ,"Thu, 12 May 2022 07:58:09 +0000 "
"Air Pollution Can Mean More, or Fewer, Hurricanes. It Depends Where You Live. ","Smog from factories and cars has led to more storms in the Atlantic Ocean, but fewer in the Pacific. A new study explains why. ",https://www.nytimes.com/2022/05/11/climate/air-pollution-hurricanes.html ,"Thu, 12 May 2022 12:22:22 +0000 "
India's Top Court Suspends Colonial-Era Sedition Law ,"The law has been used to quash dissent and is not in tune with the times, the court said. Its action does not overturn the law, though, only Parliament can do that. ",https://www.nytimes.com/2022/05/11/world/asia/india-sedition-law-suspended.html ,"Wed, 11 May 2022 19:19:39 +0000 "
Economic Toll of Russia's War in Ukraine Tests Western Solidarity ,"Russia's president is calculating that Western leaders will tire before he does of a protracted struggle in Ukraine, especially if the price is turbocharged inflation and energy shortages. ",https://www.nytimes.com/2022/05/11/world/europe/ukraine-russia-western-solidarity.html ,"Thu, 12 May 2022 06:43:42 +0000 "
Report Catalogs Abuse of Native American Children at Former Government Schools ,"Interior Secretary Deb Haaland called for a review last year, after the discovery of hundreds of unmarked graves of children who attended similar schools in Canada. ",https://www.nytimes.com/2022/05/11/us/politics/native-american-children-schools-abuse.html ,"Thu, 12 May 2022 03:37:57 +0000 "
New Zealand Border Will Fully Reopen at the End of July ,"The move comes two months ahead of schedule, in an attempt to speed up economic recovery. ",https://www.nytimes.com/2022/05/11/world/australia/new-zealand-border-reopen.html ,"Wed, 11 May 2022 19:12:55 +0000 "
Hong Kong Police Arrest Former Bishop in National Security Case ,"Cardinal Joseph Zen, 90, was among three held for their work with a legal aid group that helped protesters and that officials accuse of colluding with foreign powers. ",https://www.nytimes.com/2022/05/11/world/asia/hong-kong-arrests-national-security.html ,"Wed, 11 May 2022 16:37:43 +0000 "
Lufthansa Apologizes After Jewish People Were Barred From Flight ,"Passengers said that after landing in Germany, more than 100 people were blocked from boarding a connecting flight to Hungary, after a handful of passengers disobeyed a mask requirement. ",https://www.nytimes.com/2022/05/11/world/europe/jewish-passengers-flight-ban-lufthansa.html ,"Wed, 11 May 2022 15:50:34 +0000 "
"To Keep Putin and His Oligarchs Afloat, It Takes a System ",Out of a halting attempt at democratization grew a corrupt ecosystem that has proved very difficult for the Russian elite to resist. ,https://www.nytimes.com/2022/05/11/world/europe/putin-russia-corruption.html ,"Wed, 11 May 2022 20:40:53 +0000 "
"Nearly One-Third of Ukraine's Jobs Are Lost Amid War, U.N. Labor Agency Says ",The report highlights the grim economic toll of Russia's aggression and the challenges that lie ahead for Ukraine and other nations. ,https://www.nytimes.com/2022/05/11/world/europe/ukraine-war-jobs.html ,"Wed, 11 May 2022 15:25:02 +0000 "
E.U. Will No Longer Recommend Masks for Air Travel ,The decision came as countries across the bloc were loosening restrictions in response to the current rates of vaccination and naturally acquired immunity. ,https://www.nytimes.com/2022/05/11/world/europe/eu-masks-air-travel.html ,"Thu, 12 May 2022 03:14:14 +0000 "
Canada's Trucker Protests Have a New Political Champion ,Prime Minister Justin Trudeau condemned the protest as illegal. Now some of his key opponents are embracing it. ,https://www.nytimes.com/2022/05/11/world/canada/trucker-convoy-protest-conservatives.html ,"Wed, 11 May 2022 17:24:50 +0000 "
Few Republicans Confront Trump. What Distinguishes Them? ,What distinguishes the few Republicans willing to confront Donald Trump? ,https://www.nytimes.com/2022/05/11/briefing/republicans-trump-romney-cheney.html ,"Wed, 11 May 2022 10:35:13 +0000 "
'Tantura' Documentary Reopens Debate About Israel's Foundational Story ,"Israeli soldiers had long denied killing prisoners after capturing an Arab seaside town, days after Israel's creation. A new film provides fresh evidence — reopening a debate about Israel's foundational story. ",https://www.nytimes.com/2022/05/11/world/israeli-palestinian-mass-grave-tantura.html ,"Wed, 11 May 2022 07:00:14 +0000 "
Shireen Abu Akleh of Al Jazeera Is Killed in West Bank ,The network and Palestinian authorities blamed Israeli troops for the killing. Israel said the blame could lie with Palestinian gunmen. ,https://www.nytimes.com/2022/05/11/world/middleeast/al-jazeera-journalist-killed-west-bank.html ,"Thu, 12 May 2022 08:49:14 +0000 "
Your Wednesday Briefing ,Russian advances in eastern Ukraine. ,https://www.nytimes.com/2022/05/11/briefing/russia-donbas-fed-inflation.html ,"Thu, 12 May 2022 09:50:38 +0000 "
"Leonid Kravchuk, First President of Ukraine, Dies at 88 ","Days after his election, he signed a multinational agreement that formally declared the dissolution of the Soviet Union. ",https://www.nytimes.com/2022/05/10/world/europe/leonid-kravchuk-dead.html ,"Wed, 11 May 2022 21:15:25 +0000 "
"Iran Says It Will Execute Ahmadreza Djalali, Swedish-Iranian Accused of Spying ",Ahmadreza Djalali denies he spied for Israel or helped it kill Iranian nuclear scientists. ,https://www.nytimes.com/2022/05/10/world/middleeast/iran-execution-ahmadreza-djalali.html ,"Tue, 10 May 2022 23:51:44 +0000 "
"Russia Was Behind Cyberattack in Run-Up to Ukraine War, Investigation Finds ",The February attack rattled Pentagon officials and private industry because it revealed new vulnerabilities in global communications systems. ,https://www.nytimes.com/2022/05/10/us/politics/russia-cyberattack-ukraine-war.html ,"Wed, 11 May 2022 07:30:30 +0000 "
Ukraine War's Geographic Reality: Russia Has Seized Much of the East ,"Despite many stumbles and setbacks, the Russian military has gained near total control of the Donbas region, giving the Kremlin huge leverage in any future talks. ",https://www.nytimes.com/2022/05/10/world/europe/ukraine-russia-donbas.html ,"Wed, 11 May 2022 02:14:54 +0000 "
Your Wednesday Briefing: South Korea's New President ,Plus protests in the Philippines and a weakened Japanese yen. ,https://www.nytimes.com/2022/05/10/briefing/president-south-korea-yoon-marcos-philippines.html ,"Wed, 11 May 2022 09:57:51 +0000 "
Spain's Intelligence Leader Ousted Over Agency's Use of Pegasus Spyware ,"Paz Esteban, the first woman to hold the job, was caught up in a scandal over her agency's use of Pegasus spyware. ",https://www.nytimes.com/2022/05/10/world/europe/spain-intelligence-chief-ousted.html ,"Tue, 10 May 2022 20:33:50 +0000 "
