Snovsk,Сновськ,Chernihiv,10825,12315,−12.10%,ukraine,"Сновськ,ukraine","Сновськ, Сновська міська громада, Корюківський район, Чернігівська область, 15200-15203, Україна","(51.8187527, 31.9448953, 0.0)",51.8187527,31.9448953,0.0
Bobrynets,Бобринець,Kirovohrad,10559,12300,−14.15%,ukraine,"Бобринець,ukraine","Бобринець, Бобринецька міська громада, Кропивницький район, Кіровоградська область, 27200, Україна","(48.05729, 32.15938, 0.0)",48.05729,32.15938,0.0
Nemyriv,Немирів,Vinnytsia,11563,12082,−4.30%,ukraine,"Немирів,ukraine","Немирів, Немирівська міська громада, Вінницький район, Вінницька область, Україна","(48.9654035, 28.8430131, 0.0)",48.9654035,28.8430131,0.0
Kobeliaky,Кобеляки,Poltava,9627,12076,−20.28%,ukraine,"Кобеляки,ukraine","Кобеляки, Кобеляцька міська громада, Полтавський район, Полтавська область, 39200-39204, Україна","(49.1433333, 34.2002778, 0.0)",49.1433333,34.2002778,0.0
Rodynske,Родинське,Donetsk,9948,11996,−17.07%,ukraine,"Родинське,ukraine","Родинське, Покровська міська громада, Покровський район, 85310-87315, Україна","(48.3536652, 37.2034069, 0.0)",48.3536652,37.2034069,0.0
Chyhyryn,Чигирин,Cherkasy,8664,11960,−27.56%,ukraine,"Чигирин,ukraine","Чигирин, Чигиринська міська громада, Черкаський район, Черкаська область, 20900-20906, Україна","(49.0768871, 32.66612288227482, 0.0)",49.0768871,32.66612288227482,0.0
Bobrovytsia,Бобровиця,Chernihiv,10742,11916,−9.85%,ukraine,"Бобровиця,ukraine","Бобровиця, Бобровицька міська громада, Ніжинський район, Чернігівська область, 17400, Україна","(50.7415033, 31.3860852, 0.0)",50.7415033,31.3860852,0.0
Sosnivka,Соснівка,Lviv,10838,11889,−8.84%,ukraine,"Соснівка,ukraine","Соснівка, Червоноградська міська громада, Червоноградський район, Львівська область, 80193, Україна","(50.2909116, 24.2563161, 0.0)",50.2909116,24.2563161,0.0
Zhydachiv,Жидачів,Lviv,10525,11798,−10.79%,ukraine,"Жидачів,ukraine","Жидачів, Жидачівська міська громада, Стрийський район, Львівська область, 81700, Україна","(49.3831172, 24.1426813, 0.0)",49.3831172,24.1426813,0.0
Yampil,Ямпіль,Vinnytsia,10787,11787,−8.48%,ukraine,"Ямпіль,ukraine","Ямпіль, Ямпільська селищна громада, Шепетівський район, Хмельницька область, 30231, Україна","(49.9562165, 26.2274578, 0.0)",49.9562165,26.2274578,0.0
Mospyne[a],Моспине,Donetsk,10493,11736,−10.59%,ukraine,"Моспине,ukraine","Моспине, Моспинська міська рада, Пролетарський район, Донецька міська рада, 83492-83499, Україна","(47.8813092, 38.0746792, 0.0)",47.8813092,38.0746792,0.0
Borzna,Борзна,Chernihiv,9632,11707,−17.72%,ukraine,"Борзна,ukraine","Борзна, Борзнянська міська громада, Ніжинський район, Чернігівська область, 16400, Україна","(51.2534475, 32.4263156, 0.0)",51.2534475,32.4263156,0.0
Shcholkine[b],Щолкіне,Crimea,—,11699,—,ukraine,"Щолкіне,ukraine","Щёлкино, Ленинский район, Республика Крым, 98213, Україна","(45.4291446, 35.8222792, 0.0)",45.4291446,35.8222792,0.0
Buryn,Буринь,Sumy,8359,11678,−28.42%,ukraine,"Буринь,ukraine","Буринь, Буринська міська громада, Конотопський район, Сумська область, 41700-41708, Україна","(51.1960431, 33.8288042, 0.0)",51.1960431,33.8288042,0.0
Kamianka-Buzka,Кам'янка-Бузька,Lviv,10544,11674,−9.68%,ukraine,"Кам'янка-Бузька,ukraine","Кам’янка-Бузька, Кам'янка-Бузька міська громада, Львівський район, Львівська область, 80400, Україна","(50.1046656, 24.3453414, 0.0)",50.1046656,24.3453414,0.0
Hrebinka,Гребінка,Poltava,10645,11662,−8.72%,ukraine,"Гребінка,ukraine","Гребінка, Гребінківська міська громада, Лубенський район, Полтавська область, 37400, Україна","(50.1206044, 32.4289258, 0.0)",50.1206044,32.4289258,0.0
Khrystynivka,Христинівка,Cherkasy,10068,11650,−13.58%,ukraine,"Христинівка,ukraine","Христинівка, Христинівська міська громада, Уманський район, Черкаська область, 20000-20008, Україна","(48.812969, 29.9677872, 0.0)",48.812969,29.9677872,0.0
Hirske[c],Гірське,Luhansk,9274,11473,−19.17%,ukraine,"Гірське,ukraine","Гірське, Гірська міська громада, Сєвєродонецький район, Луганська область, 93292, Україна","(48.7395184, 38.4919701, 0.0)",48.7395184,38.4919701,0.0
Tavriisk,Таврійськ,Kherson,10250,11452,−10.50%,ukraine,"Таврійськ,ukraine","Таврійськ, Таврійська міська громада, Каховський район, Херсонська область, 74988, Україна","(46.7550442, 33.4248309, 0.0)",46.7550442,33.4248309,0.0
Borshchiv,Борщів,Ternopil,10765,11382,−5.42%,ukraine,"Борщів,ukraine","Борщів, Борщівська міська громада, Чортківський район, Тернопільська область, 48700, Україна","(48.8025557, 26.0401871, 0.0)",48.8025557,26.0401871,0.0
Zymohiria[c],Зимогір'я,Luhansk,9591,11295,−15.09%,ukraine,"Зимогір'я,ukraine","Зимогір’я, Слов’яносербський район, Луганська область, 93742, Україна","(48.5855995, 38.9277816, 0.0)",48.5855995,38.9277816,0.0
Khotyn,Хотин,Chernivtsi,9075,11216,−19.09%,ukraine,"Хотин,ukraine","Хотин, Хотинська міська громада, Дністровський район, Чернівецька область, 60000-60005, Україна","(48.5068418, 26.4859086, 0.0)",48.5068418,26.4859086,0.0
Illintsi,Іллінці,Vinnytsia,11185,11340,−1.37%,ukraine,"Іллінці,ukraine","Іллінці, Іллінецька міська громада, Вінницький район, Вінницька область, Україна","(49.1136358, 29.2024356, 0.0)",49.1136358,29.2024356,0.0
Pomichna,Помічна,Kirovohrad,8750,10946,−20.06%,ukraine,"Помічна,ukraine","Помічна, Помічнянська міська громада, Новоукраїнський район, Кіровоградська область, 27030, Україна","(48.2407152, 31.418291849593256, 0.0)",48.2407152,31.418291849593256,0.0
Olevsk,Олевськ,Zhytomyr,10226,10896,−6.15%,ukraine,"Олевськ,ukraine","Олевськ, Олевська міська громада, Коростенський район, Житомирська область, 11001-11002, Україна","(51.22272, 27.64881, 0.0)",51.22272,27.64881,0.0
Kamin-Kashyrskyi,Камінь-Каширський,Volyn,12519,10818,+15.72%,ukraine,"Камінь-Каширський,ukraine","Камінь-Каширський, Камінь-Каширська міська громада, Камінь-Каширський район, Волинська область, Україна","(51.61866655, 24.96461202911552, 0.0)",51.61866655,24.96461202911552,0.0
Tatarbunary,Татарбунари,Odessa,10933,10797,+1.26%,ukraine,"Татарбунари,ukraine","Татарбунари, Татарбунарська міська громада, Білгород-Дністровський район, Одеська область, 68100-68104, Україна","(45.8398696, 29.6166537, 0.0)",45.8398696,29.6166537,0.0
Pohrebyshche,Погребище,Vinnytsia,9382,10754,−12.76%,ukraine,"Погребище,ukraine","Погребище, Погребищенська міська громада, Вінницький район, Вінницька область, 22200-22208, Україна","(49.4848166, 29.2579157, 0.0)",49.4848166,29.2579157,0.0
Marinka,Мар'їнка,Donetsk,9256,10722,−13.67%,ukraine,"Мар'їнка,ukraine","Мар’їнка, Мар'їнська міська громада, Покровський район, Донецька область, 85600-85602, Україна","(47.9401242, 37.5022312, 0.0)",47.9401242,37.5022312,0.0
Bolekhiv,Болехів,Ivano-Frankivsk,10330,10633,−2.85%,ukraine,"Болехів,ukraine","Болехів, Болехівська міська громада, Калуський район, Івано-Франківська область, 77200-77204, Україна","(49.0663203, 23.8598949, 0.0)",49.0663203,23.8598949,0.0
Inkerman[b],Інкерман,Sevastopol,10027,10628,−5.65%,ukraine,"Інкерман,ukraine","Инкерман, Балаклавский район, Севастополь, 299703-299709, Україна","(44.6181043, 33.6043271, 0.0)",44.6181043,33.6043271,0.0
Zinkiv,Зіньків,Poltava,9328,10577,−11.81%,ukraine,"Зіньків,ukraine","Зіньків, Зіньківська міська громада, Полтавський район, Полтавська область, 38100, Україна","(50.21026, 34.35768, 0.0)",50.21026,34.35768,0.0
Khodoriv,Ходорів,Lviv,9108,10565,−13.79%,ukraine,"Ходорів,ukraine","Ходорів, Ходорівська міська громада, Стрийський район, Львівська область, 81750, Україна","(49.4065802, 24.3140241, 0.0)",49.4065802,24.3140241,0.0
Sniatyn,Снятин,Ivano-Frankivsk,9844,10479,−6.06%,ukraine,"Снятин,ukraine","Снятин, Снятинська міська громада, Коломийський район, Івано-Франківська область, 78300, Україна","(48.4523142, 25.5518046, 0.0)",48.4523142,25.5518046,0.0
Derazhnia,Деражня,Khmelnytskyi,9917,10446,−5.06%,ukraine,"Деражня,ukraine","Деражня, Деражнянська міська громада, Хмельницький район, Хмельницька область, 32200-32205, Україна","(49.2688322, 27.4327085, 0.0)",49.2688322,27.4327085,0.0
Liuboml,Любомль,Volyn,10421,10395,+0.25%,ukraine,"Любомль,ukraine","Любомль, Любомльська міська громада, Ковельський район, Волинська область, Україна","(51.2274054, 24.0396571, 0.0)",51.2274054,24.0396571,0.0
Valky,Валки,Kharkiv,8721,10381,−15.99%,ukraine,"Валки,ukraine","Валки, Валківська міська громада, Богодухівський район, Харківська область, Україна","(49.8305999, 35.6088208, 0.0)",49.8305999,35.6088208,0.0
Novodnistrovsk,Новодністровськ,Chernivtsi,10590,10342,+2.40%,ukraine,"Новодністровськ,ukraine","Новодністровськ, Новодністровська міська громада, Дністровський район, Чернівецька область, Україна","(48.58485, 27.4311004, 0.0)",48.58485,27.4311004,0.0
Radyvyliv,Радивилів,Rivne,10472,10311,+1.56%,ukraine,"Радивилів,ukraine","Радивилів, Радивилівська міська громада, Дубенський район, Рівненська область, 35500-35508, Україна","(50.1279775, 25.2487069, 0.0)",50.1279775,25.2487069,0.0
Vuhlehirsk[a],Вуглегірськ,Donetsk,7317,10309,−29.02%,ukraine,"Вуглегірськ,ukraine","Вуглегірськ, Вуглегірська міська рада, 86481-86483, Україна","(48.3119524, 38.2609048, 0.0)",48.3119524,38.2609048,0.0
Sokyriany,Сокиряни,Chernivtsi,8652,10258,−15.66%,ukraine,"Сокиряни,ukraine","Сокиряни, Сокирянська міська громада, Дністровський район, Чернівецька область, 60200-60207, Україна","(48.4460307, 27.411193, 0.0)",48.4460307,27.411193,0.0
Verkhivtseve,Верхівцеве,Dnipropetrovsk,10081,10142,−0.60%,ukraine,"Верхівцеве,ukraine","Верхівцеве, Верхівцівська міська громада, Кам'янський район, Дніпропетровська область, 51660-51662, Україна","(48.48404, 34.24232, 0.0)",48.48404,34.24232,0.0
Zalishchyky,Заліщики,Ternopil,9021,10125,−10.90%,ukraine,"Заліщики,ukraine","Заліщики, Заліщицька міська громада, Чортківський район, Тернопільська область, 48600, Україна","(48.6402658, 25.735898, 0.0)",48.6402658,25.735898,0.0
Staryi Krym[b],Старий Крим,Crimea,—,10101,—,ukraine,"Старий Крим,ukraine","Старий Крим, Кировский район, Республика Крым, Україна","(45.03339285, 35.09667583036527, 0.0)",45.03339285,35.09667583036527,0.0
Bilytske,Білицьке,Donetsk,7913,10093,−21.60%,ukraine,"Білицьке,ukraine","Білицьке, Добропільська міська громада, Покровський район, Донецька область, 85043-85047, Україна","(48.4081883, 37.1797003, 0.0)",48.4081883,37.1797003,0.0
Pereshchepyne,Перещепине,Dnipropetrovsk,9720,10041,−3.20%,ukraine,"Перещепине,ukraine","Перещепине, Перещепинська міська громада, Новомосковський район, Дніпропетровська область, 51220-51222, Україна","(49.01825, 35.35915, 0.0)",49.01825,35.35915,0.0
Andrushivka,Андрушівка,Zhytomyr,8458,9890,−14.48%,ukraine,"Андрушівка,ukraine","Андрушівка, Андрушівська міська громада, Бердичівський район, Житомирська область, 13400-13405, Україна","(50.0301392, 29.0222111, 0.0)",50.0301392,29.0222111,0.0
Pustomyty,Пустомити,Lviv,10873,9798,+10.97%,ukraine,"Пустомити,ukraine","Пустомити, Пустомитівська міська громада, Львівський район, Львівська область, 81100, Україна","(49.7189582, 23.9047288, 0.0)",49.7189582,23.9047288,0.0
Horodenka,Городенка,Ivano-Frankivsk,8972,9794,−8.39%,ukraine,"Городенка,ukraine","Городенка, Городенківська міська громада, Коломийський район, Івано-Франківська область, 78100, Україна","(48.6720598, 25.4952722, 0.0)",48.6720598,25.4952722,0.0
Tysmenytsia,Тисмениця,Ivano-Frankivsk,9096,9790,−7.09%,ukraine,"Тисмениця,ukraine","Тисмениця, Тисменицька міська громада, Івано-Франківський район, Івано-Франківська область, 77400, Україна","(48.9018102, 24.8484719, 0.0)",48.9018102,24.8484719,0.0
Tiachiv,Тячів,Zakarpattia,8943,9786,−8.61%,ukraine,"Тячів,ukraine","Тячів, Тячівська міська громада, Тячівський район, Закарпатська область, 90500, Україна","(48.01163, 23.5783799, 0.0)",48.01163,23.5783799,0.0
Semenivka,Семенівка,Chernihiv,7952,9656,−17.65%,ukraine,"Семенівка,ukraine","Семенівка, Пустомитівська міська громада, Львівський район, Львівська область, 81162, Україна","(49.6701668, 23.9064696, 0.0)",49.6701668,23.9064696,0.0
Dubrovytsia,Дубровиця,Rivne,9359,9644,−2.96%,ukraine,"Дубровиця,ukraine","Дубровиця, Дубровицька міська громада, Сарненський район, Рівненська область, 34100-34108, Україна","(51.5709462, 26.5660889, 0.0)",51.5709462,26.5660889,0.0
Kodyma,Кодима,Odessa,8514,9634,−11.63%,ukraine,"Кодима,ukraine","Кодима, Кодимська міська громада, Подільський район, Одеська область, Україна","(48.09482855, 29.120450643867407, 0.0)",48.09482855,29.120450643867407,0.0
Irshava,Іршава,Zakarpattia,9223,9515,−3.07%,ukraine,"Іршава,ukraine","Іршава, Іршавська міська громада, Хустський район, Закарпатська область, 90100, Україна","(48.31924, 23.0417599, 0.0)",48.31924,23.0417599,0.0
Berezivka,Березівка,Odessa,9527,9481,+0.49%,ukraine,"Березівка,ukraine","Березівка, Пісочинська селищна громада, Харківський район, Харківська область, 62457, Україна","(49.9043196, 36.0674414, 0.0)",49.9043196,36.0674414,0.0
Ananiv,Ананьїв,Odessa,7789,9476,−17.80%,ukraine,"Ананьїв,ukraine","Ананьїв, Ананьївська міська громада, Подільський район, Одеська область, 66400-66409, Україна","(47.7178669, 29.9601889, 0.0)",47.7178669,29.9601889,0.0
Monastyryshche,Монастирище,Cherkasy,8425,9463,−10.97%,ukraine,"Монастирище,ukraine","Монастирище, Монастирищенська міська громада, Уманський район, Черкаська область, 19100-19109, Україна","(48.9944069, 29.8007253, 0.0)",48.9944069,29.8007253,0.0
Lypovets,Липовець,Vinnytsia,8093,9406,−13.96%,ukraine,"Липовець,ukraine","Липовець, Липовецька міська громада, Вінницький район, Вінницька область, Україна","(49.2296415, 29.0642148, 0.0)",49.2296415,29.0642148,0.0
Vylkove,Вилкове,Odessa,7804,9260,−15.72%,ukraine,"Вилкове,ukraine","Вилкове, Вилківська міська громада, Ізмаїльський район, Одеська область, 68355, Україна","(45.40306, 29.58309, 0.0)",45.40306,29.58309,0.0
Radekhiv,Радехів,Lviv,9746,9230,+5.59%,ukraine,"Радехів,ukraine","Радехів, Радехівська міська громада, Червоноградський район, Львівська область, 80200, Україна","(50.2808744, 24.6397908, 0.0)",50.2808744,24.6397908,0.0
Mostyska,Мостиська,Lviv,9188,9150,+0.42%,ukraine,"Мостиська,ukraine","Мостиська, Мостиська міська громада, Яворівський район, Львівська область, 81300, Україна","(49.79235, 23.147933, 0.0)",49.79235,23.147933,0.0
Artemivsk[c],Кипуче (Kypuche),Luhansk,7203,9097,−20.82%,ukraine,"Кипуче (Kypuche),ukraine",,,,,
Novodruzhesk,Новодружеськ,Luhansk,6806,9025,−24.59%,ukraine,"Новодружеськ,ukraine","Новодружеськ, Лисичанська міська громада, Сєвєродонецький район, Луганська область, 93192, Україна","(48.963397, 38.3519615, 0.0)",48.963397,38.3519615,0.0
Zavodske,Заводське,Poltava,7832,9024,−13.21%,ukraine,"Заводське,ukraine","Заводське, Заводська селищна громада, Чортківський район, Тернопільська область, 48523, Україна","(48.9995988, 25.8551013, 0.0)",48.9995988,25.8551013,0.0
Alupka[b],Алупка,Crimea,8087,9018,−10.32%,ukraine,"Алупка,ukraine","Алупка, Ялтинский городской совет, Республика Крым, 298676-298677, Україна","(44.4185851, 34.03760282120862, 0.0)",44.4185851,34.03760282120862,0.0
Horokhiv,Горохів,Volyn,8996,9015,−0.21%,ukraine,"Горохів,ukraine","Горохів, Горохівська міська громада, Луцький район, Волинська область, Україна","(50.4976536, 24.75947481787056, 0.0)",50.4976536,24.75947481787056,0.0
Pryvillia,Привілля,Luhansk,6679,9004,−25.82%,ukraine,"Привілля,ukraine","Привілля, Лисичанська міська громада, Сєвєродонецький район, Луганська область, 93192, Україна","(48.99971, 38.30109, 0.0)",48.99971,38.30109,0.0
Chop,Чоп,Zakarpattia,8765,8919,−1.73%,ukraine,"Чоп,ukraine","Чоп, Чопська міська громада, Ужгородський район, Закарпатська область, 89502, Україна","(48.4310953, 22.2096148, 0.0)",48.4310953,22.2096148,0.0
Zastavna,Заставна,Chernivtsi,7807,8866,−11.94%,ukraine,"Заставна,ukraine","Заставна, Заставнівська міська громада, Чернівецький район, Чернівецька область, Україна","(48.5224375, 25.8457245, 0.0)",48.5224375,25.8457245,0.0
Zorynsk[c],Зоринськ,Luhansk,7128,8838,−19.35%,ukraine,"Зоринськ,ukraine","Зоринськ, Перевальський район, Луганська область, 94323, Україна","(48.41632, 38.61634198604317, 0.0)",48.41632,38.61634198604317,0.0
Tlumach,Тлумач,Ivano-Frankivsk,8770,8831,−0.69%,ukraine,"Тлумач,ukraine","Тлумач, Тлумацька міська громада, Івано-Франківський район, Івано-Франківська область, 78000-78004, Україна","(48.8665866, 25.0011978, 0.0)",48.8665866,25.0011978,0.0
Teplodar,Теплодар,Odessa,10081,8830,+14.17%,ukraine,"Теплодар,ukraine","Теплодар, Теплодарська міська громада, Одеський район, Одеська область, 65490-65495, Україна","(46.5050729, 30.3272329, 0.0)",46.5050729,30.3272329,0.0
Lanivtsi,Ланівці,Ternopil,8323,8680,−4.11%,ukraine,"Ланівці,ukraine","Ланівці, Лановецька міська громада, Кременецький район, Тернопільська область, 47400, Україна","(49.8734191, 26.0780148, 0.0)",49.8734191,26.0780148,0.0
Busk,Буськ,Lviv,8695,8673,+0.25%,ukraine,"Буськ,ukraine","Буськ, Буська міська громада, Золочівський район, Львівська область, 80500, Україна","(49.965355, 24.6089531, 0.0)",49.965355,24.6089531,0.0
Korets,Корець,Rivne,6982,8649,−19.27%,ukraine,"Корець,ukraine","Корець, Корецька міська громада, Рівненський район, Рівненська область, 34700-34704, Україна","(50.6194566, 27.159712, 0.0)",50.6194566,27.159712,0.0
Rohatyn,Рогатин,Ivano-Frankivsk,7649,8607,−11.13%,ukraine,"Рогатин,ukraine","Рогатин, Рогатинська міська громада, Івано-Франківський район, Івано-Франківська область, 77004, Україна","(49.4092703, 24.6105811, 0.0)",49.4092703,24.6105811,0.0
Pivdenne,Південне,Kharkiv,7394,8516,−13.18%,ukraine,"Південне,ukraine","Південне, Південноміська міська громада, Харківський район, Харківська область, 62464, Україна","(49.8847449, 36.0666511, 0.0)",49.8847449,36.0666511,0.0
Dubliany,Дубляни,Lviv,9793,8469,+15.63%,ukraine,"Дубляни,ukraine","Дубляни, Львівська міська громада, Львівський район, Львівська область, 80381, Україна","(49.9026751, 24.0876223, 0.0)",49.9026751,24.0876223,0.0
Rzhyshchiv,Ржищів,Kyiv,7277,8447,−13.85%,ukraine,"Ржищів,ukraine","Ржищів, Ржищівська міська громада, Обухівський район, Київська область, 09230, Україна","(49.96822, 31.04118, 0.0)",49.96822,31.04118,0.0
Novoselytsia,Новоселиця,Chernivtsi,7514,8400,−10.55%,ukraine,"Новоселиця,ukraine","Новоселиця, Миролюбненська сільська громада, Хмельницький район, Хмельницька область, 31162, Україна","(49.631416, 27.250715, 0.0)",49.631416,27.250715,0.0
Vorozhba,Ворожба,Sumy,6809,8384,−18.79%,ukraine,"Ворожба,ukraine","Ворожба, Ворожбянська міська громада, Сумський район, Сумська область, 41811-41815, Україна","(51.1722411, 34.2245008, 0.0)",51.1722411,34.2245008,0.0
Kosiv,Косів,Ivano-Frankivsk,8463,8301,+1.95%,ukraine,"Косів,ukraine","Косів, Косівська міська громада, Косівський район, Івано-Франківська область, Україна","(48.315802, 25.0983417, 0.0)",48.315802,25.0983417,0.0
