Name,Name(Ukranian),Oblast,Population,Population(2001),Population_Change,Country,Full_address,Geocoded_adress,Point,Latitude,Longitude,Altitude
Kyiv,Київ,none,2962180,2611327,+13.44%,ukraine,"Київ,ukraine","Київ, Україна","(50.4500336, 30.5241361, 0.0)",50.4500336,30.5241361,0.0
Kharkiv,Харків,Kharkiv,1433886,1470902,−2.52%,ukraine,"Харків,ukraine","Харків, Харківська міська громада, Харківський район, Харківська область, Україна","(49.9923181, 36.2310146, 0.0)",49.9923181,36.2310146,0.0
Odessa,Одеса,Odessa,1015826,1029049,−1.28%,ukraine,"Одеса,ukraine","Одеса, Одеська міська громада, Одеський район, Одеська область, 65082, Україна","(46.4843023, 30.7322878, 0.0)",46.4843023,30.7322878,0.0
Dnipro,Дніпро,Dnipropetrovsk,980948,1080846,−9.24%,ukraine,"Дніпро,ukraine","Дніпро, Дніпровська міська громада, Дніпровський район, Дніпропетровська область, 49000-49489, Україна","(48.4680221, 35.0417711, 0.0)",48.4680221,35.0417711,0.0
Donetsk[a],Донецьк,Donetsk,905364,1016194,−10.91%,ukraine,"Донецьк,ukraine","Донецьк, Ворошиловський район, Донецька міська рада, Донецька область, 83000-83490, Україна","(48.0158753, 37.8013407, 0.0)",48.0158753,37.8013407,0.0
Zaporizhzhia,Запоріжжя,Zaporizhzhia,722713,817882,−11.64%,ukraine,"Запоріжжя,ukraine","Запоріжжя, Запорізька міська громада, Запорізький район, Запорізька область, 69037, Україна","(47.8507859, 35.1182867, 0.0)",47.8507859,35.1182867,0.0
Lviv,Львів,Lviv,721510,732818,−1.54%,ukraine,"Львів,ukraine","Львів, Львівська міська громада, Львівський район, Львівська область, Україна","(49.841952, 24.0315921, 0.0)",49.841952,24.0315921,0.0
Kryvyi Rih,Кривий Ріг,Dnipropetrovsk,612750,709014,−13.58%,ukraine,"Кривий Ріг,ukraine","Кривий Ріг, Криворізька міська громада, Криворізький район, Дніпропетровська область, 50000-50479, Україна","(47.9102734, 33.3917703, 0.0)",47.9102734,33.3917703,0.0
Mykolaiv,Миколаїв,Mykolaiv,476101,514136,−7.40%,ukraine,"Миколаїв,ukraine","Миколаїв, Миколаївська міська громада, Миколаївський район, Миколаївська область, 54000-54490, Україна","(46.9758615, 31.9939666, 0.0)",46.9758615,31.9939666,0.0
Sevastopol[b],Севасто́поль,none,464349,342451,+35.60%,ukraine,"Севасто́поль,ukraine","Севастополь, 299911, Україна","(44.6054434, 33.5220842, 0.0)",44.6054434,33.5220842,0.0
Mariupol,Маріуполь,Donetsk,431859,492176,−12.26%,ukraine,"Маріуполь,ukraine","Маріуполь, Маріупольська міська громада, Маріупольський район, Донецька область, 87500-87590, Україна","(47.0957648, 37.5499621, 0.0)",47.0957648,37.5499621,0.0
Luhansk[c],Луганськ,Luhansk,399559,463097,−13.72%,ukraine,"Луганськ,ukraine","Луганськ, Ленінський район, Луганська область, Україна","(48.5717084, 39.2973153, 0.0)",48.5717084,39.2973153,0.0
Vinnytsia,Вінниця,Vinnytsia,370601,356665,+3.91%,ukraine,"Вінниця,ukraine","Вінниця, Вінницька міська громада, Вінницький район, Вінницька область, 21000-21499, Україна","(49.2320162, 28.467975, 0.0)",49.2320162,28.467975,0.0
Makiivka[a],Макіївка,Donetsk,340337,389589,−12.64%,ukraine,"Макіївка,ukraine","Макіївка, Центрально-Міський район, Макіївська міська рада, Донецька область, 86100-86180, Україна","(48.0448144, 37.9635093, 0.0)",48.0448144,37.9635093,0.0
Simferopol[b],Сімферополь,Crimea,336212,343644,−2.16%,ukraine,"Сімферополь,ukraine","Симферополь, Симферопольский городской совет, Республика Крым, Україна","(44.947523700000005, 34.10757757802299, 0.0)",44.947523700000005,34.10757757802299,0.0
Chernihiv,Чернігів,Chernihiv,285234,304994,−6.48%,ukraine,"Чернігів,ukraine","Чернігів, Чернігівська міська громада, Чернігівський район, Чернігівська область, 14000-14499, Україна","(51.494099, 31.294332, 0.0)",51.494099,31.294332,0.0
Kherson,Херсон,Kherson,283649,328360,−13.62%,ukraine,"Херсон,ukraine","Херсон, Херсонська міська громада, Херсонський район, Херсонська область, 73000-73480, Україна","(46.650868149999994, 32.6023027991877, 0.0)",46.650868149999994,32.6023027991877,0.0
Poltava,Полтава,Poltava,283402,317998,−10.88%,ukraine,"Полтава,ukraine","Полтава, Полтавська міська громада, Полтавський район, Полтавська область, 36000-36499, Україна","(49.60250085, 34.54449222533195, 0.0)",49.60250085,34.54449222533195,0.0
Khmelnytskyi,Хмельницький,Khmelnytskyi,274582,253994,+8.11%,ukraine,"Хмельницький,ukraine","Хмельницький, Хмельницька міська громада, Хмельницький район, Хмельницька область, Україна","(49.4196404, 26.9793793, 0.0)",49.4196404,26.9793793,0.0
Cherkasy,Черкаси,Cherkasy,272651,295414,−7.71%,ukraine,"Черкаси,ukraine","Черкаси, Черкаська міська громада, Черкаський район, Черкаська область, 18000-18499, Україна","(49.4447888, 32.0587805, 0.0)",49.4447888,32.0587805,0.0
Chernivtsi,Чернівці,Chernivtsi,265471,240621,+10.33%,ukraine,"Чернівці,ukraine","Чернівці, Чернівецька міська громада, Чернівецький район, Чернівецька область, 58002, Україна","(48.2864702, 25.9376532, 0.0)",48.2864702,25.9376532,0.0
Zhytomyr,Житомир,Zhytomyr,263507,284236,−7.29%,ukraine,"Житомир,ukraine","Житомир, Житомирська міська громада, Житомирський район, Житомирська область, Україна","(50.2598298, 28.6692345, 0.0)",50.2598298,28.6692345,0.0
Sumy,Суми,Sumy,259600,293141,−11.44%,ukraine,"Суми,ukraine","Суми, Сумська міська громада, Сумський район, Сумська область, 40000-40489, Україна","(50.9070007, 34.798386, 0.0)",50.9070007,34.798386,0.0
Rivne,Рівне,Rivne,245289,248813,−1.42%,ukraine,"Рівне,ukraine","Рівненська область, Україна","(51.2074112, 26.5208033, 0.0)",51.2074112,26.5208033,0.0
Horlivka[a],Горлівка,Donetsk,241106,292250,−17.50%,ukraine,"Горлівка,ukraine","Горлівка, Центрально-Міський район, Горлівська міська рада, Донецька область, 84646, Україна","(48.3066712, 38.06547939545784, 0.0)",48.3066712,38.06547939545784,0.0
Ivano-Frankivsk,Івано-Франківськ,Ivano-Frankivsk,237855,218359,+8.93%,ukraine,"Івано-Франківськ,ukraine","Івано-Франківськ, Івано-Франківська міська громада, Івано-Франківський район, Івано-Франківська область, 76000-76490, Україна","(48.9225224, 24.7103188, 0.0)",48.9225224,24.7103188,0.0
Kamianske,Кам'янське,Dnipropetrovsk,229794,255841,−10.18%,ukraine,"Кам'янське,ukraine","Кам’янське, Кам'янська міська громада, Кам'янський район, Дніпропетровська область, 51900-51989, Україна","(48.5167748, 34.6068797, 0.0)",48.5167748,34.6068797,0.0
Ternopil,Тернопіль,Ternopil,223938,227755,−1.68%,ukraine,"Тернопіль,ukraine","Тернопіль, Тернопільська міська громада, Тернопільський район, Тернопільська область, 46000-46499, Україна","(49.5557716, 25.591886, 0.0)",49.5557716,25.591886,0.0
Kropyvnytskyi,Кропивницький,Kirovohrad,222695,254103,−12.36%,ukraine,"Кропивницький,ukraine","Кропивницький, Кропивницька міська громада, Кропивницький район, Кіровоградська область, 25000-25490, Україна","(48.5105805, 32.2656283, 0.0)",48.5105805,32.2656283,0.0
Kremenchuk,Кременчук,Poltava,217710,234073,−6.99%,ukraine,"Кременчук,ukraine","Кременчук, Кременчуцький район, Полтавська область, 39600-39689, Україна","(49.09285285, 33.43081884909263, 0.0)",49.09285285,33.43081884909263,0.0
Lutsk,Луцьк,Volyn,217197,208816,+4.01%,ukraine,"Луцьк,ukraine","Луцьк, Луцька міська громада, Луцький район, Волинська область, Україна","(50.7450733, 25.320078, 0.0)",50.7450733,25.320078,0.0
Bila Tserkva,Біла Церква,Kyiv,208737,200131,+4.30%,ukraine,"Біла Церква,ukraine","Біла Церква, Білоцерківська міська громада, Білоцерківський район, Київська область, 09100-09117, Україна","(49.8038191, 30.1116924, 0.0)",49.8038191,30.1116924,0.0
Kerch[b],Керч,Crimea,151996,157007,−3.19%,ukraine,"Керч,ukraine","Керчь, городской округ Керчь, Республика Крым, 98300-98399, Україна","(45.3534002, 36.4538645, 0.0)",45.3534002,36.4538645,0.0
Melitopol,Мелітополь,Zaporizhzhia,150768,160657,−6.16%,ukraine,"Мелітополь,ukraine","Мелітополь, Мелітопольська міська громада, Мелітопольський район, Запорізька область, 72300-72324, Україна","(46.8400009, 35.35786473485406, 0.0)",46.8400009,35.35786473485406,0.0
Kramatorsk,Краматорськ,Donetsk,150084,181025,−17.09%,ukraine,"Краматорськ,ukraine","Краматорськ, Краматорська міська громада, Краматорський район, Донецька область, 84300-84390, Україна","(48.7389415, 37.5843812, 0.0)",48.7389415,37.5843812,0.0
Uzhhorod,Ужгород,Zakarpattia,115542,117317,−1.51%,ukraine,"Ужгород,ukraine","Ужгород, Ужгородська міська громада, Ужгородський район, Закарпатська область, Україна","(48.6223732, 22.3022569, 0.0)",48.6223732,22.3022569,0.0
Brovary,Бровари,Kyiv,109473,86839,+26.06%,ukraine,"Бровари,ukraine","Бровари, Броварська міська громада, Броварський район, Київська область, 07400, Україна","(50.5111168, 30.7900482, 0.0)",50.5111168,30.7900482,0.0
Yevpatoria[b],Євпаторія,Crimea,108149,105915,+2.11%,ukraine,"Євпаторія,ukraine","Евпатория, Евпаторийский городской совет, Республика Крым, Україна","(45.1996929, 33.36912905819992, 0.0)",45.1996929,33.36912905819992,0.0
Berdiansk,Бердянськ,Zaporizhzhia,107928,121692,−11.31%,ukraine,"Бердянськ,ukraine","Бердянськ, Бердянська міська громада, Бердянський район, Запорізька область, 71100-71127, Україна","(46.755678, 36.7887623, 0.0)",46.755678,36.7887623,0.0
Nikopol,Нікополь,Dnipropetrovsk,107464,136280,−21.14%,ukraine,"Нікополь,ukraine","Нікополь, Нікопольська міська громада, Нікопольський район, Дніпропетровська область, 53200-53239, Україна","(47.5692061, 34.3917272, 0.0)",47.5692061,34.3917272,0.0
Sloviansk,Слов'янськ,Donetsk,106972,124829,−14.31%,ukraine,"Слов'янськ,ukraine","Слов’янськ, Слов'янська міська громада, Краматорський район, Донецька область, 84100-84129, Україна","(48.8522691, 37.6058241, 0.0)",48.8522691,37.6058241,0.0
Alchevsk[c],Алчевськ,Luhansk,106550,119193,−10.61%,ukraine,"Алчевськ,ukraine","Алчевськ, Луганська область, Україна","(48.4696662, 38.7993994, 0.0)",48.4696662,38.7993994,0.0
Pavlohrad,Павлоград,Dnipropetrovsk,103073,118816,−13.25%,ukraine,"Павлоград,ukraine","Павлоград, Павлоградська міська громада, Павлоградський район, Дніпропетровська область, 51400-51429, Україна","(48.5317201, 35.8703535, 0.0)",48.5317201,35.8703535,0.0
Sievierodonetsk,Сєвєродонецьк,Luhansk,101135,119940,−15.68%,ukraine,"Сєвєродонецьк,ukraine","Сєвєродонецьк, Сєвєродонецька міська громада, Сєвєродонецький район, Луганська область, 93400-93480, Україна","(48.9477095, 38.4936024, 0.0)",48.9477095,38.4936024,0.0
Kamianets-Podilskyi,Кам'янець-Подільський,Khmelnytskyi,97908,99610,−1.71%,ukraine,"Кам'янець-Подільський,ukraine","Кам’янець-Подільський, Кам'янець-Подільська міська громада, Кам’янець-Подільський район, Хмельницька область, Україна","(48.6784597, 26.5852225, 0.0)",48.6784597,26.5852225,0.0
Lysychansk,Лисичанськ,Luhansk,95031,115229,−17.53%,ukraine,"Лисичанськ,ukraine","Лисичанськ, Лисичанська міська громада, Сєвєродонецький район, Луганська область, 93100, Україна","(48.917267, 38.4285981, 0.0)",48.917267,38.4285981,0.0
Mukachevo,Мукачево,Zakarpattia,85903,82346,+4.32%,ukraine,"Мукачево,ukraine","Мукачево, Мукачівська міська громада, Мукачівський район, Закарпатська область, Україна","(48.4421438, 22.7185112, 0.0)",48.4421438,22.7185112,0.0
Konotop,Конотоп,Sumy,84787,92657,−8.49%,ukraine,"Конотоп,ukraine","Конотоп, Конотопська міська громада, Конотопський район, Сумська область, 41600-41615, Україна","(51.2397495, 33.206675, 0.0)",51.2397495,33.206675,0.0
Uman,Умань,Cherkasy,82154,88735,−7.42%,ukraine,"Умань,ukraine","Умань, Уманська міська громада, Уманський район, Черкаська область, 20300-20319, Україна","(48.7497621, 30.2203052, 0.0)",48.7497621,30.2203052,0.0
Krasnyi Luch,Хрустальний (Khrustalnyi),Luhansk,79764,94875,−15.93%,ukraine,"Хрустальний (Khrustalnyi),ukraine","Хрустальний, Луганська область, 94518, Україна","(48.1790971, 38.8818684, 0.0)",48.1790971,38.8818684,0.0
Yalta[b],Ялта,Crimea,78171,81654,−4.27%,ukraine,"Ялта,ukraine","Ялта, Ялтинский городской совет, Республика Крым, Україна","(44.4970713, 34.1586871, 0.0)",44.4970713,34.1586871,0.0
Oleksandriia,Олександрія,Kirovohrad,77303,93357,−17.20%,ukraine,"Олександрія,ukraine","Олександрія, Олександрійська міська громада, Олександрійський район, Кіровоградська область, 28000-28019, Україна","(48.670609, 33.1169742, 0.0)",48.670609,33.1169742,0.0
Yenakiieve[a],Єнакієве,Donetsk,77053,103997,−25.91%,ukraine,"Єнакієве,ukraine","Єнакієве, Єнакієвська міська рада, Донецька область, 86400-86470, Україна","(48.2305107, 38.185045, 0.0)",48.2305107,38.185045,0.0
Drohobych,Дрогобич,Lviv,74610,79119,−5.70%,ukraine,"Дрогобич,ukraine","Дрогобич, Дрогобицька міська громада, Дрогобицький район, Львівська область, Україна","(49.3513996, 23.5061662, 0.0)",49.3513996,23.5061662,0.0
Berdychiv,Бердичів,Zhytomyr,73999,87575,−15.50%,ukraine,"Бердичів,ukraine","Бердичів, Бердичівська міська громада, Бердичівський район, Житомирська область, Україна","(49.8940442, 28.5814912, 0.0)",49.8940442,28.5814912,0.0
Stakhanov[c],Кадіївка (Kadiivka),Luhansk,73702,90152,−18.25%,ukraine,"Кадіївка (Kadiivka),ukraine","Кадіївка, О-232001, Волудринці, Ярмолинецька селищна громада, Хмельницький район, Хмельницька область, 32112, Україна","(49.2397059, 26.7839072, 0.0)",49.2397059,26.7839072,0.0
Shostka,Шостка,Sumy,73197,87130,−15.99%,ukraine,"Шостка,ukraine","Шостка, Шосткинська міська громада, Шосткинський район, Сумська область, 41100, Україна","(51.8643223, 33.4728213, 0.0)",51.8643223,33.4728213,0.0
Bakhmut,Бахмут,Donetsk,72310,82916,−12.79%,ukraine,"Бахмут,ukraine","Бахмут, Бахмутська міська громада, Бахмутський район, Донецька область, 84500-84510, Україна","(48.5915754, 37.9837099, 0.0)",48.5915754,37.9837099,0.0
Izmail,Ізмаїл,Odessa,70731,84815,−16.61%,ukraine,"Ізмаїл,ukraine","Ізмаїл, Ізмаїльська міська громада, Ізмаїльський район, Одеська область, 68600-68633, Україна","(45.3511307, 28.8361514, 0.0)",45.3511307,28.8361514,0.0
Novomoskovsk,Новомосковськ,Dnipropetrovsk,70230,72439,−3.05%,ukraine,"Новомосковськ,ukraine","Новомосковськ, Новомосковська міська громада, Новомосковський район, Дніпропетровська область, 51200-51214, Україна","(48.6358512, 35.2595541, 0.0)",48.6358512,35.2595541,0.0
Kostiantynivka,Костянтинівка,Donetsk,68792,95111,−27.67%,ukraine,"Костянтинівка,ukraine","Костянтинівка, Костянтинівська міська громада, Краматорський район, 85100-85129, Україна","(48.534859, 37.6923705, 0.0)",48.534859,37.6923705,0.0
Kovel,Ковель,Volyn,67991,66401,+2.39%,ukraine,"Ковель,ukraine","Ковель, Ковельська міська громада, Ковельський район, Волинська область, 45000-45014, Україна","(51.2120538, 24.708894, 0.0)",51.2120538,24.708894,0.0
Feodosia[b],Феодосія,Crimea,67750,74669,−9.27%,ukraine,"Феодосія,ukraine","Феодосия, Феодосийский городской совет, Республика Крым, 298100-298175, Україна","(45.033669, 35.3753628, 0.0)",45.033669,35.3753628,0.0
Nizhyn,Ніжин,Chernihiv,66983,76625,−12.58%,ukraine,"Ніжин,ukraine","Ніжин, Ніжинська міська громада, Ніжинський район, Чернігівська область, 16600, Україна","(51.0464747, 31.8806289, 0.0)",51.0464747,31.8806289,0.0
Smila,Сміла,Cherkasy,66475,69681,−4.60%,ukraine,"Сміла,ukraine","Сміла, Смілянська міська громада, Черкаський район, Черкаська область, 20700, Україна","(49.2336897, 31.8829216, 0.0)",49.2336897,31.8829216,0.0
Kalush,Калуш,Ivano-Frankivsk,65814,67902,−3.08%,ukraine,"Калуш,ukraine","Калуш, Калуська міська громада, Калуський район, Івано-Франківська область, Україна","(49.028894, 24.3613198, 0.0)",49.028894,24.3613198,0.0
Chervonohrad,Червоноград,Lviv,65180,70568,−7.64%,ukraine,"Червоноград,ukraine","Червоноград, Червоноградська міська громада, Червоноградський район, Львівська область, Україна","(50.3940701, 24.239616, 0.0)",50.3940701,24.239616,0.0
Boryspil,Бориспіль,Kyiv,63674,53975,+17.97%,ukraine,"Бориспіль,ukraine","Бориспіль, Бориспільська міська громада, Бориспільський район, Київська область, 08300-08307, Україна","(50.3512101, 30.95077, 0.0)",50.3512101,30.95077,0.0
Pervomaisk,Первомайськ,Mykolaiv,63377,70170,−9.68%,ukraine,"Первомайськ,ukraine","Первомайськ, Первомайська міська громада, Первомайський район, Миколаївська область, 55200-55219, Україна","(48.03579065, 30.864088395090185, 0.0)",48.03579065,30.864088395090185,0.0
Sverdlovsk[c],Довжанськ (Dovzhansk),Luhansk,62993,72531,−13.15%,ukraine,"Довжанськ (Dovzhansk),ukraine",,,,,
Irpin,Ірпінь,Kyiv,62456,40593,+53.86%,ukraine,"Ірпінь,ukraine","Ірпінь, Ірпінська міська громада, Бучанський район, Київська область, 08200-08289, Україна","(50.5206777, 30.2448725, 0.0)",50.5206777,30.2448725,0.0
Korosten,Коростень,Zhytomyr,62285,66669,−6.58%,ukraine,"Коростень,ukraine","Коростень, Коростенська міська громада, Коростенський район, Житомирська область, Україна","(50.959409699999995, 28.633106718838626, 0.0)",50.959409699999995,28.633106718838626,0.0
Pokrovsk,Покровськ,Donetsk,61161,69154,−11.56%,ukraine,"Покровськ,ukraine","Покровськ, Покровська міська громада, Покровський район, Донецька область, 85300-85309, Україна","(48.2771086, 37.1772482, 0.0)",48.2771086,37.1772482,0.0
Kolomyia,Коломия,Ivano-Frankivsk,61140,61989,−1.37%,ukraine,"Коломия,ukraine","Коломия, Коломийська міська громада, Коломийський район, Івано-Франківська область, Україна","(48.5259211, 25.0380538, 0.0)",48.5259211,25.0380538,0.0
Stryi,Стрий,Lviv,59608,62479,−4.60%,ukraine,"Стрий,ukraine","Стрий, Стрийська міська громада, Стрийський район, Львівська область, Україна","(49.255875, 23.8530863, 0.0)",49.255875,23.8530863,0.0
Chornomorsk,Чорноморськ,Odessa,58524,54151,+8.08%,ukraine,"Чорноморськ,ukraine","Чорноморськ, Чорноморська міська громада, Одеський район, Одеська область, 68000-68004, Україна","(46.3020943, 30.653466, 0.0)",46.3020943,30.653466,0.0
Khartsyzk[a],Харцизьк,Donetsk,56367,64175,−12.17%,ukraine,"Харцизьк,ukraine","Харцизьк, Харцизька міська рада, 86700-86780, Україна","(48.0339524, 38.149804, 0.0)",48.0339524,38.149804,0.0
Rubizhne,Рубіжне,Luhansk,56066,65322,−14.17%,ukraine,"Рубіжне,ukraine","Рубіжне, Рубіжанська міська громада, Сєвєродонецький район, Луганська область, Україна","(49.0222573, 38.3667937, 0.0)",49.0222573,38.3667937,0.0
Novohrad-Volynskyi,Новоград-Волинський,Zhytomyr,55463,56259,−1.41%,ukraine,"Новоград-Волинський,ukraine","Новоград-Волинський, Новоград-Волинська міська громада, Новоград-Волинський район, Житомирська область, Україна","(50.5917622, 27.6066973, 0.0)",50.5917622,27.6066973,0.0
Druzhkivka,Дружківка,Donetsk,55088,64557,−14.67%,ukraine,"Дружківка,ukraine","Дружківка, Дружківська міська громада, Краматорський район, 84200-84290, Україна","(48.6198614, 37.524945, 0.0)",48.6198614,37.524945,0.0
Lozova,Лозова,Kharkiv,54026,64041,−15.64%,ukraine,"Лозова,ukraine","Лозова, Лозівська міська громада, Лозівський район, Харківська область, Україна","(48.8842428, 36.3160254, 0.0)",48.8842428,36.3160254,0.0
Chystiakove[a],Чистякове,Donetsk,53725,72346,−25.74%,ukraine,"Чистякове,ukraine","Торез, Торезька міська рада, Донецька область, 86600-86690, Україна","(48.025858, 38.6187459, 0.0)",48.025858,38.6187459,0.0
