title,link,description
"Pride in defeat, growing support and hope for the future for Wolfsburg's women",https://www.dw.com/en/pride-in-defeat-growing-support-and-hope-for-the-future-for-wolfsburg-s-women/a-61651457?maca=en-rss-en-all-1573-rdf,"Wolfsburg lost on aggregate to Barcelona, but victory on the night and a clear philosophy off the field is earning them support — culminating in a record attendance on Saturday. The path forward for the club is clear."
"Europe cooperates on gas, as Russia turns off taps to Poland and Bulgaria",https://www.dw.com/en/europe-cooperates-on-gas-as-russia-turns-off-taps-to-poland-and-bulgaria/a-61641814?maca=en-rss-en-all-1573-rdf,"Russia has halted gas exports to Poland and Bulgaria, ramping up the pressure on all EU states to find alternative suppliers. Some are working on cutting Russian gas altogether, others have plans to share with neighbors."
"Russia posts trained dolphins at Black Sea naval base, satellite images show",https://www.dw.com/en/russia-posts-trained-dolphins-at-black-sea-naval-base-satellite-images-show/a-61640460?maca=en-rss-en-all-1573-rdf,"Dolphin pens were moved to the Black Sea naval base around the time Russia invaded Ukraine, according to the US Naval Institute's analysis of satellite imagery."
Europa League: RB Leipzig one step closer to a second final — but would a trophy bring acceptance?,https://www.dw.com/en/europa-league-rb-leipzig-one-step-closer-to-a-second-final-but-would-a-trophy-bring-acceptance/a-61638461?maca=en-rss-en-all-1573-rdf,"After victory over Rangers, RB Leipzig are one step closer to reaching their first-ever European final. The club hope a trophy might legitimize their place in German football, but are there some things money can't buy?"
Origin of hepatitis outbreak in kids is still unknown,https://www.dw.com/en/origin-of-hepatitis-outbreak-in-kids-is-still-unknown/a-61625520?maca=en-rss-en-all-1573-rdf,"Doctors are puzzled by an unknown strain of hepatitis presenting in children, which has in some cases caused liver failure. But they are learning more. Symptoms are like jaundice."
Elvira Nabiullina: The central banker Vladimir Putin is relying on to clean up Russia's economic mess,https://www.dw.com/en/elvira-nabiullina-the-central-banker-vladimir-putin-is-relying-on-to-clean-up-russia-s-economic-mess/a-61634244?maca=en-rss-en-all-1573-rdf,Elvira Nabiullina has charmed many in the West with her policymaking — and clothing choices. Analysts say she has blemished her reputation by remaining at the helm to help sustain Putin's war machine in Ukraine.
About a million people live near dangerous dams in Brazil,https://www.dw.com/en/about-a-million-people-live-near-dangerous-dams-in-brazil/a-61523548?maca=en-rss-en-all-1573-rdf,"Data analysis by DW reveals many Brazilians live near dams that, without proper maintenance and governmental oversight, could be deadly in the case of failure."
Eintracht Frankfurt show 'Europa League face' against West Ham in London,https://www.dw.com/en/eintracht-frankfurt-show-europa-league-face-against-west-ham-in-london/a-61630159?maca=en-rss-en-all-1573-rdf,Frankfurt lead their Europa League semifinal following an absorbing first leg in London. The German club continue to show their best form in Europe as they beat West Ham to hold the advantage ahead of the return leg.
Cashing in: No payment problems for Russian tourists in Turkey,https://www.dw.com/en/cashing-in-no-payment-problems-for-russian-tourists-in-turkey/a-61622480?maca=en-rss-en-all-1573-rdf,"Turkey is trying to attract more Russian tourists by expanding the usage of the Russian Mir payment system in the country, as it seeks to bypass payment bottleneck created by Western sanctions."
Putin and Parkinson's: What experts say about his health,https://www.dw.com/en/putin-and-parkinson-s-what-experts-say-about-his-health/a-61597476?maca=en-rss-en-all-1573-rdf,A video released by the Kremlin last weekend shows Putin in seemingly bad health. Some commentators and tabloids claim he has Parkinson's. What do doctors think?
Swiping right on climate love: Dating apps and environmental advocacy,https://www.dw.com/en/swiping-right-on-climate-love-dating-apps-and-environmental-advocacy/a-61600741?maca=en-rss-en-all-1573-rdf,Dating platforms have noticed their users are hot for climate issues and are incorporating features to help them connect with each other. But how useful are additions like OkCupid's climate advocate badge?
Germany top buyer of Russian energy since Ukraine invasion began: report,https://www.dw.com/en/germany-top-buyer-of-russian-energy-since-ukraine-invasion-began-report/a-61616274?maca=en-rss-en-all-1573-rdf,"Russian fossil fuel exports are undermining sanctions imposed on the Kremlin over its invasion of Ukraine, a study says. Germany and the EU remain the biggest buyers of Russian energy."
Mars probe discovers 'shocking' new aurora,https://www.dw.com/en/mars-probe-discovers-shocking-new-aurora/a-61610851?maca=en-rss-en-all-1573-rdf,The Emirates Mars Mission says it's a first: They have spotted a worm-like aurora that stretches halfway round Mars. It looks like our northern lights.
Europe’s 'middle class' clubs battle to save Champions League,https://www.dw.com/en/europe-s-middle-class-clubs-battle-to-save-champions-league/a-61610828?maca=en-rss-en-all-1573-rdf,UEFA are proposing to increase the number of games in the Champions League and offer a safety net to its richest clubs. The plans have been derided as a Super League by the back door and some clubs are fighting back.
Turning the tide on land degradation,https://www.dw.com/en/turning-the-tide-on-land-degradation/a-61606070?maca=en-rss-en-all-1573-rdf,"Human activity has led to widespread land degradation and put our very survival as a species at risk. But by reversing course, we can tackle climate change and biodiversity loss — and make a better life for billions."
Warsaw and Budapest split over Russian energy ties,https://www.dw.com/en/warsaw-and-budapest-split-over-russian-energy-ties/a-61595947?maca=en-rss-en-all-1573-rdf,"Poland and Hungary have shared a tilt towards the nationalist right, bound also by a mutual distrust of the EU. But their relations with Russia are anything but alike. DW explores the energy ties that bind — and don't."
Elon Musk buys Twitter: What it means for the platform,https://www.dw.com/en/elon-musk-buys-twitter-what-it-means-for-the-platform/a-61598916?maca=en-rss-en-all-1573-rdf,"Musk's vision of creating a bastion of free speech with less moderation and a higher bar for removing offending tweets could also lead to more abusive content, disinformation and hate speech, critics fear."
Endometriosis: The long wait for a diagnosis,https://www.dw.com/en/endometriosis-the-long-wait-for-a-diagnosis/a-61581101?maca=en-rss-en-all-1573-rdf,Sabrina Lobing waited more than a decade for a diagnosis that explained her symptoms. Now she knows she has endometriosis — a disease that little is known about and yet is very common.
How Filip Kostic became the modern Bundesliga wingback,https://www.dw.com/en/how-filip-kostic-became-the-modern-bundesliga-wingback/a-61593858?maca=en-rss-en-all-1573-rdf,"Eintracht Frankfurt are in the final four of the Europa League, and they couldn’t have done it without Kostic. It's not always been easy, but Jasmine Baba explains how the club got the best out of their Serbian winger."
Scientists sound alarm bells on noise pollution,https://www.dw.com/en/scientists-sound-alarm-bells-on-noise-pollution/a-61582252?maca=en-rss-en-all-1573-rdf,"The rumble of road traffic and trains, the bustle of the bar downstairs or the roar of a plane taking off – noise is a problem that is increasingly hurting health and disrupting ecosystems."
Afghan women athletes: prisoners in their own homes,https://www.dw.com/en/afghan-women-athletes-prisoners-in-their-own-homes/a-61586041?maca=en-rss-en-all-1573-rdf,"It's eight months since the Taliban took control of Afghanistan and the country has slipped down the news agenda. 'The world forgets about us,' says Friba Rezayee, the first Afghan woman to compete at the Olympics."
RECOMMENDED — What does a US cryptocurrency firm want from a lower-tier UK football club?,https://www.dw.com/en/recommended-what-does-a-us-cryptocurrency-firm-want-from-a-lower-tier-uk-football-club/a-61554929?maca=en-rss-en-all-1573-rdf,"Crawley Town have become the first professional football club to be bought by a cryptocurrency firm. The new owners promise to ""shake up the status quo"" and recruit global fans with NFTs. Is this new dawn what it seems?"
Beyond ecology: The trees at the heart of our culture,https://www.dw.com/en/beyond-ecology-the-trees-at-the-heart-of-our-culture/a-61554900?maca=en-rss-en-all-1573-rdf,"From Ireland to the Amazon to Kenya, trees can hold traditional or even sacred value. DW takes a look at trees and forests of cultural importance to communities around the world. Some are under threat."
Opinion: Bayern Munich's 10th title - joy or relief?,https://www.dw.com/en/opinion-bayern-munich-s-10th-title-joy-or-relief/a-61568379?maca=en-rss-en-all-1573-rdf,"Bayern Munich have won their 10th straight Bundesliga title, sparking renewed conversation about the competitive issues at the top of German football. Perhaps the biggest concern though, is the question of fun."
Bundesliga: Bayern Munich's 10th title prompts celebration — but also concern,https://www.dw.com/en/bundesliga-bayern-munich-s-10th-title-prompts-celebration-but-also-concern/a-61569770?maca=en-rss-en-all-1573-rdf,"Ten league titles in a row should be cause for celebration, one might think. But Bayern Munich's latest triumph is accompanied by acute concern, both in Munich and further afield."
EU reaches deal on major law aiming to regulate tech giants,https://www.dw.com/en/eu-reaches-deal-on-major-law-aiming-to-regulate-tech-giants/a-61566323?maca=en-rss-en-all-1573-rdf,"As per the Digital Services Act (DSA), tech giants such as Facebook and Google will be expected to moderate illegal content on their platforms. It's the second part of the bloc's project seeking to rein in tech giants."
Shanghai COVID lockdown threatens new export delays,https://www.dw.com/en/shanghai-covid-lockdown-threatens-new-export-delays/a-61557795?maca=en-rss-en-all-1573-rdf,Nearly a third of goods leaving the Port of Shanghai are held up due to a strict COVID lockdown. The delays are set to exacerbate a supply chain crisis that has caused shortages and price rises across the world.
Let's talk about salt — how unhealthy is it really?,https://www.dw.com/en/let-s-talk-about-salt-how-unhealthy-is-it-really/a-61560081?maca=en-rss-en-all-1573-rdf,Most people consume too much salt — with potentially massive effects for their health. But it's possible to find a healthy balance.
So you want to live forever?,https://www.dw.com/en/so-you-want-to-live-forever/a-61556152?maca=en-rss-en-all-1573-rdf,"Spoiler: You probably won't be able to live forever, even if you want to. How about settling for a life free from age-related ailments like Alzheimer's or arthritis instead?"
"COVID: In a crowd of unmasked people, can a mask still protect you?",https://www.dw.com/en/covid-in-a-crowd-of-unmasked-people-can-a-mask-still-protect-you/a-61544150?maca=en-rss-en-all-1573-rdf,"Many countries around the world are easing mask mandates. If no one else is masking up, should you?"
"From Mumbai to Paris, the cities investing in the planet",https://www.dw.com/en/from-mumbai-to-paris-the-cities-investing-in-the-planet/a-61479857?maca=en-rss-en-all-1573-rdf,"This Earth Day, we show how city councils and mayors have stepped up to boldly decarbonize in the face of national government inaction."
Energy crisis: What role can Germany's oil and gas sector play?,https://www.dw.com/en/energy-crisis-what-role-can-germany-s-oil-and-gas-sector-play/a-61545432?maca=en-rss-en-all-1573-rdf,"As Germany looks to ditch Russian oil and gas for good, its domestic energy industry is a key side actor — but can it step up to the plate? We search for clues in the village where Germany's oil sector was born."
Climate crisis: How to cope with eco-anxiety,https://www.dw.com/en/climate-crisis-how-to-cope-with-eco-anxiety/a-60796191?maca=en-rss-en-all-1573-rdf,"Does worrying about climate change keep you up at night? Growing numbers of people are struggling with eco-anxiety, or distress about the state of the planet. If you're one of them, these expert tips might help."
Glass windows kill billions of birds a year. Scientists are working to change that,https://www.dw.com/en/glass-windows-kill-billions-of-birds-a-year-scientists-are-working-to-change-that/a-61461646?maca=en-rss-en-all-1573-rdf,Conservationists are trying to convince governments and building owners around the world to introduce changes to stop birds from flying into reflective glass. Experts say the solutions are surprisingly simple.
The thriving gardens at the heart of Rio de Janeiro's favelas,https://www.dw.com/en/the-thriving-gardens-at-the-heart-of-rio-de-janeiro-s-favelas/a-61377873?maca=en-rss-en-all-1573-rdf,"In one of the most dangerous and deprived neighborhoods in the Brazilian city, residents are now finding hope and employment by growing fruit and vegetables."
European Space Agency halts cooperation with Russia on moon missions,https://www.dw.com/en/european-space-agency-halts-cooperation-with-russia-on-moon-missions/a-61476573?maca=en-rss-en-all-1573-rdf,The European Space Agency's move marks the latest in the deterioration of space-based relations with Russia.
New omicron variants: What we know so far,https://www.dw.com/en/new-omicron-variants-what-we-know-so-far/a-61472164?maca=en-rss-en-all-1573-rdf,"A new omicron subvariant, BA.2.12.1, is spreading in the US and India. German Health Minister Lauterbach has expressed concern about the highly contagious coronavirus variant. Here's what we know so far."
China turns cities into sponges to stop flooding,https://www.dw.com/en/china-turns-cities-into-sponges-to-stop-flooding/a-61414704?maca=en-rss-en-all-1573-rdf,"In the coming decade, China is expanding its plans for sponge cities. They can help prevent flooding, promote biodiversity and cut emissions. But what exactly are these cities and how do they work?"
Germany: Over 1 in 4 people have 'migrant background',https://www.dw.com/en/germany-over-1-in-4-people-have-migrant-background/a-61452241?maca=en-rss-en-all-1573-rdf,"The number of people with ""migrant background"" — foreigners and people with foreign roots — keeps rising in Germany, with Turkey, Poland and Russia the top three countries of familial origin."
Cities are major polluters: Can we make them climate neutral?,https://www.dw.com/en/cities-are-major-polluters-can-we-make-them-climate-neutral/a-61438020?maca=en-rss-en-all-1573-rdf,"Spewing most of the world's heat-trapping gases, fast-growing cities need to be transformed into clean, low emissions ecosystems in the struggle against climate breakdown."
Astronaut Samantha Cristoforetti: ISS is a 'beacon of hope',https://www.dw.com/en/astronaut-samantha-cristoforetti-iss-is-a-beacon-of-hope/a-61440382?maca=en-rss-en-all-1573-rdf,"Ahead of the launch of her Minerva mission to the International Space Station, Cristoforetti talked about the cooperation among European, US and Russian crew members in light of the ongoing Russian invasion of Ukraine."
Ukraine Live Updates: Russia Presses on Eastern Front and Targets Final Fighters in Mariupol,https://www.nytimes.com/live/2022/05/05/world/ukraine-russia-war-news,"Russian forces sought to destroy the last pocket of resistance at Azovstal steel plant in Mariupol, which would let President Vladimir V. Putin claim a major victory before Moscow’s military celebration on Monday."
"India Finds Russian Oil an Irresistible Deal, No Matter the Diplomatic Pressure",https://www.nytimes.com/2022/05/04/world/asia/india-russia-oil.html,A parade of emissaries have urged a harder line on Russia. But India’s political neutrality over the war in Ukraine has expanded into economic opportunism.
Elon Musk Left a South Africa That Was Rife With Misinformation and White Privilege,https://www.nytimes.com/2022/05/05/world/africa/elon-musk-south-africa.html,The apartheid era created all-white enclaves littered with anti-Black government propaganda and sheltered from the atrocities of apartheid.
"In Senegal’s Former Capital, a Colonial Statue in Hiding Is No Longer Welcome",https://www.nytimes.com/2022/05/05/world/africa/senegal-faidherbe-statue.html,"The city of Saint-Louis was shaped by Louis Faidherbe, a French governor who also led brutal military campaigns in West Africa. What to do with his legacy has divided Senegal."
U.K. Local Elections Guide: What to Look For,https://www.nytimes.com/2022/05/05/world/europe/uk-local-elections-northern-ireland.html,"National politics may not be front and center in voters’ minds, but how they cast their ballots could signal their opinions of the main parties."
"Anti-Putin Russians Are Leaving, With a Push From the Kremlin",https://www.nytimes.com/2022/05/05/world/europe/russian-exiles-foreign-agents-putin.html,"Many Russians who are designated “foreign agents” by the government view it as another form of repression that makes living in the country, or returning to it, untenable."
Nicaragua’s Secretive Ruling Family Reaches Out Quietly to the U.S.,https://www.nytimes.com/2022/05/05/world/americas/nicaragua-ruling-family-us.html,"Sanctions intended to thwart the president’s dictatorial actions have hit his family and inner circle hard. More pain is expected as sanctions hit Russia, an ally."
Iraqis Choke Under a Blanket of Dust as Sandstorms Sweep the Country,https://www.nytimes.com/2022/05/05/world/middleeast/iraq-sandstorms-climate.html,"Orange skies signaled yet another dusty day for millions of Iraqis. It was the seventh such storm in recent months, and experts say more are on the way."
"What Is Russia’s May 9 Victory Day, and What Might Putin Say?",https://www.nytimes.com/2022/05/04/world/europe/russia-victory-day.html,"In the two decades that Vladimir V. Putin has led Russia, the country’s Victory Day marches, honoring Soviet sacrifices of World War II, have transformed into huge military spectacles and nostalgic celebrations."
Why Boris Johnson Will Be Tested in UK by Local Elections,https://www.nytimes.com/2022/05/05/world/europe/uk-elections-boris-johnson.html,The British prime minister is under fire for lockdown-breaking parties. But many voters are skeptical that the opposition can solve issues such as soaring prices.
"In Mexico, One Cartel Is Cleared, but Others Storm In",https://www.nytimes.com/2022/05/04/world/americas/mexico-cartels-michoacan.html,"In the state of Michoacán, small drug cartels compete with larger ones for territory, leaving the residents caught in the middle of a brutal turf war."
China’s Covid Lockdowns Leave Millions Out of Work,https://www.nytimes.com/2022/05/05/business/china-shanghai-covid-lockdown-economy.html,"Migrant workers and recent college graduates have been hit hardest by shuttered factories, closed construction sites and an anemic job market."
China’s Covid Policies Have European Companies Wary of Investing,https://www.nytimes.com/2022/05/05/business/china-covid-lockdown-europe.html,"Lockdowns and supply chain issues have soured European businesses in China on the idea of further investment in the country, a survey finds."
Turkey’s Plan to Draw Refugees Back to Syria: Homes for 1 Million,https://www.nytimes.com/2022/05/04/world/middleeast/turkey-syria-million-homes.html,"President Recep Tayyip Erdogan says Turkey will build homes, schools, hospitals and more in northern Syria, but experts question whether refugees will return willingly."
"Ricardo Alarcon, Diplomat and Castro Confidant, Dies at 84",https://www.nytimes.com/2022/05/05/world/americas/ricardo-alarcon-dead.html,"As Havana’s go-between with the U.S., he negotiated Elián González’s return to Cuba. He was also the country’s U.N. representative on two occasions."
Why the Battle for Mariupol Is Important for Putin,https://www.nytimes.com/2022/05/05/world/putin-war-mariupol-ukraine.html,A victory in the predominantly Russian-speaking city could give a veneer of credibility to the Russian leader’s false claims of ridding Ukraine of “Nazis.”
Europe’s Quest to Replace Russian Gas Faces Plenty of Hurdles,https://www.nytimes.com/2022/05/05/business/energy-environment/natural-gas-europe-russia-ukraine.html,"Climate concerns, investor reticence and political disputes complicate a shift to supplies from the United States, North Africa and the Mediterranean."
They Thought the Skulls Were Murder Victims’. They Were Off by Centuries.,https://www.nytimes.com/2022/05/05/world/americas/mexico-skulls-cave.html,"Originally thought to be the remnants of gang killings, dozens of skulls found in a cave in southern Mexico are now believed to be from sacrificial killings more than 1,000 years ago."
This Trump Play in London Is a Comedy. Unless You’re American.,https://www.nytimes.com/2022/05/05/theater/the-47th-play-trump-london.html,Mike Bartlett’s “The 47th” presents political turmoil in the United States for laughs. But some find it more like a horror story.
"Death Toll During Pandemic Far Exceeds Totals Reported by Countries, W.H.O. Says",https://www.nytimes.com/2022/05/05/health/covid-global-deaths.html,"Nearly 15 million more people died during the first two years of the pandemic than would have been expected during normal times, the organization found. The previous count of virus deaths, from countries’ reporting, was six million."
‘Not Good for Learning’,https://www.nytimes.com/2022/05/05/briefing/school-closures-covid-learning-loss.html,New research is showing the high costs of long school closures in some communities.
"Searching for What Connects Us, Carlo Rovelli Explores Beyond Physics",https://www.nytimes.com/2022/05/05/books/carlo-rovelli-physicist-book.html,"The physicist ranges widely — from black holes to Buddhism to climate change — in his new book, “There Are Places in the World Where Rules Are Less Important Than Kindness.”"
Why Climate Change Makes It Harder to Fight Fire With Fire,https://www.nytimes.com/2022/05/05/climate/wildfires-prescribed-burn.html,Worsening wildfires in recent years have led officials to embrace planned fires to thin forests before disaster strikes. But the warming world is making it tougher to do safely.
Your Thursday Briefing,https://www.nytimes.com/2022/05/05/briefing/russia-oil-embargo-victory-day.html,A planned embargo on Russian oil.
"Stanislav Shushkevich, First Leader of Post-Soviet Belarus, Dies at 87",https://www.nytimes.com/2022/05/04/world/europe/stanislav-shushkevich-dead.html,"He helped formalize the breakup of the Soviet Union in 1991, led his country until 1994, then became a vocal critic of his successor, Aleksandr G. Lukashenko."
"Putin Could Use Russia’s Victory Day to Expand Ukraine War, Some Fear",https://www.nytimes.com/2022/05/04/world/europe/ukraine-russia-putin-victory-day.html,The Russian holiday celebrating the Soviet triumph over Nazi Germany is viewed by Ukraine and NATO as a stage for the Russian president to proclaim a turn in the war.
Moderna Reaps $5.9 Billion From Its Vaccine Sales,https://www.nytimes.com/2022/05/04/world/moderna-covid-vaccine.html,"Stéphane Bancel, the company’s chief executive officer, said Moderna has $21 billion worth of advance purchase agreements for the vaccine."
Your Thursday Briefing: A Ban on Russian Oil?,https://www.nytimes.com/2022/05/04/briefing/your-thursday-briefing-a-ban-on-russian-oil.html,The E.U. proposed a total embargo.
NOAA Image Catches Wildfire Smoke and Dust on Collision Course,https://www.nytimes.com/2022/05/04/climate/wildfire-smoke-dust-storm.html,A time-lapse image of smoke from wildfires in New Mexico and dust from a storm in Colorado illustrates the scope of Western catastrophe.
European Union Takes a Leap With a Russian Oil Embargo,https://www.nytimes.com/2022/05/04/world/europe/eu-russia-oil-embargo.html,"The ban, once seen as unlikely, is a significant tightening of the squeeze on Russia’s economy, and a financial blow to Europe, too."
"Putin-Linked Superyacht May Elude Sanctions, by Setting Sail",https://www.nytimes.com/2022/05/04/world/europe/russia-putin-superyacht-sanctions.html,The Italian police are in a race to finish investigating a $700 million vessel thought to be the Russian president’s — before it’s out of their reach.
John Doerr Gives Stanford $1.1 Billion for Climate School,https://www.nytimes.com/2022/05/04/climate/john-doerr-stanford-climate.html,The billionaire venture capitalist said the study of climate change and sustainability would be the “new computer science.”
"In Pakistan, Violence by Baluch Separatists Destabilizes Region",https://www.nytimes.com/2022/05/04/world/asia/pakistan-baluchistan-violence.html,A government plagued by volatility is trying to quell a separatist movement in Baluchistan while also fighting other insurgencies and striving for economic development.
"Saving Ukrainian Art, and Helping Artists, One NFT at a Time",https://www.nytimes.com/2022/05/04/world/europe/ukraine-nft-art.html,"Lika Spivakovska, the owner of two art galleries in Kyiv, Ukraine, has partnered with an NFT gallery in Puerto Rico to auction off pictures of art damaged and created during the war. The money will go to Ukrainian artists and other humanitarian aid."
"Roe Inspired Activists Worldwide, Who May Be Rethinking Strategy",https://www.nytimes.com/2022/05/04/world/americas/abortion-activists-movements.html,"Feminist movements in some countries similarly sought abortion protections in their courts, but for others, the goal was legislative change."
