title,link,description
Putin sorry for Lavrov's claim Hitler was part Jewish - Israel PM,https://www.bbc.co.uk/news/world-middle-east-61339749?at_medium=RSS&at_campaign=KARANGA,"Russia's foreign minister claimed that Nazi leader Adolf Hitler had Jewish blood, sparking outrage."
"Ukraine war has dragged on, admits Putin ally Lukashenko",https://www.bbc.co.uk/news/world-europe-61339742?at_medium=RSS&at_campaign=KARANGA,Belarus's authoritarian leader Lukashenko has defended the war but wants it to end.
Donbas fighting: Risking capture to evacuate the vulnerable from the front line,https://www.bbc.co.uk/news/world-europe-61328947?at_medium=RSS&at_campaign=KARANGA,"Civilian volunteers are going to the front line, but some have been detained by Russian forces."
"Covid: World’s true pandemic death toll nearly 15 million, says WHO",https://www.bbc.co.uk/news/health-61327778?at_medium=RSS&at_campaign=KARANGA,These include deaths from Covid and from the indirect effects of the pandemic over two years worldwide.
China building collapse: Woman rescued from rubble after six days,https://www.bbc.co.uk/news/world-asia-china-61332324?at_medium=RSS&at_campaign=KARANGA,The collapse of a building in the city of Changsha is now known to have killed at least 26 people.
Kenya alarm after carrier bag mistaken for stray lion,https://www.bbc.co.uk/news/world-africa-61335539?at_medium=RSS&at_campaign=KARANGA,The Kenyan villagers were on alert after some of their livestock had recently gone missing.
Elon Musk lines up $7bn backing for Twitter deal,https://www.bbc.co.uk/news/business-61337622?at_medium=RSS&at_campaign=KARANGA,The billionaire has tapped the likes of Oracle's Larry Ellison and Sequoia to finance the takeover.
"Iraq dust storm leaves 5,000 people needing treatment",https://www.bbc.co.uk/news/world-middle-east-61335124?at_medium=RSS&at_campaign=KARANGA,"It is the seventh severe dust storm in weeks, turning skies orange and causing breathing problems."
Senegal midwives go on trial in Louga over Astou Sokhna's death,https://www.bbc.co.uk/news/world-africa-61335534?at_medium=RSS&at_campaign=KARANGA,"Astou Sokhna died after reportedly being refused a Caesarean, sparking a national outcry."
Turkey's cost of living soars nearly 70%,https://www.bbc.co.uk/news/business-61332272?at_medium=RSS&at_campaign=KARANGA,Everyday goods including food and transport costs have seen among the biggest annual increases.
Why 9 May Victory Day is so important for Russia,https://www.bbc.co.uk/news/world-europe-61332283?at_medium=RSS&at_campaign=KARANGA,"Vladimir Putin has made it an annual event, but amid war in Ukraine 9 May has taken on new significance."
'There's power in names': Antigua unearths lost ancestors,https://www.bbc.co.uk/news/world-latin-america-61174988?at_medium=RSS&at_campaign=KARANGA,A landmark genealogy project is unearthing the names of enslaved people whose stories were erased.
Wealthy Russians flee to Dubai to avoid sanctions,https://www.bbc.co.uk/news/business-61257448?at_medium=RSS&at_campaign=KARANGA,"Property purchases by Russians in Dubai surged by 67% in the first quarter of 2022, a report says."
Myanmar civil war: ‘I saw my son’s body on Facebook’,https://www.bbc.co.uk/news/world-asia-india-61327821?at_medium=RSS&at_campaign=KARANGA,"After the Myanmar military entered his village, Joseph fled into the jungle but his 13-year-old was killed."
Africa's digital business: The women swapping shops for smartphones,https://www.bbc.co.uk/news/world-africa-61318779?at_medium=RSS&at_campaign=KARANGA,Three African women explain how they have boosted their income by going digital since Covid.
Bill Gates on Elon Musk feud and Jeffrey Epstein meetings,https://www.bbc.co.uk/news/technology-61329167?at_medium=RSS&at_campaign=KARANGA,"The Microsoft tycoon talks to the BBC about divorce, conspiracy theories and Elon Musk."
Why Sigrid feels on top of the world,https://www.bbc.co.uk/news/entertainment-arts-61271404?at_medium=RSS&at_campaign=KARANGA,"The pop star talks lockdown blues, singing Nirvana at school, and why she moved all her gold discs."
How Covid-scarred Shanghai will finally exit lockdown,https://www.bbc.co.uk/news/world-asia-china-61307148?at_medium=RSS&at_campaign=KARANGA,"A mass clean-up is sweeping through Shanghai, with the city's gradual reopening expected to follow."
Russia rehearses World War Two victory parade,https://www.bbc.co.uk/news/world-europe-61333748?at_medium=RSS&at_campaign=KARANGA,"Military vehicles, weapons and soldiers were on display at a rehearsal for Russia's Victory Day parade."
Dust storm and wildfires seen from space,https://www.bbc.co.uk/news/world-us-canada-61333747?at_medium=RSS&at_campaign=KARANGA,Satellite images show gusts of up to 60mph blowing dust across Colorado and plumes of smoke in New Mexico.
Disabled children 'dumped' in Ukrainian institutions,https://www.bbc.co.uk/news/world-europe-61325277?at_medium=RSS&at_campaign=KARANGA,Thousands of disabled Ukrainian children reportedly left in institutions that can’t care for them.
Durban floods survivors: 'I thought the world was ending',https://www.bbc.co.uk/news/world-africa-61325457?at_medium=RSS&at_campaign=KARANGA,"Moeketsi Manake and his family talk about losing everything, including their house, in the Durban floods."
Hungary will veto EU oil ban proposal - minister,https://www.bbc.co.uk/news/world-europe-61319518?at_medium=RSS&at_campaign=KARANGA,Zoltán Kovács says the proposal is against the country's interests and would ruin the Hungarian economy.
Ukraine: Putin 'apologizes' to Israeli PM over Russia's Holocaust remarks — live updates,https://www.dw.com/en/ukraine-putin-apologizes-to-israeli-pm-over-russia-s-holocaust-remarks-live-updates/a-61688699?maca=en-rss-en-all-1573-rdf,Russia's President Vladimir Putin discussed the war in Ukraine with Israel's Prime Minister Naftali Bennett after his foreign minister infuriated Israel with comments about Hitler. Follow DW for the latest.
"Champions League: Real Madrid, Karim Benzema and the greatest remontada of all",https://www.dw.com/en/champions-league-real-madrid-karim-benzema-and-the-greatest-remontada-of-all/a-61699179?maca=en-rss-en-all-1573-rdf,"Karim Benzema was the hero once again as Real Madrid produced another stunning comeback to shock Manchester City and reach the Champions League final. Impossible, unthinkable, unimaginable – yet not for the first time."
"RECOMMENDED — Western companies are leaving Russia, taking Russian jobs with them. DW spoke to people who are now unemployed.",https://www.dw.com/en/recommended-western-companies-are-leaving-russia-taking-russian-jobs-with-them-dw-spoke-to-people-who-are-now-unemployed/a-61697175?maca=en-rss-en-all-1573-rdf,"More and more Russians are losing their jobs due to western sanctions on Russia, and some are having to painfully rethink their future. With some sanctions' effects yet to be felt, the number of unemployed could grow."
Habeck: LNG lawsuit hinders German efforts to move away from Russian energy,https://www.dw.com/en/habeck-lng-lawsuit-hinders-german-efforts-to-move-away-from-russian-energy/a-61697725?maca=en-rss-en-all-1573-rdf,The Economy and Climate Minister says the legal action against the accelerated construction of an import terminal for liquefied natural gas will make it harder to move away from Russian energy.
Moldova: 'I'm worried about the children',https://www.dw.com/en/moldova-i-m-worried-about-the-children/a-61675279?maca=en-rss-en-all-1573-rdf,"In villages close to the breakaway Moldovan region of Trans-Dniester, many residents fear they could be dragged into Russia's war on Ukraine. For some, the current events bring back painful memories of conflict."
WHO estimates nearly 15 million deaths linked to COVID pandemic,https://www.dw.com/en/who-estimates-nearly-15-million-deaths-linked-to-covid-pandemic/a-61696320?maca=en-rss-en-all-1573-rdf,"The World Health Organization said more than twice as many people died as a result of the COVID pandemic than official data shows, if including deaths of other causes that might not have occurred in more typical times."
Zelenskyy tells donor conference: 'Freedom must protect and provide',https://www.dw.com/en/zelenskyy-tells-donor-conference-freedom-must-protect-and-provide/a-61696221?maca=en-rss-en-all-1573-rdf,"Poland and Sweden hosted an international donors' conference to raise aid for Ukraine. President Volodymyr Zelenskyy urged donors to show that ""freedom"" protects better than ""tyranny."""
Why is India falling in the World Press Freedom Index?,https://www.dw.com/en/why-is-india-falling-in-the-world-press-freedom-index/a-61697180?maca=en-rss-en-all-1573-rdf,"India fell eight places in the World Press Freedom Index, down to 150 out of 180 countries. Critics say the ranking reflects increased pressure and violence against journalists."
Think 8 hours of sleep is best? Think again!,https://www.dw.com/en/think-8-hours-of-sleep-is-best-think-again/a-61661946?maca=en-rss-en-all-1573-rdf,Are you 38 or older? Then you may want to rethink how much sleep you truly need. A team of international researchers has found that less is more.
"Ukraine conflict: Steinmeier and Zelenskyy have 'good, constructive, important conversation'",https://www.dw.com/en/ukraine-conflict-steinmeier-and-zelenskyy-have-good-constructive-important-conversation/a-61696571?maca=en-rss-en-all-1573-rdf,"The German president and Chancellor Olaf Scholz have both been invited to Kyiv, according to Frank-Walter Steinmeier's office. He had planned to go to Kyiv in April, but was told not to come on the eve of his trip."
5 things we can learn from Marlene Dietrich,https://www.dw.com/en/5-things-we-can-learn-from-marlene-dietrich/a-60195584?maca=en-rss-en-all-1573-rdf,"Marlene Dietrich died on May 6, 1992 — 30 years ago. She fled the Nazis and conquered Hollywood. She remains a role model in times of crisis."
Ukraine: How farm vehicles stolen by Russia were remotely disabled,https://www.dw.com/en/ukraine-how-farm-vehicles-stolen-by-russia-were-remotely-disabled/a-61691839?maca=en-rss-en-all-1573-rdf,"Russian soldiers looted combine harvesters and tractors worth millions of dollars from Ukraine, according to a media report. But the machinery was deactivated remotely before it could be put to use."
Brittney Griner's Russian detention highlights WNBA's growing problem,https://www.dw.com/en/brittney-griner-s-russian-detention-highlights-wnba-s-growing-problem/a-61692245?maca=en-rss-en-all-1573-rdf,"The WNBA is seen as the world's best women's basketball league. However, the arrest of one of its biggest stars has highlighted problems involving time and money that are forcing players to go abroad in the off-season."
ECOWAS criticized over West African coups,https://www.dw.com/en/ecowas-criticized-over-west-african-coups/a-61685721?maca=en-rss-en-all-1573-rdf,"The Economic Community of West African States has reacted to putsches in the region with appeals, sanctions or troop deployments. But criticism of the bloc's inconsistent actions is growing."
Can Indonesia and Germany build ties ahead of major summits?,https://www.dw.com/en/can-indonesia-and-germany-build-ties-ahead-of-major-summits/a-61694532?maca=en-rss-en-all-1573-rdf,"Indonesia has been invited by Germany to attend the G7 summit in June, raising hopes of more bilateral cooperation amid a thorny geopolitical landscape."
EU threatens Vladimir Putin's Patriarch Kirill,https://www.dw.com/en/eu-threatens-vladimir-putin-s-patriarch-kirill/a-61696343?maca=en-rss-en-all-1573-rdf,Patriarch Kirill of Moscow is an ally of Russian President Vladimir Putin and shares his anti-Western views. That's made him a target of European Union sanctions.
Bank of England raises interest rates to 13-year-high,https://www.dw.com/en/bank-of-england-raises-interest-rates-to-13-year-high/a-61694671?maca=en-rss-en-all-1573-rdf,It is the fourth month in a row the central bank's Monetary Policy Committee has voted for a rise. Policymakers are currently trying to stem inflation amid high energy prices sparked partly by Russia's war in Ukraine.
Bitcoin boom spikes amid perceived risks,https://www.dw.com/en/bitcoin-boom-spikes-amid-perceived-risks/a-61686615?maca=en-rss-en-all-1573-rdf,Central African Republic and El Salvador have made Bitcoin legal tender and Panama has approved a bill to regulate crypto assets. Experts warn that nations that adopt crypto currencies risk instability.
Documenta cancels talks amid antisemitism row,https://www.dw.com/en/documenta-cancels-talks-amid-antisemitism-row/a-61692036?maca=en-rss-en-all-1573-rdf,"The 2022 edition of the world-famous contemporary art show has suddenly axed discussions on the topic of artistic freedom, which had planned to address accusations of antisemitism."
"UK regional elections: Boris Johnson under scrutiny, historic vote in N. Ireland predicted",https://www.dw.com/en/uk-regional-elections-boris-johnson-under-scrutiny-historic-vote-in-n-ireland-predicted/a-61691869?maca=en-rss-en-all-1573-rdf,"The British prime minister has faced calls to step down after breaking COVID lockdown rules. In Northern Ireland, polls suggest the Irish nationalist party Sinn Fein could win the largest number of seats."
New German open letter: 'Yes' to weapons for Ukraine,https://www.dw.com/en/new-german-open-letter-yes-to-weapons-for-ukraine/a-61692748?maca=en-rss-en-all-1573-rdf,"Pianist Igor Levit, Nobel laureate Herta Müller and 55 other intellectuals have sent an appeal to Chancellor Olaf Scholz. They say Germany should supply heavy weapons to Ukraine."
More than prayers: The faithful who aid Ukraine's front line,https://www.dw.com/en/more-than-prayers-the-faithful-who-aid-ukraine-s-front-line/a-61689192?maca=en-rss-en-all-1573-rdf,"In western Ukraine, a religious community led by Greek-Catholic monks is supporting the war effort by providing clothes and medical supplies for soldiers on the front line."
China's COVID curbs rattle EU business confidence,https://www.dw.com/en/china-s-covid-curbs-rattle-eu-business-confidence/a-61691204?maca=en-rss-en-all-1573-rdf,"More European businesses in China are looking to shift their investments due to the country's strict coronavirus lockdowns, according to the European Chamber of Commerce."
India: Policeman arrested for raping alleged child gang rape victim,https://www.dw.com/en/india-policeman-arrested-for-raping-alleged-child-gang-rape-victim/a-61690818?maca=en-rss-en-all-1573-rdf,Police in India arrested an officer accused of raping a 13-year-old girl who had gone to the police station to file a gang-rape case.
Germany plans documentation center on Nazi occupation in Europe,https://www.dw.com/en/germany-plans-documentation-center-on-nazi-occupation-in-europe/a-61690542?maca=en-rss-en-all-1573-rdf,"Almost 80 years after the end of the Second World War, the German government has approved a concept for a documentation center in Berlin. Its focus: the effects of the Nazi era in Europe."
What are millets and can they help create global food security?,https://www.dw.com/en/what-are-millets-and-can-they-help-create-global-food-security/a-61682721?maca=en-rss-en-all-1573-rdf,The Russian invasion of Ukraine has pushed food insecurity onto the table. Could an overlooked cereal help steady the situation and feed the global population in an era of climate crisis?
Germany: Woman sentenced for poking holes in partner's condoms,https://www.dw.com/en/germany-woman-sentenced-for-poking-holes-in-partner-s-condoms/a-61689670?maca=en-rss-en-all-1573-rdf,"In what the judge described as a ""historic"" case, a woman has been found guilty of sexual assault after poking holes in her partner's condoms without his knowledge or consent."
'Navalny' documentary hits theaters in Germany,https://www.dw.com/en/navalny-documentary-hits-theaters-in-germany/a-61683768?maca=en-rss-en-all-1573-rdf,"Being an outspoken enemy of the Kremlin nearly cost Alexei Navalny his life. In this documentary that feels like a spy thriller, Putin's rival uncovers the facts about his poisoning."
Germany's Scholz: 'Western Balkans belong in Europe',https://www.dw.com/en/germany-s-scholz-western-balkans-belong-in-europe/a-61688348?maca=en-rss-en-all-1573-rdf,The leaders of Serbia and Kosovo met with German Chancellor Olaf Scholz in Berlin. Leaders voiced optimism at the prospect of both joining the European Union.
Champions League: Jürgen Klopp's Liverpool to meet Real Madrid in 2018 re-run,https://www.dw.com/en/champions-league-jürgen-klopp-s-liverpool-to-meet-real-madrid-in-2018-re-run/a-61678834?maca=en-rss-en-all-1573-rdf,"Real Madrid will meet Liverpool in the Champions League final following Madrid's late turnaround against Manchester City. It's a repeat of the 2018 final, with Jürgen Klopp determined not to let history repeat itself."
Scholz stands firm on Ukraine visit amid criticism at home and abroad,https://www.dw.com/en/scholz-stands-firm-on-ukraine-visit-amid-criticism-at-home-and-abroad/a-61687080?maca=en-rss-en-all-1573-rdf,"Chancellor Olaf Scholz addressed Ukraine's refusal to welcome President Frank-Walter Steinmeier again Wednesday, calling it ""a problem for the German people."" He said Kyiv needed to do its part to resolve the issue."
Ukraine: How drones are changing the way of war,https://www.dw.com/en/ukraine-how-drones-are-changing-the-way-of-war/a-61681013?maca=en-rss-en-all-1573-rdf,The war in Ukraine shows that unmanned aerial vehicles are part of modern warfare. Drones have various tasks from aerial surveillance to missile defense.
German Overshoot Day: 'We cannot continue like this',https://www.dw.com/en/german-overshoot-day-we-cannot-continue-like-this/a-61673016?maca=en-rss-en-all-1573-rdf,Germany has used more resources in the first third of 2022 than are sustainably available to it for an entire year. Here's what needs to change.
North Korea cracks down on 'capitalist' pop culture,https://www.dw.com/en/north-korea-cracks-down-on-capitalist-pop-culture/a-61682842?maca=en-rss-en-all-1573-rdf,Some North Koreans are defying strict fashion and style regulations to fight conformity. But their expressions of individualism could cost them their freedom.
DW documentary 'Guardians of Truth' premieres in Berlin,https://www.dw.com/en/dw-documentary-guardians-of-truth-premieres-in-berlin/a-61683697?maca=en-rss-en-all-1573-rdf,Turkish journalist Can Dündar and Mexican investigative journalist Anabel Hernandez both live in exile. They share their stories in a new documentary and at the Berlin premiere.
COVID: Omicron variants are 'escaping previous immunity',https://www.dw.com/en/covid-omicron-variants-are-escaping-previous-immunity/a-61673415?maca=en-rss-en-all-1573-rdf,"You may be at risk of catching new COVID subvariants BA.4 or BA.5 even if you had the original omicron, as virologist Alex Sigal told DW's Science Unscripted."
Germany warns prices may spike as Russia sanctions tighten,https://www.dw.com/en/germany-warns-prices-may-spike-as-russia-sanctions-tighten/a-61681026?maca=en-rss-en-all-1573-rdf,Germany's Cabinet has wrapped two days and talks about the war in Ukraine and its impact on the German economy. The government warned that a planned EU oil embargo could cause supply problems and even higher inflation.
Ukrainian troops get training in Germany,https://www.dw.com/en/ukrainian-troops-get-training-in-germany/a-61682712?maca=en-rss-en-all-1573-rdf,Ukrainian soldiers are receiving weapons training on military bases in Germany. Legal advisers are discussing whether that makes Germany a party to war.
Open letter about weapons deliveries to Ukraine draws criticism,https://www.dw.com/en/open-letter-about-weapons-deliveries-to-ukraine-draws-criticism/a-61660104?maca=en-rss-en-all-1573-rdf,The publication of an open letter to German Chancellor Scholz signed by leading cultural figures has triggered a fierce debate about the planned delivery of heavy weapons to Ukraine — especially on social media.
Can Algeria contribute to the EU's energy security?,https://www.dw.com/en/can-algeria-contribute-to-the-eu-s-energy-security/a-61680466?maca=en-rss-en-all-1573-rdf,"Timely decisions, long-term commitments and a broader vision could help the European Union increase ties with the Western Mediterranean. Algeria, with its large reserves, could enhance the bloc's energy security."
DOK.fest Munich puts spotlight on Ukraine,https://www.dw.com/en/dok-fest-munich-puts-spotlight-on-ukraine/a-61674310?maca=en-rss-en-all-1573-rdf,"After a two-year break due to the pandemic, the documentary film festival is once again held in cinemas. A political thriller about Alexei Navalny opens the event."
Will buying cars online really take off?,https://www.dw.com/en/will-buying-cars-online-really-take-off/a-61676761?maca=en-rss-en-all-1573-rdf,"Boosted by the popularity of electric automaker Tesla, more people than ever are buying vehicles online. UBS estimates the web will make up half of all car sales by 2030, but what will that mean for traditional dealers?"
Breed accounts for less than 10% of a dog's behavior,https://www.dw.com/en/breed-accounts-for-less-than-10-of-a-dog-s-behavior/a-61634800?maca=en-rss-en-all-1573-rdf,"If you're looking for a dog with a specific personality, its breed will tell you less than the environment in which it is raised, a new study suggests."
To be fire and flame: German expressions with 'fire',https://www.dw.com/en/to-be-fire-and-flame-german-expressions-with-fire/a-56983232?maca=en-rss-en-all-1573-rdf,"May 4 marks International Firefighters' Day — a time to honor their work, while also learning some German expressions involving fire."
Will an EU oil embargo put the lights out at Schwedt's refinery?,https://www.dw.com/en/will-an-eu-oil-embargo-put-the-lights-out-at-schwedt-s-refinery/a-61668807?maca=en-rss-en-all-1573-rdf,"As EU member states push for a Russian oil embargo, Germany's PCK Schwedt refinery is facing an uncertain future. It runs wholly on Russian imports, and many locals aren't so sure alternatives can be found in time."
Carbon farming: Climate change solution or greenwashing?,https://www.dw.com/en/carbon-farming-climate-change-solution-or-greenwashing/a-61532175?maca=en-rss-en-all-1573-rdf,European agriculture produces millions of tons of CO2 every year. Could encouraging farmers to capture carbon on their land to sell credits to businesses help reduce emissions?
'Zombie TV': The disintegration of Russia's free press,https://www.dw.com/en/zombie-tv-the-disintegration-of-russia-s-free-press/a-61661855?maca=en-rss-en-all-1573-rdf,"On World Press Freedom Day, a look at how Russia's media has evolved since the 1990s: 37 journalists have been murdered in Russia since Vladimir Putin took office in 2000."
DW documentary series 'Guardians of Truth' looks at press freedom,https://www.dw.com/en/dw-documentary-series-guardians-of-truth-looks-at-press-freedom/a-61657700?maca=en-rss-en-all-1573-rdf,"In this new DW documentary series, exiled Turkish journalist Can Dündar meets Mexican journalist Anabel Hernandez. Both have paid a high price for their fight for truth."
Bundesliga: Leverkusen jubilant as top-four race tilts away from RB Leipzig,https://www.dw.com/en/bundesliga-leverkusen-jubilant-as-top-four-race-tilts-away-from-rb-leipzig/a-61666300?maca=en-rss-en-all-1573-rdf,"Monday's doubleheader saw Leverkusen tighten their grip on a top four place in the Bundesliga. While Moussa Diaby and Patrik Schick shone for Leverkusen against Frankfurt, RB Leipzig crashed in Mönchengladbach."
Germans split over heavy weapons deliveries to Ukraine,https://www.dw.com/en/germans-split-over-heavy-weapons-deliveries-to-ukraine/a-61664515?maca=en-rss-en-all-1573-rdf,The German public is divided on the issue of military support for Ukraine. Many fear the delivery of tanks and training of Ukrainian soldiers in Germany may drag the country into the war.
Is India facing a post-pandemic employment crisis?,https://www.dw.com/en/is-india-facing-a-post-pandemic-employment-crisis/a-61662629?maca=en-rss-en-all-1573-rdf,"India's job market is tightening, and skilled workers are finding it harder to enter the workforce. Government job drives and the informal economy have been unable to make up the difference."
What are the COVID entry rules for travelers to European countries?,https://www.dw.com/en/what-are-the-covid-entry-rules-for-travelers-to-european-countries/a-58017284?maca=en-rss-en-all-1573-rdf,Most European countries have lifted travel restrictions — despite ongoing high infection numbers. DW Travel has compiled this overview of EU rules.
Record-breaking heat waves show we need to adapt to the climate crisis now,https://www.dw.com/en/record-breaking-heat-waves-show-we-need-to-adapt-to-the-climate-crisis-now/a-61661802?maca=en-rss-en-all-1573-rdf,"India is just the latest country to face life-threatening temperatures before summer has even started. As extreme heat becomes more frequent around the world, how can affected areas adapt to remain livable?"
COVID travel restrictions: Germany,https://www.dw.com/en/covid-travel-restrictions-germany/a-60771733?maca=en-rss-en-all-1573-rdf,"Travel in Europe is subject to COVID-19 restrictions. The omicron variant has led to higher numbers of infections, which are often less severe. This is how Germany is responding to the current situation."
The story of Germany's national anthem,https://www.dw.com/en/the-story-of-germany-s-national-anthem/a-61638407?maca=en-rss-en-all-1573-rdf,"Created in the 19th century, the ""Deutschlandlied"" was sullied by the Nazis. Germany decided 70 years ago it would adopt only the third verse of the original song as its national anthem."
