title,link,description
IOC calls on sports federations to exclude Russia and Belarus,https://www.dw.com/en/ioc-calls-on-sports-federations-to-exclude-russia-and-belarus/a-60949051?maca=en-rss-en-all-1573-rdf,The IOC has called on sports federations to exclude Russian and Belarusian athletes from international events. This is the latest response from the sporting world to Russia's invasion of Ukraine.
"Will Musk's Starlink save Ukraine, SpaceX save the ISS?",https://www.dw.com/en/will-musk-s-starlink-save-ukraine-spacex-save-the-iss/a-60948531?maca=en-rss-en-all-1573-rdf,Tech tycoon Elon Musk has indicated he will protect the internet in Ukraine and the world from the International Space Station if it crashes to Earth. But how?
Russia's economy in crisis as sanctions bite,https://www.dw.com/en/russia-s-economy-in-crisis-as-sanctions-bite/a-60943968?maca=en-rss-en-all-1573-rdf,The war in Ukraine has prompted huge financial sanctions against Russia. The escalating list of measures is starting to severely impact the country's economy. The stock exchange is closed and people are queueing at ATMs.
Schalke to end sponsorship agreement with Gazprom,https://www.dw.com/en/schalke-to-end-sponsorship-agreement-with-gazprom/a-60930045?maca=en-rss-en-all-1573-rdf,Schalke is in talks over terminating its partnership with longtime kit sponsor Gazprom. This comes after the Bundesliga 2 outfit removed Gazprom from its jerseys as a result of Russia’s invasion of Ukraine.
IPCC depicts unfolding climate emergency,https://www.dw.com/en/ipcc-depicts-unfolding-climate-emergency/a-60938009?maca=en-rss-en-all-1573-rdf,"The latest Intergovernmental Panel on Climate Change report details a widespread climate catastrophe, along with ways to address — and fund — adaptation and resilience in vulnerable regions."
Opinion: Time to rethink climate adaptation,https://www.dw.com/en/opinion-time-to-rethink-climate-adaptation/a-60940384?maca=en-rss-en-all-1573-rdf,A major new report highlights the need for humans to stop climate change in order to protect their own well-being. DW's Heather Moore says it's time to listen.
"EU, US, UK to exclude some Russian banks from SWIFT",https://www.dw.com/en/eu-us-uk-to-exclude-some-russian-banks-from-swift/a-60931401?maca=en-rss-en-all-1573-rdf,European Commission President Ursula von der Leyen says the move aims to harm Russia's ability to finance its war in Ukraine.
"Opinion: After legitimizing Putin, sport criticizes Russia",https://www.dw.com/en/opinion-after-legitimizing-putin-sport-criticizes-russia/a-60924062?maca=en-rss-en-all-1573-rdf,"Some of the world's top athletes and sporting organizations are all joining in the chorus to condemn Russia's invasion of Ukraine. That's nice, DW's Marko Langer writes, but it's a bit late."
Russians take Chernobyl ― What we know,https://www.dw.com/en/russians-take-chernobyl-―-what-we-know/a-60921177?maca=en-rss-en-all-1573-rdf,Russia’s capture of the Chernobyl nuclear power plant raises concerns of nuclear safety. Here’s a look into the state of the facility and its reactors.
How can I reduce my gas consumption?,https://www.dw.com/en/how-can-i-reduce-my-gas-consumption/a-60916991?maca=en-rss-en-all-1573-rdf,"Gas prices have risen to record levels in recent months — and the Russian invasion of Ukraine won't help matters, especially in Europe. What can we do to reduce our dependence on natural gas?"
Why some Polish haulers are relocating to Germany,https://www.dw.com/en/why-some-polish-haulers-are-relocating-to-germany/a-60890768?maca=en-rss-en-all-1573-rdf,The number of Polish haulers moving their operations to Germany as the EU Mobility Package and Polish tax reforms kick in is rising. But many say the deluge that was expected is unlikely to materialize.
Does this picture tell the real story of corporate Germany?,https://www.dw.com/en/does-this-picture-tell-the-real-story-of-corporate-germany/a-60896179?maca=en-rss-en-all-1573-rdf,"A picture from the Munich Security Conference commanded global attention, yet it had nothing to do with the Ukraine conflict. For many, the all-male ""CEO Lunch"" photo represents the reality of corporate Germany."
Bracing for sanctions: German businesses react to Russia's invasion of Ukraine,https://www.dw.com/en/bracing-for-sanctions-german-businesses-react-to-russia-s-invasion-of-ukraine/a-60904981?maca=en-rss-en-all-1573-rdf,"For years, Germany's policy on Russia has been to promote political change through trade. Now, German companies with investments in Russia and in Ukraine are faced with imperiled staff and expensive uncertainties."
"'Superlative' pterosaur, world's biggest mid-Jurassic flying animal, found in Scotland",https://www.dw.com/en/superlative-pterosaur-world-s-biggest-mid-jurassic-flying-animal-found-in-scotland/a-60903517?maca=en-rss-en-all-1573-rdf,"A skeleton of the biggest animal to have flown during the Middle Jurassic was discovered on the Isle of Skye, Scotland. This is one of the best-preserved fossils in UK's history, researchers who found it told DW."
COVID: Sanofi-GSK ask regulators to approve new protein-based vaccine,https://www.dw.com/en/covid-sanofi-gsk-ask-regulators-to-approve-new-protein-based-vaccine/a-60899898?maca=en-rss-en-all-1573-rdf,Creators of a new protein-based coronavirus vaccine say it is 100% effective at preventing severe illness and hospitalization.
Can cryptocurrency ever be environmentally friendly?,https://www.dw.com/en/can-cryptocurrency-ever-be-environmentally-friendly/a-60818440?maca=en-rss-en-all-1573-rdf,A Costa Rican hydropower plant has transformed into a green crypto-mining operation. But can energy-hungry cryptocurrencies such as bitcoin ever be compatible with climate targets?
France and China link up in global infrastructure projects,https://www.dw.com/en/france-and-china-link-up-in-global-infrastructure-projects/a-60890734?maca=en-rss-en-all-1573-rdf,"Paris and Beijing have agreed to build infrastructure projects in Africa, South East Asia and Eastern Europe. But will this help shine light on China’s opaque foreign investments? Or just give the appearance of doing so?"
COVID: Is England scrapping self-isolation too soon?,https://www.dw.com/en/covid-is-england-scrapping-self-isolation-too-soon/a-60891915?maca=en-rss-en-all-1573-rdf,"England is ditching self-isolation for positive COVID-19 cases, leaving scientists concerned about variants, the spread of the coronavirus and sick people being forced to work."
"Wildfires to increase up to 30% by 2050, experts warn",https://www.dw.com/en/wildfires-to-increase-up-to-30-by-2050-experts-warn/a-60874478?maca=en-rss-en-all-1573-rdf,"The intense, destructive fires that have dominated headlines in recent years are expected to become more frequent, even in places like the Arctic. Experts warn our response must shift toward planning and preparedness."
BioNTainers and co: The disjointed quest to produce COVID mRNA vaccines in Africa,https://www.dw.com/en/biontainers-and-co-the-disjointed-quest-to-produce-covid-mrna-vaccines-in-africa/a-60854125?maca=en-rss-en-all-1573-rdf,"The European Union-African Union summit brought dissonant news about COVID-19 mRNA vaccine development in Africa, revealing cracks in collaboration between the world's largest drug companies and the WHO."
Can genetic engineering make meat sustainable?,https://www.dw.com/en/can-genetic-engineering-make-meat-sustainable/a-60869271?maca=en-rss-en-all-1573-rdf,Climate-friendly sheep and salmon that eat less yet grow faster. Researchers are using genetic engineering to design animals for the livestock farming of the future.
25 years of Dolly: What’s become of the world’s first cloned sheep?,https://www.dw.com/en/25-years-of-dolly-what-s-become-of-the-world-s-first-cloned-sheep/a-60864024?maca=en-rss-en-all-1573-rdf,"Dolly the infamous sheep was cloned 25 years ago. Since then, major progress has been made in stem cell research. And lots of other animals have been cloned ― including, yes, pets."
How the climate crisis is threatening our energy supply,https://www.dw.com/en/how-the-climate-crisis-is-threatening-our-energy-supply/a-60853502?maca=en-rss-en-all-1573-rdf,"Whether it's heat or heavy rain, the consequences of climate change are putting our energy security at risk. Oil, gas and nuclear energy are particularly vulnerable. So what does that mean for our future?"
Cryptocurrency and football's perfect match causes concerns,https://www.dw.com/en/cryptocurrency-and-football-s-perfect-match-causes-concerns/a-60849328?maca=en-rss-en-all-1573-rdf,"The worlds of professional football and cryptocurrency have become increasingly enmeshed over the past year. Critics say it is reckless that the game has got so tied up with the unregulated, volatile sector."
Ethiopia grapples with severe drought,https://www.dw.com/en/ethiopia-grapples-with-severe-drought/a-60831029?maca=en-rss-en-all-1573-rdf,Nearly 7 million people in Ethiopia's drought-hit regions need urgent help after a third failed rainy season devastates pastoralist communities.
How to find hope in the face of the climate crisis,https://www.dw.com/en/how-to-find-hope-in-the-face-of-the-climate-crisis/a-60716665?maca=en-rss-en-all-1573-rdf,"Amidst frightening data and frustratingly slow political action, DW asked people working in climate activism, research and science what gives them grounds for optimism."
US college enrollment another victim of COVID?,https://www.dw.com/en/us-college-enrollment-another-victim-of-covid/a-60767851?maca=en-rss-en-all-1573-rdf,"For a decade, US student enrollment numbers in undergraduate programs have been headed down. With wages up, ever more would-be students seem attracted to paychecks rather than higher education."
Oligarch's death sends Czech giant west,https://www.dw.com/en/oligarch-s-death-sends-czech-giant-west/a-60809142?maca=en-rss-en-all-1573-rdf,"A year after the death of Czech oligarch Petr Kellner, PPF Group — the conglomerate he left behind — appears to be retreating from his bet on eastern markets."
"Your car hosts more bacteria than your toilet seat, research shows",https://www.dw.com/en/your-car-hosts-more-bacteria-than-your-toilet-seat-research-shows/a-60715116?maca=en-rss-en-all-1573-rdf,It's easy to understand why toilets are gross. But cars may be worse. A study has found that cars can host more germs than the average toilet seat.
"Tschüss, cars: a path to sustainable transportation emerges in German countryside",https://www.dw.com/en/tschüss-cars-a-path-to-sustainable-transportation-emerges-in-german-countryside/a-60783207?maca=en-rss-en-all-1573-rdf,"In rural parts of Germany, it's nearly impossible to get by without your own car. But a few simple changes could make a big difference."
Lingering colonial legacies: The study of skin is too white,https://www.dw.com/en/lingering-colonial-legacies-the-study-of-skin-is-too-white/a-60632976?maca=en-rss-en-all-1573-rdf,"The historical lack of racial representation in dermatology textbooks isn't just a problem in countries with majority white populations, but across the globe."
Period products: How menstruation is managed around the world,https://www.dw.com/en/period-products-how-menstruation-is-managed-around-the-world/a-60776504?maca=en-rss-en-all-1573-rdf,"In the early 20th century, rags were used to manage periods. Since then, lots of options have been developed to make menstruating far more comfortable. But many across the world are still ""on the rag"" — literally."
Experts say falling in love is great but watch your heart,https://www.dw.com/en/experts-say-falling-in-love-is-great-but-watch-your-heart/a-60768714?maca=en-rss-en-all-1573-rdf,"Experts say that falling in love enhances your well-being. But they stress the importance of watching your heart while doing so, especially for older people with blood vessel blockages or heart attack survivors."
Cocoa farming for forest conservation in Ghana,https://www.dw.com/en/cocoa-farming-for-forest-conservation-in-ghana/a-60636978?maca=en-rss-en-all-1573-rdf,Cocoa cultivated in Ghana's forests is encroaching on natural ecosystems. Boosting the productivity of existing plantations could keep their expansion in check.
Chinese 'space cleaner' spotted grabbing and throwing away old satellite,https://www.dw.com/en/chinese-space-cleaner-spotted-grabbing-and-throwing-away-old-satellite/a-60658574?maca=en-rss-en-all-1573-rdf,"Last month, a private satellite tracking company spotted a Chinese spacecraft apparently grabbing and throwing a dead satellite away into a ""graveyard"" orbit."
COVID: Chinese researchers develop 4-minute PCR test,https://www.dw.com/en/covid-chinese-researchers-develop-4-minute-pcr-test/a-60699247?maca=en-rss-en-all-1573-rdf,Researchers at Fudan University in Shanghai say they have developed a technology combining the speed of the rapid antigen test with the accuracy of PCR testing.
Indian megacity maps environmental memories,https://www.dw.com/en/indian-megacity-maps-environmental-memories/a-60649773?maca=en-rss-en-all-1573-rdf,Pollution and rampant construction have destroyed much of Mumbai's natural coastal protection. Could recording stories from locals help create alternative visions of urban development?
Live Updates: Russia’s Attacks Imperil Evacuation Efforts in Ukraine,https://www.nytimes.com/live/2022/03/06/world/ukraine-russia,"At least three people trying to get to safety were killed in shelling outside Kyiv, and an evacuation from the besieged port city of Mariupol was called off for the second straight day. Police in Russia take 3,000 people into custody as protests against the invasion expand across the nation."
Ukrainians Find That Relatives in Russia Don’t Believe It’s a War,https://www.nytimes.com/2022/03/06/world/europe/ukraine-russia-families.html,Many Ukrainians are encountering a confounding and frustrating backlash from family members in Russia who have bought into the official Kremlin messaging.
‘Falling Into Emptiness’: Ukrainian Families Feel the Pain of Separation,https://www.nytimes.com/2022/03/06/world/europe/ukraine-poland-families-separation.html,"With most Ukrainian men legally prohibited from leaving Ukraine, the international border gates serve as a painful filter, splitting families as women and children move on."
"On Ukraine’s Border, Moldovans Wonder: Where Will Putin Stop?",https://www.nytimes.com/2022/03/06/world/europe/ukraine-russia-moldova-transnistria.html,"Moldovans fear that Transnistria, a region run by Russia-backed separatists in eastern Moldova, might be the next target after Ukraine."
"In Burundi, the Drum Is a Revered Symbol of Unity. But Only Men Can Play.",https://www.nytimes.com/2022/03/06/world/africa/burundi-drumming.html,"Burundian drumming is a global phenomenon, featured in blockbuster movies and best-selling albums. But at home, authorities have restricted it to official functions — and banned women from performing."
How the West Marshaled a Stunning Show of Unity Against Russia,https://www.nytimes.com/2022/03/05/world/europe/russia-ukraine-invasion-sanctions.html,"In a few frantic days, the West threw out the playbook it used for decades against the Kremlin and isolated Russia with unparalleled sanctions and penalties."
A Welcome Steeped in History: Ukrainian Refugees Arrive in Germany,https://www.nytimes.com/2022/03/05/world/europe/ukraine-refugees-germany.html,"Berlin has become a major hub for refugees from Ukraine, welcoming them with an outpouring of help. The response stirs memories of both bright and dark chapters of German history."
China Outlines Plan to Stabilize Economy in Crucial Year for Xi,https://www.nytimes.com/2022/03/04/world/asia/china-economy-congress.html,"China calls for heavy government spending and lending, as its leaders seek to project confidence in the face of global uncertainty over the pandemic and war in Ukraine."
Build a New City or New Humans? A Utopia in India Fights Over Future.,https://www.nytimes.com/2022/03/05/world/asia/auroville-india.html,"Backed by Prime Minister Narendra Modi, the new leadership of Auroville, an experimental commune, wants to create a model city. In the way stand trees, tree houses and a take-it-slow tradition."
"In Ukraine’s West, Lviv Makes Itself a Vital Rear Base",https://www.nytimes.com/2022/03/05/world/europe/lviv-ukraine-war-russia.html,"Spared direct attacks so far, the city has become a transit point for thousands of fleeing refugees and for men and supplies headed to the front lines."
What Cities Is Russia Targeting in Ukraine?,https://www.nytimes.com/article/ukraine-cities.html,About two-thirds of Ukraine’s population of 44 million people lived in cities before Russia’s invasion began. Now many urban areas are in the cross hairs of war.
"In a surrounded Ukrainian city, residents vow to fight to the end.",https://www.nytimes.com/live/2022/03/04/world/russia-ukraine/in-a-surrounded-ukrainian-city-residents-vow-to-fight-to-the-end,"Wearing flak jackets and toting Kalashnikovs, many people in Mykolaiv say they are bracing to fight the advancing Russians."
Ukraine War Forces a Question: How Far East Does Europe Go?,https://www.nytimes.com/2022/03/04/world/europe/ukraine-eu-moldova-georgia.html,"After Russia invaded, Ukraine asked to join the European Union, quickly. Moldova and Georgia have asked, too. Member states would rather not answer."
An Italian Princess From Texas Awaits Her Next Act,https://www.nytimes.com/2022/03/04/world/europe/italy-princess-rita-boncompagni-ludovisi-jenrette.html,"Princess Rita Boncompagni Ludovisi, formerly Rita Jenrette, is locked in a battle over the estate of her late husband, a Roman prince."
"Pressed on Putin, Russian Conductor Quits Bolshoi and French Post",https://www.nytimes.com/2022/03/06/arts/music/tugan-sokhiev-russia-ukraine-putin.html,"Tugan Sokhiev, the Bolshoi’s music director, said he was “being asked to choose one cultural tradition” over another, at a moment Russian artists are under pressure to denounce Russia’s president."
"Rubio, U.S. Lawmakers Are Largely Opposed to No-Fly Zone Over Ukraine",https://www.nytimes.com/2022/03/06/us/politics/no-fly-zone-ukraine-congress.html,"Members of both parties said such a move would risk drawing the United States into a conflict with Russia, another nuclear power."
"Police Arrest More Than 3,000 People As Protests Grow Across Russia",https://www.nytimes.com/2022/03/06/world/europe/police-russia-protests.html,An activist group that tracks protests found demonstrations in nearly 50 cities on Sunday.
"South Korea reports high turnout in early voting, but apologizes to coronavirus patients for a lack of preparation.",https://www.nytimes.com/2022/03/06/world/asia/south-korea-early-voting-covid.html,"South Korea is experiencing a sharp spike in coronavirus cases, its worst wave of the pandemic, but is allowing infected voters to cast a ballot in the country’s contentious presidential election."
What We Know About Brittney Griner’s Detention in Russia,https://www.nytimes.com/article/brittney-griner-russia.html,The W.N.B.A. star was stopped at an airport outside Moscow and accused of carrying hashish oil in her luggage. But much about the case remains unclear.
In photos: Evacuation comes under fire near Kyiv.,https://www.nytimes.com/2022/03/06/world/europe/in-photos-evacuation-comes-under-fire-near-kyiv.html,
U.S. Is Exploring How to Send Soviet-Era Fighter Jets to Ukraine,https://www.nytimes.com/2022/03/06/world/europe/us-fighter-jets-ukraine.html,The discussions follow President Volodymyr Zelensky’s impassioned plea to American legislators for assistance in obtaining more lethal military aid.
At Least 3 Civilians Killed in Shelling by Russian Forces Near Kyiv,https://www.nytimes.com/2022/03/06/world/europe/ukraine-irpin-civilian-death.html,"The attack in Irpin, west of the capital, suggested either direct targeting of evacuees or disregard for the risk of civilian casualties."
Policing Is Under Scrutiny as Murders Rise in the U.S.,https://www.nytimes.com/2022/03/06/briefing/crime-solutions-ukraine-war-books.html,"Murders have spiked in the U.S., and experts say a mix of solutions works best."
"What Is a No-Fly Zone, and Why Is It So Contentious?",https://www.nytimes.com/2022/03/05/world/europe/what-is-no-fly-zone-nato.html,"Enforcing a ban on aircraft could draw more countries into conflict against Russia and set off “a full-fledged war in Europe,” NATO’s leader has warned."
Here is the latest news about Russia’s invasion of Ukraine.,https://www.nytimes.com/2022/03/05/world/europe/catch-up-on-the-latest-news-about-russias-invasion-of-ukraine.html,
"Mexico Soccer Riot Leaves 22 Injured, Querétaro Officials Say",https://www.nytimes.com/2022/03/05/world/americas/mexico-soccer-riot.html,Videos posted on social media showed violent clashes between fans in a stadium in the central city of Querétaro on Saturday.
Russian Prisoners and Ukrainian Soldiers Describe Two Sides of the Conflict,https://www.nytimes.com/2022/03/05/world/europe/ukraine-russia-soldiers-war.html,"The accounts painted a picture of a conflict consisting largely of ambushes, at least in northern Ukraine where the Russian forces are striving to encircle and capture the capital, Kyiv."
Mastercard and Visa Suspend Operations in Russia,https://www.nytimes.com/2022/03/05/world/europe/mastercard-visa-suspend-operations-russia.html,"Russian-issued cards will no longer work in other countries, and purchases from Russian vendors by cardholders in other countries will be cut off."
"US Officials Travel to Venezuela, a Russia Ally, as the West Isolates Putin",https://www.nytimes.com/2022/03/05/world/americas/venezuela-russia-usa.html,"The trip is the highest-level visit by American officials to Caracas in years, driven by a desire to separate Russia from its remaining Latin American allies."
"Fast-Food Chains Stay Open in Russia, Mostly Quiet About Ukraine",https://www.nytimes.com/2022/03/05/world/europe/russia-food-ukraine.html,Many fast-food chains are facing growing pressure on social media platforms and from large investors to halt operations in Russia.
Does Part of Putin's Wartime Mindset Reflect Pandemic Isolation?,https://www.nytimes.com/2022/03/05/world/putin-pandemic-mindset.html,"Analysts are debating whether the Russian leader’s ambitions and appetite for risk have been altered by his long-held Covid bubble, or by his urgency to secure a legacy, or both."
Israel PM Naftali Bennett Visits Moscow for Putin Talks on Ukraine,https://www.nytimes.com/2022/03/05/world/europe/israel-russia-ukraine.html,"Prime Minister Naftali Bennett of Israel met for three hours with President Vladimir V. Putin of Russia, the Israeli leader’s office said."
Putin Likens Sanctions to a ‘Declaration of War’,https://www.nytimes.com/2022/03/05/world/europe/ukraine-russia-putin.html,"Despite a cease-fire, Russia shelled near humanitarian corridors meant for civilians to escape an embattled city, Ukraine says, while the Russian leader also warned about a no-fly zone."
"Pakistan Identifies Peshawar Suicide Bomber and Network, Police Say",https://www.nytimes.com/2022/03/05/world/middleeast/pakistan-peshawar-suicide-bomber.html,"The attack at a Shiite mosque, claimed by an ISIS affiliate, killed at least 63 people and left nearly 200 wounded."
Ukrainian Protesters Take to the Streets in Occupied Kherson,https://www.nytimes.com/2022/03/05/world/europe/kherson-protests-ukraine.html,Kherson was the first major city to fall to Russian forces and the protests are presenting a challenge to the new authority.
Allies Focus on Security of Zelensky and Other Ukraine Leaders,https://www.nytimes.com/2022/03/05/us/politics/russia-ukraine-succession-zelensky.html,Concerns about the line of succession were prompted in part because President Volodymyr Zelensky insists he will not be evacuated.
"Aeroflot, Russia's State Airline, Says it Will Suspend International Flights",https://www.nytimes.com/2022/03/05/world/europe/aeroflot-russia-international-flights-suspended.html,Russia’s airline industry has been hit hard as countries around the world have imposed sanctions on the country for its invasion of Ukraine.
Here are the latest developments in the Russian invasion of Ukraine.,https://www.nytimes.com/2022/03/05/world/europe/catch-up-on-the-latest-news-in-ukraine.html,
True Stories,https://www.nytimes.com/2022/03/05/briefing/tv-shows-fashion-week-oscar-ballots.html,Why are so many drama series based on real-life events?
"While Canada Welcomes Refugees, Its Door Is Far From Wide Open",https://www.nytimes.com/2022/03/05/world/canada/canada-refugees-ukraine.html,"The war in Ukraine may bring another wave of asylum seekers to Canada, but they will face many controls and restrictions."
TikTok Ukraine War Videos Raise Questions About Spread of Misinformation,https://www.nytimes.com/2022/03/05/technology/tiktok-ukraine-misinformation.html,The Chinese-owned video app is dealing with a flood of war videos and the question of whether it is spreading unverified information.
The Best Time to Use Your Airline Points and Miles,https://www.nytimes.com/2022/03/05/travel/airline-miles-credit-card.html,"If you’re thinking of traveling and you’ve got points or miles sitting in airline and credit card accounts, the time to cash in may have arrived. Here’s what you need to know."
"Too Close to Putin? Institutions Vet Artists, Uncomfortably.",https://www.nytimes.com/2022/03/05/arts/music/russian-artists-putin.html,"Russia’s invasion of Ukraine has led arts organizations to reconsider who performs, forcing them to confront questions about free speech and policing political views."
