title,link,description
Gov. Murphy Ends Virus Briefings in New Jersey and Tries to Turn Page,https://www.nytimes.com/2022/03/05/world/nj-governor-murphy-covid-briefing.html,"Friday’s briefing was two years to the day since the state’s first confirmed coronavirus case, the governor said, and served as a fitting end to his pandemic updates."
"Finland, Non-NATO and Nervous, Discusses Defense With Biden",https://www.nytimes.com/2022/03/04/us/politics/biden-sauli-niinisto-finland.html,"“We usually don’t start wars,” President Sauli Niinisto of Finland said as the leaders spoke amid the war in Ukraine."
"North Korea Launches Ballistic Missile, South Korea Says",https://www.nytimes.com/2022/03/04/world/asia/north-korea-missile-launch.html,The launch is North Korea’s second missile test in a week and comes only days before the presidential election in South Korea.
Zelensky Criticizes NATO Over Its Rejection of a No-fly Zone Over Ukraine,https://www.nytimes.com/2022/03/04/world/europe/zelensky-nato-no-fly-zone-ukraine.html,"“All the people who will die from this day will die because of you, as well,” the Ukrainian president told NATO leaders in a video shared on social media."
Russia Seizes Nuclear Plant in Ukraine and Makes Gain in the South,https://www.nytimes.com/2022/03/04/world/europe/russia-military-advance-ukraine-war.html,"The Russian military advance in Ukraine sowed more destruction and chaos, pointing to a worsening conflict, as the Kremlin also moved to restrict how it’s reported at home."
A.C.L.U. Lawsuit Accuses ICE Jailers of Denying Detainees Vaccines,https://www.nytimes.com/2022/03/04/world/aclu-ice-covid-vaccine-booster.html,"One of the plaintiffs is Anna Sorokin, a Russian immigrant who for several years presented herself as a German heiress named Anna Delvey. She received a booster shot on Thursday, two days after the suit was filed."
"In Kyiv’s Railway Station, Rumors, Near-Stampedes and Frustration",https://www.nytimes.com/2022/03/04/world/europe/ukraine-kyiv-train-station.html,"As Russian forces begin to encircle the Ukrainian capital, tens of thousands are clambering for a way out that may soon be closed off."
FDA Rejects India-Made Bharat Biotech Vaccine For Those Under 18,https://www.nytimes.com/2022/03/04/world/fda-bharat-biotech-vaccine.html,"The vaccine, made by Bharat Biotech, is widely used in India. It has not been tested in the U.S., which has not authorized it for any age groups."
"As Russia Pounds Ukraine, NATO Countries Rush In Javelins and Stingers",https://www.nytimes.com/2022/03/04/us/politics/russia-ukraine-weapons.html,The American weapons are part of a $350 million package that President Biden authorized on Saturday.
Anti-Covid-Vaccine Doctor Pleads Guilty to Capitol Riot Charges,https://www.nytimes.com/2022/03/04/world/simone-gold-capitol-riot.html,"The founder of America’s Frontline Doctors, a group that spreads pandemic misinformation, stood by as a Capitol Police officer was assaulted, then entered the Capitol and made a speech against Covid vaccines, according to a Justice Department filing."
NATO Accuses Russia of Using Cluster Bombs in Ukraine,https://www.nytimes.com/2022/03/04/world/europe/nato-ukraine-russia-cluster-bombs.html,"Officials made the accusation Friday as part of a display of a unified front in support of Ukraine, but rejected a plea from Kyiv to impose a no-fly zone over its airspace."
"Russia Blocks Facebook, as Kremlin Moves to Stifle Dissent",https://www.nytimes.com/2022/03/04/world/europe/russia-facebook-ukraine.html,
The War in Ukraine Holds a Warning for the World Order,https://www.nytimes.com/2022/03/04/world/ukraine-russia-war-authoritarianism.html,The multinational response shows that liberalism has some life left. But the challenges posed by waning U.S. power and rising authoritarianism remain formidable.
"With Sanctions, U.S. and Europe Aim to Punish Putin and Fuel Russian Unrest",https://www.nytimes.com/2022/03/04/us/politics/russia-sanctions-ukraine.html,The Biden administration and European officials are crushing the Russian economy and stirring mass anxiety to pressure President Vladimir V. Putin to end his war in Ukraine.
An appeals ruling bars the U.S. from expelling any endangered migrant families on public health grounds.,https://www.nytimes.com/2022/03/05/world/an-appeals-ruling-bars-the-us-from-expelling-any-endangered-migrant-families-on-public-health-grounds.html,
BBC Suspends Operations in Russia After Censorship Law Is Passed,https://www.nytimes.com/2022/03/04/world/europe/bbc-russia-ukraine.html,
‘We Have No Choice’: Mothers in Ukraine Flee to Poland,https://www.nytimes.com/video/world/europe/100000008238170/ukraine-women-children-train.html,"At a station in Western Ukraine, mothers and their children boarded evacuation trains to Poland, while many of their husbands stayed to defend the country from advancing Russian forces."
