title,link,description
"Ukraine: Russia has attacked schools and hospitals, says deputy PM",https://www.bbc.co.uk/news/world-europe-60638042?at_medium=RSS&at_campaign=KARANGA,"Meanwhile, the UN says more than 1.5m people have now fled Ukraine since Russia invaded on 24 February."
"Ukraine war: Residents run from Russian shelling in Irpin, near Kyiv",https://www.bbc.co.uk/news/world-europe-60637845?at_medium=RSS&at_campaign=KARANGA,"People are seen dropping to the ground as the town, just outside Kyiv, is attacked again."
Protests across Russia see thousands detained,https://www.bbc.co.uk/news/world-europe-60640204?at_medium=RSS&at_campaign=KARANGA,"People have been held in 53 cities, from St Petersburg in the west to Vladivostok in the east."
Shell defends 'difficult' decision to buy Russian crude oil,https://www.bbc.co.uk/news/business-60638255?at_medium=RSS&at_campaign=KARANGA,"The oil giant confirmed it made a purchase of Russian crude oil on Friday but said it had ""no alternative""."
War in Ukraine: Russian invasion fuels Finnish support for Nato,https://www.bbc.co.uk/news/world-europe-60626536?at_medium=RSS&at_campaign=KARANGA,President Putin's devastating attack on Ukraine leaves countries in the region worried about their future.
War in Ukraine: Zelensky urges Ukrainians to go on the offensive,https://www.bbc.co.uk/news/world-europe-60636337?at_medium=RSS&at_campaign=KARANGA,"In a rallying cry, the Ukrainian president says the country has withstood the invasion ""together""."
War in Ukraine: Thousands march in Kherson against occupiers,https://www.bbc.co.uk/news/world-europe-60632587?at_medium=RSS&at_campaign=KARANGA,The Black Sea port is Ukraine's only big city to have been captured by Russia in the war so far.
Queretaro v Atlas: At least 22 injured as fans fight at Mexican match,https://www.bbc.co.uk/sport/football/60637196?at_medium=RSS&at_campaign=KARANGA,At least 22 people are injured as violence breaks out among the crowd at a top-flight match in Mexico.
Putin says sanctions over Ukraine are like a declaration of war,https://www.bbc.co.uk/news/world-europe-60633482?at_medium=RSS&at_campaign=KARANGA,The Russian president also warned against any attempt to impose a no-fly zone over Ukraine.
Ukraine invasion: Residents under siege in Mariupol clear out shopping mall,https://www.bbc.co.uk/news/world-europe-60634735?at_medium=RSS&at_campaign=KARANGA,"Local officials say residents are in dire need of food, water and medicine due to Russia's blockade."
War in Ukraine: Citizens evacuate town of Irpin as homes are destroyed,https://www.bbc.co.uk/news/world-europe-60632974?at_medium=RSS&at_campaign=KARANGA,Crowds are leaving the town of Irpin outside Kyiv as Russian shelling strikes residential areas.
Why Indian fathers are embracing paternity leave,https://www.bbc.co.uk/news/world-asia-india-60491095?at_medium=RSS&at_campaign=KARANGA,The pandemic and changing family structures have highlighted how young parents are struggling with childcare.
BBC Ukrainian editor: 'My mother called to say she'd managed to buy bread',https://www.bbc.co.uk/news/world-europe-60633888?at_medium=RSS&at_campaign=KARANGA,"In the second week of war, the BBC's Ukrainian editor says empty shelves are an increasing reality."
"From Grozny to Aleppo to Ukraine, Russia meets resistance with more firepower",https://www.bbc.co.uk/news/world-europe-60631433?at_medium=RSS&at_campaign=KARANGA,"Russia answers resistance with big guns and sieges. Ukrainians pray that will not happen to them, writes the BBC's Jeremy Bowen in Kyiv."
The young Ukrainians battling pro-Russian trolls,https://www.bbc.co.uk/news/blogs-trending-60596133?at_medium=RSS&at_campaign=KARANGA,Conspiracy theories and trolls are adding to the chaos of war.
European peace seems as fragile as ever,https://www.bbc.co.uk/news/world-60622772?at_medium=RSS&at_campaign=KARANGA,"The shifting of European history's tectonic plates is not really that unexpected, explains Kevin Connolly."
Why doesn't Ukraine attack the Russian convoy? And other questions,https://www.bbc.co.uk/news/world-60617145?at_medium=RSS&at_campaign=KARANGA,Correspondents and experts answer questions from readers on the BBC News website
Russia oligarchs: The mega-rich men facing global sanctions,https://www.bbc.co.uk/news/uk-60593022?at_medium=RSS&at_campaign=KARANGA,President Putin has for years warned Russia's richest to protect themselves against sanctions.
"Ukraine war: Don't be afraid of Putin, Kyiv residents say",https://www.bbc.co.uk/news/world-europe-60637840?at_medium=RSS&at_campaign=KARANGA,This couple in Kyiv tells the BBC they are confident that Ukraine will survive Russia's invasion.
War in Ukraine: Russian helicopter shot down by missile,https://www.bbc.co.uk/news/world-europe-60630352?at_medium=RSS&at_campaign=KARANGA,"The video, shared by Ukrainian armed forces, shows the helicopter being hit by a missile."
Ukraine war: President Zelensky invites Elon Musk to visit,https://www.bbc.co.uk/news/world-europe-60637841?at_medium=RSS&at_campaign=KARANGA,Ukraine's president was thanking the tech entrepreneur for supplying Starlink equipment to the country.
War in Ukraine: Thousands of pro-Russia Serbs march in Belgrade,https://www.bbc.co.uk/news/world-europe-60630351?at_medium=RSS&at_campaign=KARANGA,"Flags and flares are paraded through the Serbian capital, as marchers show support for Moscow."
Ukraine: Russians still bombing Mariupol despite ceasefire - deputy mayor,https://www.bbc.co.uk/news/world-europe-60630182?at_medium=RSS&at_campaign=KARANGA,Serhiy Orlov tells the BBC that attacks are still happening despite a ceasefire being agreed.
Culture rallies for Ukraine in Berlin,https://www.dw.com/en/culture-rallies-for-ukraine-in-berlin/a-61034478?maca=en-rss-en-all-1573-rdf,"A ""Concert for Peace"" headed by star conductor Daniel Barenboim, and a later rally by literary luminaries at the site of the Nazi book burnings, bookended a day of solidarity with Ukraine."
Ukraine: Second attempt to evacuate civilians from Mariupol fails — live updates,https://www.dw.com/en/ukraine-second-attempt-to-evacuate-civilians-from-mariupol-fails-live-updates/a-61030032?maca=en-rss-en-all-1573-rdf,"The Red Cross says civilian safe passage from the Ukrainian city of Mariupol has been ""halted"" amid reports of Russian shelling. Meanwhile, anti-war protesters have gathered in Berlin. Follow DW for the latest."
Correspondent perspectives: Reporting on the war in Ukraine,https://www.dw.com/en/correspondent-perspectives-reporting-on-the-war-in-ukraine/a-61027532?maca=en-rss-en-all-1573-rdf,"DW's correspondents are reporting from Ukraine and the neighboring countries about the war, the refugee situation and how Europe is responding. Here's what they've experienced over the past few days."
Mexico: Dozens injured in soccer game brawl,https://www.dw.com/en/mexico-dozens-injured-in-soccer-game-brawl/a-61031520?maca=en-rss-en-all-1573-rdf,At least 22 people were injured when violence erupted during the Liga MX match between Queretaro and Atlas.
Opinion: Watching the war from the sidelines will be bitter,https://www.dw.com/en/opinion-watching-the-war-from-the-sidelines-will-be-bitter/a-61030364?maca=en-rss-en-all-1573-rdf,"The Western community sent its foreign ministers to Brussels on Friday in a show of solidarity with Ukraine. But the outlook for the struggling country is bleak, writes Barbara Wesel."
Taliban's most-wanted leader Haqqani appears in public,https://www.dw.com/en/taliban-s-most-wanted-leader-haqqani-appears-in-public/a-61030993?maca=en-rss-en-all-1573-rdf,Taliban officials released images of Sirajuddin Haqqani for the first time as he made a rare public appearance in Kabul. Haqqani has long been wanted by the US over a string of terror attacks.
What are humanitarian corridors?,https://www.dw.com/en/what-are-humanitarian-corridors/a-61030061?maca=en-rss-en-all-1573-rdf,They are set up to avert humanitarian catastrophes and provide relief for civilians. But they also can be abused. How can humanitarian corridors help and how can they harm?
Moldova shows solidarity with Ukrainian refugees,https://www.dw.com/en/moldova-shows-solidarity-with-ukrainian-refugees/a-61029418?maca=en-rss-en-all-1573-rdf,"One of the poorest countries in Europe has taken in tens of thousands of Ukrainian refugees. That support, and fear of further Russian aggression, have brought the tiny southeast European nation international attention."
Israel's Naftali Bennett informs Berlin after meeting with Vladimir Putin,https://www.dw.com/en/israel-s-naftali-bennett-informs-berlin-after-meeting-with-vladimir-putin/a-61030728?maca=en-rss-en-all-1573-rdf,Israeli Prime Minister Naftali Bennett has been the latest world leader to visit Moscow to speak with President Vladimir Putin about the war in Ukraine. Some see Bennett as a potential mediator between Moscow and Kyiv.
Germany to accept refugees from Ukraine regardless of nationality,https://www.dw.com/en/germany-to-accept-refugees-from-ukraine-regardless-of-nationality/a-61030647?maca=en-rss-en-all-1573-rdf,Interior Minister Nancy Faeser has said nationality would not play a role in Germany's decision to host refugees fleeing Ukraine. More than a million people have left Ukraine for neighboring European countries.
"Iran, UN nuclear watchdog take steps to resolve key issues",https://www.dw.com/en/iran-un-nuclear-watchdog-take-steps-to-resolve-key-issues/a-61029606?maca=en-rss-en-all-1573-rdf,Iranian officials and the head of the International Atomic Energy Agency Rafael Grossi have laid out a timeline in Tehran to resolve differences that hinder the revival of the 2015 nuclear deal.
Ukraine-Russia war forces EU refugee policy reversal,https://www.dw.com/en/ukraine-russia-war-forces-eu-refugee-policy-reversal/a-61028152?maca=en-rss-en-all-1573-rdf,"The European Union wants to take in millions of refugees from Ukraine, in a move that could inadvertently shift the decades-old fight over asylum and migration policy. Bernd Riegert reports from Brussels."
Ukraine: US top diplomat visits Poland amid refugee crisis,https://www.dw.com/en/ukraine-us-top-diplomat-visits-poland-amid-refugee-crisis/a-61028240?maca=en-rss-en-all-1573-rdf,"US Secretary of State Antony Blinken has praised Poland for its ""vital work"" in responding to a migration crisis triggered by Russia's invasion of Ukraine."
Russia detains US basketball player Brittney Griner on drug charges — reports,https://www.dw.com/en/russia-detains-us-basketball-player-brittney-griner-on-drug-charges-reports/a-61028790?maca=en-rss-en-all-1573-rdf,Phoenix Mercury center Brittney Griner was detained at Moscow Sheremetyevo airport after officials reportedly found hashish oil in her luggage. The move comes as US-Russian diplomatic tensions increase over Ukraine.
Ukraine: Russia shells Mariupol as cease-fire attempts stall — as it happened,https://www.dw.com/en/ukraine-russia-shells-mariupol-as-cease-fire-attempts-stall-as-it-happened/a-61023653?maca=en-rss-en-all-1573-rdf,"A cease-fire attempt in two Ukrainian cities has collapsed, with Russia pushing forward with its military offensive. Meanwhile, Americans are being urged to leave Russia immediately."
German Eurovision preliminary marked by war in Ukraine,https://www.dw.com/en/german-eurovision-preliminary-marked-by-war-in-ukraine/a-61027014?maca=en-rss-en-all-1573-rdf,"Malik Harris will represent Germany at the Eurovision Song Contest in Turin, Italy in May. Six acts took part in the broadcast, which included a particularly compelling guest performance by Ukrainian singer Jamala."
Ukrainian fencer Olena Kryvytska: 'I hope to wake up without war',https://www.dw.com/en/ukrainian-fencer-olena-kryvytska-i-hope-to-wake-up-without-war/a-61027359?maca=en-rss-en-all-1573-rdf,"As war rages in Ukraine, hundreds of thousands have fled their homeland while others have stayed behind. Among them is Ukrainian fencer Olena Kryvytska, who has demanded that Russian athletes speak out against the war."
"F1: Haas ditch Mazepin and Uralkali, Russian drivers must sign FIA document",https://www.dw.com/en/f1-haas-ditch-mazepin-and-uralkali-russian-drivers-must-sign-fia-document/a-61015656?maca=en-rss-en-all-1573-rdf,"Formula One team Haas has parted company with driver Nikita Mazepin and sponsor Uralkali in the wake of Russia's invasion of Ukraine. Meanwhile, other Russian drivers will have to sign a Driver Commitment document."
How vital is nuclear energy for Ukraine?,https://www.dw.com/en/how-vital-is-nuclear-energy-for-ukraine/a-61023368?maca=en-rss-en-all-1573-rdf,"When it was attacked by Russian forces, Ukraine's Zaporizhzhia nuclear power plant shifted to center stage. But while nuclear energy is important to Ukraine, the country still gets 70% of its power from fossil fuels."
"Russian, Ukrainian tourists stranded abroad amid war back home",https://www.dw.com/en/russian-ukrainian-tourists-stranded-abroad-amid-war-back-home/a-61021285?maca=en-rss-en-all-1573-rdf,"What was supposed to be a vacation in the Dominican Republic, Turkey or Egypt has turned into a nightmare for thousands of Russians and Ukrainians. Many Russian travelers are increasingly struggling with payment issues."
Will war fast-track the energy transition?,https://www.dw.com/en/will-war-fast-track-the-energy-transition/a-61021440?maca=en-rss-en-all-1573-rdf,The sudden push to reduce Europe's dependence on Russian gas and oil could trigger a paradigm shift to clean energy sources that might be quickly scaled up.
Radiation: Does iodine help?,https://www.dw.com/en/radiation-does-iodine-help/a-61020889?maca=en-rss-en-all-1573-rdf,"Fears have grown about radiation exposure since Russia's attack on a Ukrainian nuclear facility. But taking iodine won't always help. It can, in fact, be dangerous."
Russia sanctions threaten Vladimir Putin's allies in Latin America,https://www.dw.com/en/russia-sanctions-threaten-vladimir-putin-s-allies-in-latin-america/a-61021136?maca=en-rss-en-all-1573-rdf,"The effects of the sanctions on Russia's banking system will likely affect Venezuela, Nicaragua and Cuba. Energy, military and agricultural sectors could suffer the most."
Europe looks to Africa to fill natural gas gap,https://www.dw.com/en/europe-looks-to-africa-to-fill-natural-gas-gap/a-61017873?maca=en-rss-en-all-1573-rdf,"To move away from depending on Russian energy, Europe is increasingly turning to Africa for its natural gas imports. Though the potential is there, low supply and serious bottlenecks stand in the way."
Winter Paralympic Games open in Beijing with calls for peace in Ukraine,https://www.dw.com/en/winter-paralympic-games-open-in-beijing-with-calls-for-peace-in-ukraine/a-61018531?maca=en-rss-en-all-1573-rdf,The tournament starts amidst the Russian war on Ukraine that has led to the expulsion of its athletes. The Chinese government has refused to criticize Russia as it welcomed more than five hundred athletes for the Games.
Ukraine: Germany's Scholz urges Putin to end hostilities,https://www.dw.com/en/ukraine-germany-s-scholz-urges-putin-to-end-hostilities/a-61018687?maca=en-rss-en-all-1573-rdf,"During a one-hour conversation, the German chancellor called on Russia's president to immediately halt military action in Ukraine. Putin said Russia was ""open"" to talks with Kyiv if all his demands were met."
Tesla's Germany plant almost ready to roll with final permit granted,https://www.dw.com/en/tesla-s-germany-plant-almost-ready-to-roll-with-final-permit-granted/a-60006610?maca=en-rss-en-all-1573-rdf,US carmaker Tesla's fourth Gigafactory has received a long-awaited final permit from regional German authorities. But full-scale production has to start later due to the strings attached.
From COVID to the Ukraine war: Berlin clubs reopen amid new concerns,https://www.dw.com/en/from-covid-to-the-ukraine-war-berlin-clubs-reopen-amid-new-concerns/a-61016271?maca=en-rss-en-all-1573-rdf,Clubs in Germany reopen after COVID restrictions brought them to a standstill for months. But the return of nightlife is overshadowed by the war in Ukraine. A look at the scene in Berlin.
What’s your clothing style?,https://www.dw.com/en/what-s-your-clothing-style/a-60997146?maca=en-rss-en-all-1573-rdf,"The way we dress says a lot about our personalities. Some like it comfy, others love to be dressed elegantly and for some, tradition plays an important role when deciding on what clothes to wear. What’s your style?"
Ukraine's little-known space feats,https://www.dw.com/en/ukraine-s-little-known-space-feats/a-61005697?maca=en-rss-en-all-1573-rdf,"The war in Ukraine threatens space development — and not only due to sanctions on Russia. Ukraine plays a little-known, but crucial, role in the world's space scene."
Ukraine: How to protect yourself against cyberattacks,https://www.dw.com/en/ukraine-how-to-protect-yourself-against-cyberattacks/a-61012231?maca=en-rss-en-all-1573-rdf,"Cyberattacks are an emerging weapon of choice in the ongoing Russia-Ukraine war and could have spillover effects across the world. Though difficult to predict, they can be managed with proper preparation."
From COVID to Ukraine: How do I explain it to my kids?,https://www.dw.com/en/from-covid-to-ukraine-how-do-i-explain-it-to-my-kids/a-61005115?maca=en-rss-en-all-1573-rdf,COVID is far from over and already there's a new crisis: War in Ukraine. That's on top of the climate crisis. What do we tell the kids? Here are some tips.
Author Nora Bossong on Germany's new generation of politicians,https://www.dw.com/en/author-nora-bossong-on-germany-s-new-generation-of-politicians/a-61010268?maca=en-rss-en-all-1573-rdf,"The author's latest book explores the ""smooth"" generation — people who are now around 40. Among them are Germany's new young politicians: How are they dealing with the war in Ukraine?"
Germans approve of government U-turn on Ukraine,https://www.dw.com/en/germans-approve-of-government-u-turn-on-ukraine/a-61011528?maca=en-rss-en-all-1573-rdf,Russia's invasion of Ukraine has led to an about-face in German foreign and security policy. A recent opinion poll shows most Germans think this is the right thing to do.
Ukraine: The risks of war in a nuclear state,https://www.dw.com/en/ukraine-the-risks-of-war-in-a-nuclear-state/a-60963926?maca=en-rss-en-all-1573-rdf,The fear that Russia's invasion of Ukraine could escalate to a nuclear war is real. But what happens now that its largest active nuclear power plant has been caught in the crossfire?
"RECOMMENDED — Since its invasion of Ukraine, Russia has been hit by a wave of crippling financial sanctions. Could cryptocurrencies offer an escape?",https://www.dw.com/en/recommended-since-its-invasion-of-ukraine-russia-has-been-hit-by-a-wave-of-crippling-financial-sanctions-could-cryptocurrencies-offer-an-escape/a-61008735?maca=en-rss-en-all-1573-rdf,"Since a wave of financial sanctions hit Russia over its Ukraine invasion, questions have been raised over whether cryptocurrencies could provide an escape route. But leading exchanges said they will comply with the law."
Olaf Scholz says ex-Chancellor Gerhard Schröder should resign from Russian firms,https://www.dw.com/en/olaf-scholz-says-ex-chancellor-gerhard-schröder-should-resign-from-russian-firms/a-61007011?maca=en-rss-en-all-1573-rdf,German Chancellor Olaf Scholz said former Chancellor Gerhard Schröder ought to resign from Russian companies. The former chancellor is a longtime associate of Russian leader Vladimir Putin.
Does Germany really need LNG terminals?,https://www.dw.com/en/does-germany-really-need-lng-terminals/a-61005220?maca=en-rss-en-all-1573-rdf,"The German government now aims to build liquefied natural gas terminals to become less dependent on Russian gas. But are they really a sound investment, given the need for climate-friendly energy?"
"Ukraine: Cyberwar creates chaos, 'it won't win the war'",https://www.dw.com/en/ukraine-cyberwar-creates-chaos-it-won-t-win-the-war/a-60999197?maca=en-rss-en-all-1573-rdf,"There have been at least 150 cyberattacks in Ukraine since Russia's invasion. Their effect is mainly psychological, and experts say they won't decide the war."
Are bans against Russian arts targeting the right people?,https://www.dw.com/en/are-bans-against-russian-arts-targeting-the-right-people/a-61001207?maca=en-rss-en-all-1573-rdf,"Across Europe, Russian artists, musicians and filmmakers are being excluded from events and competitions. But how far should the boycott go?"
Opinion: Turning the tide on plastic pollution,https://www.dw.com/en/opinion-turning-the-tide-on-plastic-pollution/a-60996886?maca=en-rss-en-all-1573-rdf,"Plastic pollution is pushing our health and ecosystems to the brink of disaster, but the global agreement to tackle the issue offers hope, writes Christina Dixon of Environmental Investigation Agency."
Beethoven and a peace speech get Russian conductor suspended,https://www.dw.com/en/beethoven-and-a-peace-speech-get-russian-conductor-suspended/a-60996710?maca=en-rss-en-all-1573-rdf,"A day after the start of the invasion of Ukraine, Ivan Velikanov stood up for peace on stage in the Russian city of Nizhny Novgorod. That resulted in immediate consequences for the star conductor."
Germany's army: Will €100 billion make it strong?,https://www.dw.com/en/germany-s-army-will-€100-billion-make-it-strong/a-60996891?maca=en-rss-en-all-1573-rdf,"Following the Russian attack on Ukraine, Germany has decided to dramatically beef up its defense budget and give the Bundeswehr an extra €100 billion. What will it use the money for?"
What are the COVID entry rules for travelers to European countries?,https://www.dw.com/en/what-are-the-covid-entry-rules-for-travelers-to-european-countries/a-58017284?maca=en-rss-en-all-1573-rdf,Anyone traveling to Europe must expect restrictions. But some countries are making it easier to enter — despite ongoing high infection numbers. DW Travel has compiled this overview of EU rules.
Paralympics: Russian and Belarusian athletes banned after U-turn,https://www.dw.com/en/paralympics-russian-and-belarusian-athletes-banned-after-u-turn/a-60996260?maca=en-rss-en-all-1573-rdf,"There will be no athletes from Russia or Belarus at the 2022 Paralympic Games in Beijing after all. Less than 24 hours after the organizing body said the athletes could compete as neutrals, the decision was reversed."
Sanctions on Russia: Death by a thousand cuts,https://www.dw.com/en/sanctions-on-russia-death-by-a-thousand-cuts/a-60992232?maca=en-rss-en-all-1573-rdf,"Western sanctions imposed on Russia as a reaction to its invasion of Ukraine are beginning to bite. Everybody is likely to be affected, but some economic sectors will be hit harder than others."
Roman Abramovich puts Chelsea up for sale as Russian money trail in sport draws attention,https://www.dw.com/en/roman-abramovich-puts-chelsea-up-for-sale-as-russian-money-trail-in-sport-draws-attention/a-60961988?maca=en-rss-en-all-1573-rdf,"Roman Abramovich has put Premier League club Chelsea up for sale as the spotlight falls on Russian involvement in sport. With sporting bodies queuing up to distance themselves, are the days of Russian sportswashing over?"
Plastic: World agrees to tackle the crisis,https://www.dw.com/en/plastic-world-agrees-to-tackle-the-crisis/a-60951020?maca=en-rss-en-all-1573-rdf,"The petrochemical industry is pumping out polluting plastic faster than ever. The UN has made a groundbreaking pledge to try to end the ""epidemic"" of plastic pollution."
From Russia with haste: Mass exodus of companies over Ukraine invasion,https://www.dw.com/en/from-russia-with-haste-mass-exodus-of-companies-over-ukraine-invasion/a-60978353?maca=en-rss-en-all-1573-rdf,"Horror over Russia's Ukraine invasion has hardened opinion in the West, prompting a major flight of capital. Several US and European companies have suspended or ended commercial activity in the country."
How a teenager's Twitter tracks Russian oligarchs,https://www.dw.com/en/how-a-teenager-s-twitter-tracks-russian-oligarchs/a-60961086?maca=en-rss-en-all-1573-rdf,A college student who's been tracking Elon Musk's plane is now also posting the movements of Russian oligarchs on Twitter. The thing is: almost anyone can do it.
Ukraine crisis forces Germany to change course on energy,https://www.dw.com/en/ukraine-crisis-forces-germany-to-change-course-on-energy/a-60968585?maca=en-rss-en-all-1573-rdf,Germany's energy dependence on Russia is enormous. Will nuclear power plants have to operate longer and the coal phase-out have to be postponed? Some see fresh opportunities in the current crisis.
Paralympics chief Andrew Parsons: 'We understand our responsibility',https://www.dw.com/en/paralympics-chief-andrew-parsons-we-understand-our-responsibility/a-60963850?maca=en-rss-en-all-1573-rdf,FIFA banned Russia after the IOC called on sports federations to act. The International Paralympic Committee is facing tough decisions ahead of the first major global sporting event since Russia's invasion of Ukraine.
How could Russia sanctions impact you?,https://www.dw.com/en/how-could-russia-sanctions-impact-you/a-60959319?maca=en-rss-en-all-1573-rdf,Western sanctions are threatening to send the Russian economy into a tailspin. The tremors of the sanctions would be felt across the world from Africa to Europe in the form of higher inflation and food shortages.
"FIFA, UEFA suspend Russian clubs, national teams from all competitions",https://www.dw.com/en/fifa-uefa-suspend-russian-clubs-national-teams-from-all-competitions/a-60928571?maca=en-rss-en-all-1573-rdf,"FIFA and UEFA have announced that Russian clubs and national teams are suspended in all their football competitions until further notice. This comes after Poland, Sweden and Czech Republic refused to play against Russia."
